annotator_id,profile
26,"This annotator displays a unique sensitivity to linguistic nuances and wordplay, favoring phrases that evoke strong imagery or absurdity over more straightforward or conventional expressions. Their tendency to identify humor in terms such as 'volcanic_plume' and 'higgledy_piggledy' suggests an appreciation for whimsical or exaggerated concepts, alongside a penchant for witty expressions that defy typical classification. However, they exhibit a clear bias against common or mundane terminology, as seen by their consistent labeling of more straightforward words like 'bloodsport' and 'limb' as non-humorous. This indicates a desire for novelty and cleverness in humor, possibly reflecting a preference for cognitive engagement over emotional resonance in comedic content. Overall, this annotator's perspective seems deeply rooted in an inclination towards playful language and creativity, setting them apart from those who might interpret humor in a more conventional or broader context."
27,"This annotator demonstrates a unique sense of humor that often veers towards the absurd and the playful. They enjoy finding humor in unexpected places, showcasing a particular fondness for playful terms and phrases that challenge typical interpretations. Their inclination towards labeling terms associated with humor, like 'guffawing' and 'genitalia,' reflects a tendency to embrace a light-hearted, non-traditional view of humor. Conversely, they appear less amused by straightforward or serious terms, such as 'radioactive contamination' and 'neutered male,' which may suggest a preference for humor that is vibrant and whimsical rather than somber or literal. This annotator's bias leans towards appreciating pun-like humor or the inherent silliness in certain phrases. Overall, they seem to exhibit a playful disposition and an openness to humor that surprises or subverts expectations."
28,"The annotator appears to have a very low tolerance for humor, as evidenced by their consistent labeling of a variety of terms as ""not humorous."" Their selections, which include words and phrases from scientific, social, and general contexts, suggest a serious disposition towards the classification task. This annotator may favor a more analytical or literal interpretation of phrases, opting for practical and factual content over whimsical or creative expressions. Such a perspective may indicate a preference for straightforward and unembellished language, often overlooking the subtleties that could suggest humor. Overall, they seem to prioritize clarity and seriousness over the playful or ambiguous aspects of language, reflecting a personality that values structure and clarity in communication."
29,"This annotator appears to take a critical and discerning approach towards humor, likely exhibiting a tendency to favor more subtle or intellectually stimulating humor over more overt comedic expressions. Their annotations suggest a preference for instances where humor emerges from nuanced concepts, as seen in the selection of terms like 'bunker_mentality' and 'dumper_truck,' which might be considered humorous only in specific contexts or through clever associations. The annotator tends to label most examples as non-humorous, indicating a cautious standpoint that avoids labeling texts as humorous unless they exhibit clear, distinctive comedic advantages. This discernment hints at a preference for dry wit or situational humor and less inclination toward slapstick or more conventional jokes. Overall, they seem to appreciate a level of intellectual engagement when it comes to determining the humor in language."
30,"This annotator demonstrates a discerning sense of humor, characterized by a preference for subtlety and nuance rather than overt comedic elements. They seem to lean towards labeling more complex or unconventional words as humorous when there is a bit of cleverness involved, as seen with their acceptance of terms like 'dongles', 'pheromones', and 'gazpacho'. This suggests an appreciation for wordplay or perhaps absurdity in language. 
 
Conversely, they appear to reject phrases that are more straightforward or mundane, indicating a bias towards innovative or unexpected meanings in humor rather than standard definitions. 
 
Carefully navigating the waters of humor, this individual likely values intellectual humor and a playful use of language that might provoke thought or a chuckle, as opposed to standard punchlines or simplistic jokes. They may enjoy humor that challenges conventional perspectives or requires a deeper understanding, thus fostering a unique and selective approach to their labeling task."
31,"The annotator possesses a discerning sense of humor, as evidenced by their inclination to label only certain phrases as humorous. While they recognize humor, they maintain a critical stance, distinguishing less conventional or blatant humor from more subtle forms. This annotator leans towards labeling straightforward, everyday terms and phrases with a non-humorous bias, suggesting a preference for irony or unexpected bursts of humor, as illustrated by their positive labels for 'pannier' and 'mannish.' Their selections indicate a more sophisticated understanding of humor, likely appreciating nuances rather than overt comedic expressions.

The annotator's perspectives suggest a cautious and perhaps skeptical nature. They seem to favor contexts where humor arises organically, rather than from forced or fabricated punchlines. This inclination may reflect a personality that values authenticity over superficiality, leading to a unique interpretation of what constitutes humor. As a result, they may be seen as more reflective and thoughtful, demanding a stronger connection between the text's content and its humorous quality than what might be perceived by others."
32,"The annotator demonstrates a discerning and critical eye towards humor, with a strong preference for texts that align with their distinct interpretation of humorousness. They label only a few examples as humorous, suggesting a high threshold for what they consider funny or comical. This annotator tends to lean towards conventional meanings and uses of words, often requiring a more playful or whimsical context to deem something as humorous. Their selections reflect a preference for nuanced interpretations, likely indicating a thoughtful and reflective personality who values depth and complexity in humor. This annotator may possess a tendency to be serious or pragmatic, perceiving humor as an intricate mechanism rather than mere wordplay or randomness. Overall, they showcase a unique, selective approach that hints at a personality favoring substance over superficiality."
33,"This annotator demonstrates a highly critical and discerning perspective towards humor, largely marking items as non-humorous. Their choices suggest they possess a low threshold for what they consider to be funny, indicating that they may lean towards a more serious demeanor or perhaps a preference for humor that is more subtle or intellectual in nature. Out of the entire sample, only one instance was deemed humorous, showcasing a possible inclination towards literal interpretations rather than playful or puns-oriented humor. This annotator's responses can imply a rigorous analytical mind, favoring terms that align closely with conventional or straightforward meanings, and potentially reflecting a personality that may appreciate precision over ambiguity in language."
34,"This annotator has a discerning approach to humor, displaying a strong inclination towards labeling texts as non-humorous. They appear to reserve the classification of 'humorous' for only texts that meet specific, perhaps rigid, criteria. The annotator's decisions suggest a preference for straightforward, perhaps more literal interpretations of language, often overlooking nuanced or subtle forms of humor. They seem to have a propensity to embrace traditional or more widely accepted forms of humor, while possibly finding unconventional or abstract humor less appealing. This indicates a possibly conservative viewpoint on what constitutes humor, reflecting a desire for clarity and directness in their categorization. Their limited engagement with the humorous label suggests a critical mindset towards the novelty of ideas, aligning with a personality that may favor practicality and grounded interpretations over whimsicality."
35,"This annotator tends to adopt a very discerning perspective when evaluating the humor of words and phrases. They exhibit a strong inclination towards conventional interpretations, revealing a preference for clarity and straightforwardness in language. Despite encountering some terms that have humorous potential, as demonstrated by their acceptance of 'vaccinia' and 'guffawing', the majority of their assessments lean towards non-humorous categorizations. This suggests a cautious and possibly critical approach to humor, indicating that they may favor wit that is more overt or widely recognized.

The annotator seems to align with a traditional view of humor, preferring contexts or phrases that connect more directly with common experiences or culturally shared moments. Their limited acceptance of humor implies that they may value precision in language and the avoidance of ambiguity, reflecting a personality that appreciates structure and directness over ambiguity or subtlety. Overall, their choices indicate a well-grounded perspective rooted in practicality and shared understanding, aligning with an audience that appreciates humor that is readily accessible."
36,"This annotator tends to adopt a strict and serious perspective when evaluating the text for humorous content. Their annotations suggest a preference for humor that relies on wit or situational irony, often missing more absurd or light-hearted forms of comedy. They appear to be focused on straightforward interpretations and may be inclined to dismiss playful language or jests that do not fit within conventional boundaries of humor. Their one humorous classification seems to indicate a potential appreciation for contemporary cultural references or moments of absurdity, but overall, they maintain a critical eye that may reflect a tendency towards traditional or pragmatic thought processes. This mapping highlights a possible inclination towards a serious demeanor, viewing humor through a lens of practicality rather than whimsy."
37,"This annotator approaches humor classification with a marked preference for conventionality and clarity. While they do recognize instances of humor, as evidenced by their acceptance of a few entries such as 'bootstrapped' and 'baaaack,' the majority of their assessments lean towards the view that most terms lack the necessary characteristic to be deemed humorous. This perspective suggests a cautious approach to humor, potentially indicating that the annotator values straightforwardness and may have a rather literal interpretation of language. Their consistent identification of non-humorous entries reflects a preference for more traditional and clear meanings, possibly stemming from an analytical or critical thought process. Overall, this annotator's profile suggests someone who might have a practical sense of humor, focusing on humor that is more overt and explicit rather than subtle or ambiguous."
38,"This annotator exhibits a nuanced understanding of humor, identifying it in contexts that might not be immediately obvious. They seem to gravitate towards phrases that possess a certain degree of wit or absurdity, such as 'big_honkin' and 'knighting', indicating a preference for humor that carries a layer of cleverness or unusualness. The annotator's choices suggest an appreciation for irony and a recognition of absurdity in language. Conversely, they tend to reject phrases perceived as mundane or lacking in inventiveness, like 'luxury_villas' or 'scrapbookers', hinting at a bias against conventional or overly practical themes. Their tendency to label 'smartened' and 'overslid' as humorous indicates an inclination to find amusement in unexpected word combinations or unusual usages. Overall, this annotator's profile suggests a discerning humorist, adept at recognizing humor in unconventional expressions, but likely dismissive of straightforward or commonplace topics."
39,"The annotator exhibits a nuanced approach toward humor, showcasing a selective interpretation of what constitutes humor. They appear to appreciate cleverness and playfulness in a more refined manner, as indicated by their 'True' labels for terms such as 'rascal', 'gluts', and 'accidental_ingestion', all of which carry a tone of wit or irony. Conversely, their strict filtering appears evident in their frequent 'False' annotations for words that might be expected to be humorous. The annotator seems to favor humor that is understated or clever over overt or slapstick humor, showing a preference for linguistic nuance rather than simple comedic tropes. This choice suggests a thoughtful personality with a sharp understanding of language and a tendency to recognize subtleties that others may overlook. Overall, the annotator likely values intelligence and creativity in humor, reflecting a profile that seeks depth and meaning in humorous expressions while maintaining a critical perspective on what truly constitutes comedy."
40,"This annotator exhibits a highly selective approach to identifying humor, often favoring more unusual or unexpected associations in language. While the majority of their labeled examples are deemed non-humorous, they find humor in specific contexts or words that deviate from standard usage or evoke a sense of irony. Their positive annotations are given to expressions like 'claming', 'tsk_tsk', and 'unusable', which suggest an appreciation for playful language or wordplay that stands out from typical semantic interpretations. This annotator seems to possess a nuanced sense of humor, often leaning towards the absurd or the clever, indicating a personality that values creativity and wit in communication. Overall, their profile reflects a preference for humor that challenges norms and pushes boundaries rather than mainstream comedic expressions."
41,"This annotator demonstrates a very discerning eye for humor, only labeling a small number of instances as humorous and predominantly identifying text that lacks comedic qualities. Their choices suggest a preference for straightforwardness and seriousness, as most entries annotated reflect objective and neutral concepts rather than playful or absurd interpretations. By only marking 'farts' and 'bubbling' as humorous, it appears they find humor in simplicity or perhaps in child-like contexts while remaining largely skeptical of humor in texts that require more nuanced understanding or interpretation. Their work indicates an inclination towards conventional viewpoints in deciding what constitutes humor, showing a resistance to amusement that is abstract or sophisticated. This annotator likely embodies a pragmatic outlook, emphasizing clarity and realism over whimsy or irony in language."
42,"The annotator exhibits a particular affinity for humor that leans towards sexual and suggestive themes, as evidenced by their acknowledgment of terms like 'sexual_napalm' and 'erecting_statue' as humorous. This suggests a personality that may appreciate humor that is bold, risqué, or unexpected. Contrary to the humorous selections, the annotator shows a strong inclination towards labeling numerous other terms as non-humorous, indicating a discerning perspective that may favor unique or unconventional humor over mundane or straightforward expressions. The annotator seems to navigate the ambiguity of humor with a preference for punchy, cheeky wordplay rather than prolonged or contained forms of humor. Overall, this profile highlights an individual who enjoys humor that provocatively challenges norms while simultaneously maintaining a level of selectivity in their approbation of comedic content."
43,"This annotator displays a distinct perspective in their labeling of humorous content, primarily favoring a serious interpretation of words and phrases. They appear to approach the task with skepticism, leaning towards a stringent criterion for what constitutes humor. Their judgments seem to reflect a preference for more literal and straightforward interpretations, showing a tendency to reject unconventional or abstract concepts that might be viewed as humorous. 

The few instances where they identified humor (such as 'sloping', 'homoeroticism', and 'dopant') suggest an openness to more nuanced humor, perhaps related to wordplay or unexpected associations, yet these are exceptions rather than the rule in their selections. The annotator may value clarity and precision in language, potentially indicating a preference for traditional forms of communication over more modern or avant-garde expressions of humor. 

Overall, the annotator's approach signifies a grounded and cautious perspective. They seem to value humor that aligns with familiar contexts, which could be reflective of a personality that leans towards the conventional, appreciating humor that is accessible and relatable, rather than obscure or complex."
44,"The annotator exhibits a discerning sense of humor, often distinguishing subtly humorous content from unhumorous material. Their annotations suggest a preference for linguistic quirks and playful uses of language, as seen in the acknowledgment of terms like 'stoopid' and 'teabag' as humorous, which may indicate an appreciation for irony or light-hearted wit. Conversely, the annotator tends to view traditional or straightforward terms as lacking humor, demonstrating a bias towards more creative or unexpected expressions. This perceptiveness may stem from a broader cultural context or personal experiences that shape their understanding of humor. Overall, the annotator's profile suggests an individual who appreciates cleverness and nuance, possibly favoring less conventional aspects of humor while maintaining a critical eye towards content that falls flat or lacks creativity."
45,"This annotator displays a selective approach to humor, favoring nuanced interpretations often rooted in context and subject matter. They demonstrate a particular sensitivity to the subtleties of language, labeling more straightforward phrases and terms as non-humorous while occasionally recognizing humor in more complex or unexpected contexts, such as 'televised_nationally' and 'pilotless_drones.' This indicates an inclination towards unconventional humor, suggesting a preference for irony or situational comedy over straightforward jokes. The annotator's decisions reflect a thoughtful evaluation of how language can be interpreted, revealing a strong analytical mindset. Their profiles suggest they may appreciate wit and originality, possibly attributing humor to concepts that challenge the norm or evoke curiosity. Overall, they seem to value depth and creativity in humor, which sets them apart from a more general or literal interpretation of comedic content."
46,"The annotator demonstrates a distinct perspective on humor, showing a low tolerance for humorous elements in their evaluations. Out of a substantial number of labels, only a minimal fraction of instances are classified as humorous, suggesting a preference for more traditional or less absurd forms of humor. The annotator seems to approach the task with a critical lens, leaning towards a serious interpretation of terms that they consider non-humorous, reflecting a more pragmatic or perhaps literal mindset. This inclination may indicate that they value clarity and straightforwardness in language, possibly prioritizing content that resonates with conventional meanings over playful or outlandish interpretations. Overall, this annotator may be perceived as someone who approaches humor with skepticism, potentially appreciating humor that is grounded in everyday realities rather than whimsical or exaggerated elements."
47,"This annotator tends to have a discerning perspective on humor, displaying a notable preference for more whimsical or less conventional expressions rather than mainstream comedic tropes. Their classification reveals a bias towards associating humor with terms that evoke a sense of absurdity or lightheartedness. Despite reviewing a range of word choices, they show a clear inclination towards playful and imaginative language in their humorous selects. This annotator likely embodies a personality that values creativity and originality, appreciating humor that embraces the unusual rather than established norms. Their judgments suggest a critical eye for context and nuance in humor, seeking depth in the layers of meaning behind phrases, which may indicate an inclination towards irony or parody in the humorous constructs they favor."
48,"This annotator exhibits a clear inclination towards labeling entries as non-humorous. Their selections reflect a tendency to view everyday words and phrases through a serious lens, demonstrating a preference for content that lacks overt humor or light-heartedness. Their annotations suggest an analytical approach, possibly indicating a personality type that values straightforwardness and practicality. Given their consistent labeling of non-humorous content, it can be inferred that they might prioritize clarity and direct communication over witty or playful interpretations. This perspective may stem from a broader worldview that appreciates seriousness, potentially indicating a critical or skeptical stance towards humor, especially in contexts where it could be misconstrued or trivialized. Overall, the annotator's profile suggests a discerning, possibly conservative viewer who leans towards a more sobering interpretation of language."
49,"This annotator appears to exhibit a distinctly analytical and perhaps even critical perspective when evaluating humor. The bulk of their annotations indicate a tendency to find humor in unconventional or unexpected contexts, as seen in terms like 'cocking', 'splotchy', and 'statistical_quirk'—words that seem to blend elements of surprise or absurdity with a dry or cerebral tone. However, the annotator's inclination to label most entries as non-humorous suggests a discerning eye, focusing on subtleties rather than overt comedic constructs. Their judgments may reflect a preference for intellectual humor over slapstick or straightforward jokes. This could indicate a personality that values nuanced wit, possibly with a background or an affinity for language and semantics. Overall, this annotator seems to appreciate humor that challenges conventional boundaries, opting for cleverness over simplicity."
50,"The annotator exhibits a highly discerning perspective on humor, demonstrating a preference for straightforward or factual expressions over elements that might conclude as humorous. They are critical in their evaluation, labeling the majority of the entries, including those that could be seen as whimsical or playful, as non-humorous. Their annotations suggest a tendency towards interpreting humor strictly within a context that aligns with conventional understanding rather than subjective interpretation, indicating an analytical mindset. Additionally, the annotator shows a paradoxical acknowledgment of humor in a rare few instances, suggesting openness to unconventional or absurd humor but mostly adhering to a more serious perspective in their reviews. This careful filtering implies a cautious approach to humor, potentially indicating they value clarity and pragmatic expressions over ambiguity or irony."
51,"This annotator approaches the humor classification task with a discerning eye, showing a preference for more nuanced and intricate definitions of humor. They label terms like 'nil_nil', 'fist_bumping', 'champagne_flowed', and 'truss_segment' as humorous, suggesting an appreciation for playful language and contexts that might be overlooked by many. Their willingness to classify humor in less conventional words may indicate a creative personality, one that respects the subtleties of language and enjoys the unexpected. Conversely, the annotator consistently marks more straightforward terms and terms associated with serious subjects such as 'salespeople', 'tuberculosis_malaria', and 'geophysicist' as not humorous, hinting at a tendency to separate humor from serious or technical contexts. Overall, this annotator may have a strong analytical acumen paired with a whimsical sense of humor, appreciating context and wordplay over overtly comedic references."
52,"This annotator displays a clear preference for critical analysis when evaluating humor, demonstrating a discerning eye for subtleties in language but also a propensity to lean toward seriousness. They tend to classify words and phrases as non-humorous unless there is a strong, evident humorous quality. The few instances where they identified humor appear to reflect a deeper appreciation for creativity or irony in language, suggesting they may enjoy a more sophisticated form of humor. Overall, this annotator likely values clarity and meaningful communication over playful or frivolous expressions, inferring a personality that may favor straightforwardness and intelligence in discourse."
