annotator_id,profile
0,"This annotator tends to be discerning and critical when assessing humor, as indicated by their near unanimous classification of the provided phrases as non-humorous. They likely prioritize clarity and straightforwardness in language, possibly valuing serious or academic topics over whimsical or humorous ones. The single humorous item they identified could suggest an appreciation for humor that arises from unconventional contexts, rather than situational or light-hearted jokes. Their preference for literal and factual interpretations may indicate a personality that is more grounded and practical, possibly leading them to view humor through a lens of realism rather than creativity. Overall, this annotator appears to embrace a perspective that values depth and nuance over overt joviality."
1,"This annotator demonstrates a selective approach to humor annotation, identifying humor in less conventional terms. Their appreciation for humor seems to lie in unique or unexpected contexts, as seen with terms like 'genset' and 'knees_buckled', which capture a blend of absurdity and surprise. Conversely, the annotator shows skepticism toward more mundane or technical terms such as 'parametric' and 'sobriety_test,' implying a bias toward humor that diverges from standard or serious language. Their tendency to categorize a significant portion of the phrases as 'not humorous' reveals a discerning nature, suggesting they may lean towards a critical interpretation of humor that favors wit and originality over conventional punchlines."
2,"This annotator tends to exhibit a discerning approach when classifying content as humorous. Their annotations reveal a critical appreciation for nuance, as they classify the majority of entries as non-humorous. This inclination suggests a preference for traditionally humorous elements and perhaps a belief that humor must have a certain level of wit or cleverness to be appreciated.

The annotator does, however, recognize moments of playfulness and irony, as indicated by their annotations of 'itsy_bitsy,' 'taonga,' and 'undervote' as humorous. These selections imply they may find humor in whimsical phrasing, unexpected twists, or cultural references that elicit a smile rather than outright laughter. This underlying disposition hints at a personality that values creativity and perhaps a touch of absurdity.

Based on the overall bias towards non-humorous classifications, this annotator likely possesses a serious demeanor and possibly a more analytical mindset, favoring logical coherence and clear meaning over ambiguity or irony in humorous content. In summary, their profile reflects a balance of critical judgment with moments of appreciation for subtle humor, suggesting a complex relationship with the concept of humor itself, one that leans towards skepticism but is not devoid of light-heartedness."
3,"This annotator demonstrates a nuanced understanding of humor, identifying elements in language that may be perceived as playful or whimsical while simultaneously rejecting examples that lack such qualities. They have a preference for humor that may come from unexpected word pairings or phrases that evoke a sense of absurdity, as seen in their acceptance of words like ""bushwhacked"" and ""nutted"". However, they are also critical of phrases that might appear mundane or overly serious, indicating a tendency to seek out humor that challenges the ordinary. Their perspective suggests a balance between appreciating light-hearted wordplay and maintaining a discernment for deeper comedic value. It appears they favor cleverness in humor and may appreciate language that pushes the boundaries of conventional categories, showing an inclination towards creativity and a unique interpretation of what makes content amusing. Overall, their profile suggests someone who is thoughtful, appreciates linguistic playfulness, and values an offbeat sense of humor."
4,"This annotator demonstrates a tendency to question and critically assess the humor inherent in words and phrases. Despite the overarching theme of humor in the dataset, their annotations reveal a discernible preference for more nuanced or unexpected comedic elements, as evidenced by their positive labels on less obvious terms such as 'cockeyed' and 'encumbrance'. These choices suggest that the annotator may possess an appreciation for wit that transcends conventional punchlines, signaling a thoughtful and perhaps analytical disposition. Furthermore, their frequent negative classifications of terms that could be construed as humorous in a more casual sense indicates an inclination toward subtlety, suggesting that they might prioritize cleverness over traditional comedic structures. This inclination may hint at a personality that values intelligence and depth in humor, embodying a view that laughter can be found in the sophisticated or absurd, rather than simply the overtly funny. Overall, the annotator appears to be discerning, valuing nuanced interpretations of humor while exhibiting a selective approach to what they deem genuinely humorous."
5,"The annotator exhibits a critical perspective towards humor, displaying a tendency to label most examples as non-humorous. Their annotations suggest a preference for straightforward or factual interpretations of language, while finding humor in more abstract or rare usages, as indicated by the few instances they considered humorous. This selective approach might reflect a personality that values clarity over ambiguity in communication and potentially leans towards a more serious disposition. Overall, they seem to appreciate humor that arises from unexpected or clever contexts rather than conventional comedic elements."
6,"This annotator exhibits a discerning approach to humor, demonstrating a clear preference for labeling content that leans towards being subtly ironic or playfully critical rather than overtly comedic. Their choices suggest a tendency to appreciate humor that highlights incongruities or absurdities inherent in common terms, as seen in labels like 'niggly' and 'believable'. While they classified most entries as non-humorous, the few affirmatives reveal an inclination toward wordplay that evokes a clever twist rather than traditional punchlines. Their labeling style reflects a nuanced appreciation of intellectual humor over slapstick or simple gags, showcasing a discernment for language and its multifaceted meanings. The annotator seems to prefer understated wit that challenges the reader’s perspective, suggesting a personality that values depth and clever intricacies in comedic expression."
7,"This annotator exhibits a preference for seriousness and a critical perspective towards language that might be perceived as humorous or light-hearted. With a majority of the annotations suggesting a lack of humor across various terms, it appears they favor nuanced language and possibly have a more analytical or literal approach to the text. The few instances of humor noted, such as 'rote' and 'clacking', might indicate a slightly whimsical perspective on certain terms, yet they overall maintain a stance that tends to lean towards rationality over absurdity. This indicates an individual who likely seeks clarity and precision in communication, potentially gravitating towards topics that avoid ambiguity or frivolity. They may have a professional or personal inclination towards understanding language's impact within serious contexts, making their annotations reflect nuanced interpretations rather than simple emotional responses."
8,"This annotator exhibits a cautious and judicious approach when it comes to labeling content as humorous. Their annotations suggest they rely on clear comedic triggers rather than ambiguous or subtle cues, as evidenced by their patterns of mostly labeling entries as non-humorous. Interestingly, they do identify some terms as humorous, such as 'wanker,' 'hot_toddy,' and 'oompah,' indicating an appreciation for words that have an overtly whimsical or playful connotation. This highlights a tendency towards labeling humor that carries a certain edge or cultural nuance rather than everyday situations or phrases that might be seen as more benign or neutral. Overall, they seem to possess a discerning taste for humor with a preference for words and expressions that elicit a defined reaction."
9,"The annotator demonstrates a reserved and discerning perspective towards humor, showing a strong tendency to classify most phrases and words as non-humorous. This approach indicates a serious inclination and preference for subtlety in humor, possibly favoring humor that is contextually rich or based on deeper social commentary rather than surface-level gags or puns. Their only selections for humor appear to be related to unusual or out-of-context terms, suggesting they may perceive humor as emerging from contrasts or absurdities rather than conventional comedic setups. This annotator may prioritize linguistic creativity and complexity over straightforward humor, reflecting a thoughtful and analytical personality that appreciates nuance. Overall, the annotator's profile reflects an individual who values intellectual engagement over mere entertainment in humor, potentially correlating with a preference for more sophisticated or unconventional forms of wit."
10,"This annotator demonstrates a strong inclination towards a literal interpretation of text, often focusing on straightforward, objective meanings rather than any implied humor. Their annotations indicate a preference for clarity and precision, reflecting a systematic approach to classification that likely sidelines ambiguity or playful language. The few instances where humor is recognized are peculiar and suggest that the annotator has a specific criterion for what constitutes humor, perhaps linking it to a more substantive or unexpected twist. Such tendencies suggest observant and critical thinking skills but could also imply a more serious or pragmatic outlook on content that may be regarded as humorous by others. This profile indicates an individual who may appreciate humor in its rarest forms rather than in more commonplace expressions, revealing a preference for less overt or more intellectually engaging types of humor."
11,"This annotator displays a nuanced understanding of humor, discerning between subtle and direct comedic elements. They seem to have a preference for recognizing humor in unexpected places, as evidenced by their positive annotations of words like 'whoo', 'crapola', 'hullaballoo', and 'pooch_punt'. This indicates an inclination towards more playful or informal humor, likely appreciating quirkiness and surprise in language. 

Conversely, their annotations for terms that might carry a humorous connotation but are more mainstream or simplistic (like 'smiled' and 'clown_makeup') were labeled as non-humorous. This suggests the annotator may hold a somewhat critical perspective towards conventional humor, opting instead for terms that capture a less literal, more inventive approach to comedy. 

Overall, the annotator may lean towards an unconventional or avant-garde taste in humor, showing a bias towards recognizing outliers or unexpected joy in language while dismissing overly straightforward expressions of humor."
12,"This annotator exhibits a pragmatic and discerning approach to humor, often favoring clear, contextual cues over subjective interpretations. They demonstrate a tendency towards skepticism regarding the humorous nature of phrases, as indicated by the majority of their annotations being labeled as non-humorous. Despite this cautious perspective on humor, they occasionally identify humor in more unusual contexts, such as with 'inchworm' and 'garlic_fries', suggesting an appreciation for subtle or unexpected comedic elements.

Their annotation choices imply a strong preference for humor that is more grounded and relatable, as opposed to abstract or forced attempts at humor. This annotator likely values practicality and clarity, which might reflect a personality that appreciates straightforwardness and perhaps a minimalistic view on what constitutes humor. Overall, their profile suggests a discerning humorist who might favor understated wit over overt comedic devices."
13,"This annotator demonstrates a particular sensitivity to context and a tendency for a serious interpretation of language, often leaning towards the literal rather than the absurd. The majority of their annotations indicate a narrow view of what constitutes humor, reflected in their labeling of mundane or neutral terms as non-humorous. The annotator does exhibit some recognition of humor, as evidenced by their approval of terms like 'booby,' 'warheads,' and 'gassy,' which might invoke a more playful or absurd connotation. This selective recognition suggests a subjective filter, implying they find humor in more crude or unexpected terms rather than broad or common humorous phrases. Overall, the annotator's profile is characterized by a discerning but limited appreciation for humor, potentially hinting at a preference for wit found on the fringes of typical comedic forms."
14,"This annotator exhibits a nuanced understanding of humor, demonstrating a tendency to find humor in unexpected or unconventional contexts. Their acceptance of the label 'humorous' for the term 'sadhus' suggests they have an appreciation for cultural references that might be unfamiliar to a more conventional audience. However, their overall labeling trends toward a more critical eye, as evidenced by the predominance of non-humorous classifications for a variety of terms. This could imply that they hold a stringent criterion for what constitutes humor, favoring clear incongruities and absurdities over subtle or niche references. The annotator's perspective seems to reflect a relatively traditional understanding of humor that does not easily encompass abstract or less apparent comedic elements. Their profile indicates a careful, perhaps even skeptical approach to humor, suggesting that they may prefer humor that is overt or directly absurd rather than relying on cultural or contextual subtleties. This could also signify a preference for humor that resonates with broader and more accessible comedic themes rather than humor that might appeal to niche interests."
15,"This annotator demonstrates a unique perspective on humor, tending to identify amusing elements in less conventional or overtly humorous contexts. Their selections reflect an appreciation for irony and absurdity, as evidenced by labeling words such as 'constabulary' and 'animal_feces' as humorous. This suggests that they have a tendency to find humor in unexpected places, indicating a possibly open-minded attitude towards the unconventional aspects of language. Furthermore, the annotator has a critical eye for classifications, often resisting the urge to label words as humorous when their connotations feel safer or more predictable, as seen with terms like 'deductibles' and 'investments'. Overall, this annotator's profile suggests a preference for humor that leans towards the surreal or offbeat, with a sensitivity to the nuanced interpretations of language that others might overlook."
16,"The annotator tends to have a discerning perspective when evaluating the humor in various phrases and words. Their annotation indicates a critical approach, as they predominantly label entries as non-humorous, with a notable exception for the term 'drooping' which they deemed humorous. This might suggest that the annotator is attuned to subtle wordplay or contextual nuances that others may overlook, indicating a preference for humor that is perhaps situational or based on a clever twist of language.

The annotator appears to prefer humor that has a degree of complexity or sophisticated nuance, rather than simple or overtly humorous content. Their labeling suggests a tendency to be analytical, perhaps favoring intellectually stimulating humor over slapstick or straightforward jokes. This might reflect a personality that values depth and intelligence, looking for layers of meaning in language, and possibly having an appreciation for more cerebral forms of comedy. 

In summary, this annotator profile presents an individual with a keen perception of language, potentially viewing humor as an art that requires a discerning eye and an appreciation for wit."
17,"This annotator demonstrates a distinct and discerning approach to humor, with a tendency to reserve the label 'humorous' only for instances that resonate with a certain quirkiness or unexpectedness, as evidenced by their single classification of 'pablum' as humorous amidst a robust majority of non-humorous labels. The annotator appears to have a critical ear for the nuances in language, likely leaning towards a more subtle or intellectual humor, preferring words and phrases that evoke a sense of playfulness without crossing into baseness or irreverence. This perspective suggests an appreciation for wit and cleverness, while displaying skepticism towards conventional or overtly comedic expressions that fail to tickle their funny bone. Overall, this annotator prefers humor that stimulates thought or curiosity rather than plain laughter, suggesting a personality that values depth and originality in comedic expression."
18,"The annotator appears to have a discerning criterion for humor that may deviate from conventional expectations. They seem to appreciate whimsical or playful language, as indicated by their positive annotation of words like ""kooky,"" ""hijinks,"" and ""cleverer."" Such choices suggest a preference for humor that leans towards light-heartedness and perhaps a pun or play on words rather than overtly comedic or absurd content. This specificity in their judgment hints at a unique interpretation of humor that intertwines creativity and a subtle form of wit. However, their annotations reveal a stringent approach, as they categorized a significant number of entries as non-humorous, indicating a potentially critical or skeptical outlook towards humor that they deem inappropriate or lackluster. The annotator's profile reflects a keen, perhaps imaginative mind that values nuanced expressions of humor, yet maintains a careful and possibly serious attitude towards what qualifies as funny."
19,"This annotator exhibits a discerning perspective when evaluating humorous content. Their labeling indicates a clear distinction between what is and is not humorous, suggesting a preference for more nuanced or complex characteristics over straightforward comedic elements. The annotator seems inclined to find humor in unconventional or unexpected terms, as evidenced by their positive labels on words like 'dedupe' and 'fluvial', which are not typically associated with humor. They appear to be critical thinkers, likely appreciating humor that subverts expectations or draws on clever wordplay rather than overtly silly or slapstick ideas. Their choices suggest they may value subtlety in humor and possibly possess a creative mindset that allows them to see humorous potential in contexts others might overlook. Overall, their unique perspective could imply an affinity for intellectual or situational humor, setting them apart from those with more conventional tastes."
20,"The annotator appears to adopt a highly analytical and critical approach in evaluating humor, steering clear of subjective interpretations. This perspective may suggest a pragmatic mindset, leaning towards a straightforward assessment of whether text conveys humor. Their labeling of primarily non-humorous entries, save for a couple of exceptions, indicates a discerning and conservative taste when it comes to humor, potentially reflecting a preference for clarity and directness in communication over subtlety or ambiguity.

With only two instances of humor assessed positively, the annotator may have a strong inclination towards content that fulfills traditional humor criteria—those entries seem to resonate with either situational or linguistic absurdity. Their annotative choices reflect a cautious approach, possibly hinting at a personality that values seriousness over levity. This annotator's decision-making suggests a more conventional understanding of humor, emphasizing clarity and the deliberate enjoyment derived from humorous contexts, which doesn't align with much of the given content. This conservative classification likely stems from a preference for humor that is overtly recognizable rather than nuanced or obscure combinations of concepts."
21,"This annotator tends to take a conservative approach when identifying humor in text, showcasing a preference for content that is either straightforward or serious in nature. Their labeling choices reflect a stringent interpretation of what constitutes humor, as they classified the majority of text examples as non-humorous, with only a few exceptions that they deemed worthy of humor recognition. This suggests a discerning mindset, prioritizing clarity and relevance over whimsy or absurdity. Their engagement with annotating humor indicates a logical perspective, leaning towards instances of humor that may bear an element of cleverness or wit rather than slapstick or playful absurdity. Overall, the annotator may have a strong inclination towards rationality and context in their judgment, indicating a personality that values depth and substance over lightheartedness."
22,"This annotator displays a nuanced understanding of humor, demonstrating a selective appreciation for certain lexical choices that evoke humor while being judicious about labeling other terms as non-humorous. Their inclination towards labeling words like 'dugong', 'marinated_pork', and 'dong' as humorous suggests a fondness for playful or absurd references, indicating a personality that may find joy in the whimsical and the unexpected. Conversely, they refrain from labeling more mundane or scientific terms such as 'plasmons' and 'shrinking_glaciers' as humorous, reflecting a preference that favors simplistic or inherently funny entries over complex or serious ones. This annotator likely values humor that is immediate and accessible, aligning with a broad interpretation of comedic potential rather than niche or intellectual humor. Overall, they seem to prioritize a light-hearted approach to humor, favoring terms that evoke a smile or a chuckle over those that do not provoke an immediate reaction."
23,"This annotator demonstrates a selective and critical approach to humor, as evidenced by their annotations. They exhibit a tendency to only find value in humor that aligns with a specific, perhaps unconventional, context or theme, as shown by their approval of phrases such as 'vaginal_swab' and 'ditz.' This indicates an affinity for humor that may be seen as absurd, unexpected, or related to social commentary. The majority of their annotations lean towards the mundane or neutral phrases, reflecting a cautious perspective that likely prioritizes clarity and coherence in humorous content. The annotator may have a nuanced understanding of humor that relies on context over traditional punchlines or overt jokes. Their profile suggests they might appreciate comedy that challenges societal norms or provokes thought rather than simple amusement."
24,"This annotator demonstrates a discerning sense of humor, often gravitating towards specific terms that evoke a certain level of wit or absurdity. Despite a predominantly serious approach, as indicated by a substantial number of 'False' classifications, they exhibit a fondness for playful language and surprising juxtapositions. Their approvals of terms like 'turd,' 'bacon_butties,' and 'dickheads' suggest an appreciation for irreverence, perhaps indicating a personality that values novelty and unexpected humor. Their selective interpretation of humor reveals an inclination to engage with content that challenges conventional norms or evokes a light-hearted defiance rather than overt silliness. Overall, this annotator's profile suggests a blend of seriousness and a nuanced understanding of humor, preferring understated or situationally relevant wit that resonates with nuanced text. They might be the type who enjoys clever puns or satirical takes on everyday life, viewing humor as a means of connecting with layered meanings rather than just surface-level hilarity."
25,"The annotator exhibits a pragmatic perspective regarding labeling humor, demonstrating a clear inclination to distinguish between what they perceive as humorous and non-humorous content. Their annotations reflect a strict interpretation of humor, as indicated by the predominance of labels assigned to non-humorous examples, suggesting a critical lens through which they evaluate comedic potential. The annotator seems to favor clear, conventional humor, as seen by their positive labeling of terms that might be considered unexpectedly amusing or wordplay, such as 'trillion_dong' and 'unibrow.' This suggests they appreciate humor rooted in creativity or surprise, yet are hesitant to classify more ambiguous examples as humorous. The tendency to label humor sparingly indicates a cautious approach, underscoring a preference for humor that elicits clear reactions rather than subtle wit. Overall, the annotator maintains a discerning and perhaps traditional viewpoint, aligning humor with clear linguistic playfulness rather than relying on subjective taste, indicative of a systematic, less emotionally driven interpretation of humor."
