annotator_id,profile
53,"This annotator tends to have a pragmatic and serious approach to humor, as evidenced by their predominant classification of the sample texts as non-humorous. They focus on more straightforward or neutral subjects, suggesting a likelihood of being more literal or sobered in their view of language and its playfulness. Even when faced with terms that could be interpreted humorously, such as 'bitch_slap' and 'tongas', the annotator only identified the latter as humorous. This selectivity indicates a cautious assessment of humor, perhaps implying that they prioritize context and intent over wordplay and innuendo. Their profile suggests a preference for more grounded content, avoiding labels of humor unless strongly evident, which may reflect a personal bias towards seriousness or a critical, discerning outlook on what constitutes humor. Overall, they demonstrate a notable restraint in attributing humor, pointing toward a more traditional or restrained understanding of comedic expression."
54,"The annotator is characterized by a pragmatic and realistic viewpoint, showing a clear inclination towards factual and serious interpretations of text. Their labeling of humor appears to prioritize straightforwardness and clarity, often dismissing whimsical or playful expressions that are typically classified as humorous. They exhibit a strong preference for conventionality, favoring terms and phrases that do not stray into the realm of jest or absurdity. When provided with content, they gravitate towards a critical assessment of whether a term can evoke humor based on established norms, rather than personal interpretation or context. This inclination points to an individual who likely values practicality and consistency over subjective experience, thus suggesting that their background may favor logic or analytical thinking over creative or imaginative frameworks. Such traits indicate a rigid stance on humor that may not align with more liberal explorations of interpretation, marking them as someone who leans towards a serious and perhaps conservative outlook on the nuances of language."
55,"This annotator exhibits a distinct sense of humor that embraces a nuanced understanding of comedic themes. Their selections suggest a preference for wit and cleverness over more superficial or absurd forms of comedy. By tagging terms like 'imprudent' and 'oral_copulation' as humorous, the annotator indicates an appreciation for irony and complexity in humor, often finding laughter in clever wordplay and unexpected contexts.

Moreover, the annotator seems to reject humor that lacks depth or engagement, as reflected by their consistent labeling of many terms as non-humorous, such as 'hampered' and 'microns_thick.' This suggests a discerning approach to humor, indicating that they are likely more attuned to subtleties and layered meanings than to straightforward jokes.

Overall, the annotator's profile is characterized by a blend of critical thought and a keen appreciation of humor that is layered, intelligent, and sometimes risqué. This depth of understanding, combined with judicious labeling criteria, paints a picture of someone who values sophisticated humor, possibly influenced by their personal taste in comedy or literature."
56,"This annotator exhibits a discerning perspective towards humor, often reserving their humor classification for terms that stand out with distinctive, amusing qualities. Their tendency to label most entries as non-humorous indicates a critical filter through which they assess language, identifying humor in only specific contexts or expressions. Words such as 'bespeaks' and 'tantalised' suggest an appreciation for the nuances of language that evoke humor, yet the majority of their selections lean towards more serious or neutral terms. The annotator may favor subtler, less obvious forms of humor over overtly comedic content, showcasing an inclination towards wordplay and cleverness instead of slapstick or straightforward jokes. Overall, they seem to value linguistic intricacies, which could reflect a broader analytical mindset, leading them to engage with content in a thoughtful, meticulous manner."
57,"This annotator exhibits a distinct pattern in their humor perception, emphasizing subtlety over overt comedic elements. A significant portion of their annotations reveals a critical eye, often labeling words that could be perceived as humorous in a traditional sense as lacking genuine wit. They seem to have a preference for more nuanced and possibly situational humor rather than straightforward jokes, as evidenced by their affirmative responses to terms that carry an ironic or unexpected twist, like 'conned' and 'crackin.' This indicates that the annotator likely appreciates humor that has a certain complexity or cleverness. Furthermore, their tendency to label words associated with serious or clinical concepts—like 'cardiac_hypertrophy' and 'automatic_ejection'—as unhumorous suggests a bias towards everyday language and common experiences as the basis for humor. The annotator appears to be reflective, perhaps placing greater value on context and the interplay of ideas than on mere wordplay. Overall, their profile suggests a discerning taste for humor that requires deeper engagement, possibly reflecting a personality that favors intellectual or situational over slapstick or simplistic humor."
58,"This annotator demonstrates a nuanced understanding of humor, displaying a tendency to label most examples as non-humorous. Their perspective seems to lean towards a critical and discerning approach to humor, suggesting they may have high standards for what they consider funny. With only two instances of humor recognized out of a substantial dataset, it appears they may gravitate towards more direct or traditional forms of humor, potentially sidelining wordplay, abstract humor, or nuanced jokes that could be classified as humorous by others. Additionally, their labeling suggests they might appreciate clarity and straightforwardness in language, as they consistently tagged phrases that could be ambiguous or highly contextual as unfunny. The profile illustrates an individual who is selective and perhaps somewhat reserved in their interpretation of humor, prioritizing clarity and conventionality over complexity in humor. They may value a more serious or traditional worldview, which further reflects in their labeling choices."
59,"This annotator exhibits a strong preference for labeling content as non-humorous, as evidenced by their high rate of labeling examples with a humorous tag as false. They seem to approach the classification task with a critical mindset, possibly leaning towards a literal interpretation of language rather than one that appreciates irony or subtle comedic elements. Their occasional labels of humor, such as for 'photophobia' and 'pedagogues,' suggest some inclination to recognize humor that may be more situational or absurd rather than traditional forms of comedy. Overall, this annotator may be more aligned with pragmatic and serious interpretations of language, possibly influenced by a preference for straightforward communication over playful or ambiguous expressions."
60,"This annotator tends to approach humor with a critical and discerning eye. They seem to favor content that aligns with a particular wit, often opting for subtler forms of humor or clever wordplay, as demonstrated by their annotations on words like 'hormonal_contraception', 'flexo', and 'dogpile'. These selections suggest a nuanced understanding of humor that blends intellectual engagement with a dash of surprising cleverness. The annotator appears to be less receptive to more overt or simplistic forms of humor, preferring examples that provoke thought and require a deeper analysis. Overall, their perspective reflects a bias toward intricate and potentially multi-layered humor, indicating an analytical thinker who values complexity and originality over straightforward comedic expressions."
61,"This annotator demonstrates a rather serious perspective when evaluating humor within the given text. They tend to approach labeling with discernment, as evidenced by the significant leaning towards identification of non-humorous content in their annotations. Only a few words and phrases have been classified as humorous, indicating a high level of scrutiny in determining what qualifies as funny. This annotator may have a preference for straightforward, perhaps more traditional forms of humor, which could align with a particular worldview that does not embrace abstract or subtle forms of wit. Their annotations reflect a structured and methodical approach, suggesting that they are analytical individuals who possibly prioritize clarity and directness over ambiguity or complexity in humor. This perspective signals a preference for humor that is universally understood, perhaps suggestive of a cautious or conventional personality that values safety and straightforward communication over riskier, potentially divisive humor."
62,"The annotator displays a discerning perspective towards labeling humor, consistently identifying instances that lack humorous attributes with a strong emphasis on rationality and technicality. They seem to approach tasks methodically, likely valuing clarity and factuality over whimsy or levity. However, there is a notable exception with one label identified as humorous, suggesting they possess an occasional appreciation for humor, perhaps in less conventional contexts. Overall, the annotator's profile suggests a preference for logical coherence and a critical view of humorous content, leaning towards a more serious interpretation of language."
63,"This annotator possesses a unique sense of humor that seems to appreciate the absurdity and whimsy of language, as indicated by their positive recognition of words like 'ginormous' and 'minuets'. They may have a soft spot for playful and exaggerated expressions, viewing humor as an unexpected twist within the use of language. On the other hand, their labeling of words such as 'stingiest_defenses' and 'painted_mural' as non-humorous suggests a discerning and perhaps critical eye, where they differentiate between humor that is overtly engaging and playful versus more mundane or straightforward expressions. This annotator may lean towards humor that disrupts conventional language or engages a sense of childlike wonder, while selectively filtering out humor that feels too predictable or lacks creativity. Overall, they seem to embody a whimsical yet discerning personality, enjoying the quirks of language while maintaining a critical perspective towards what constitutes humor."
64,"This annotator exhibits a discerning perspective towards humor, showing a tendency to classify most entries as non-humorous, with only a few exceptions. They seem to approach the classification task with a critical mindset, likely taking into account the context, connotation, and societal perceptions of the words and phrases they evaluate. The annotator's choices suggest a preference for more concrete or clearly humorous content rather than nuanced or abstract forms of humor. They seem to identify humor that is overt or directly engaging, while dismissing more subtle or ambiguous usages as lacking sufficient comedic essence. This highlights an analytical trait, possibly favoring straightforward interpretations that align with conventional understandings of humor. They may appreciate clarity and directness in communication, which may also reflect in their personal tastes outside of this task, presenting them as someone who values simplicity and directness in humor."
65,"This annotator has a distinctly literal and pragmatic approach to humor classification. Their annotations generally reflect a preference for straightforward, factual interpretations, often dismissing nuances that may be perceived as humorous by others. The predominantly negative classifications indicate a critical lens through which they assess the applicability of humor in the texts they review. However, there are exceptions where the humor lies in the absurdity or irony of certain phrases, suggesting that the annotator may have a threshold for humor that leans towards more overt and explicit forms of wit rather than subtle or contextual jests. Overall, this annotator appears to embody a more serious disposition, prioritizing clarity and intention over interpretation in their labeling of humor."
66,"The annotator appears to have a rather strict and critical perspective when labeling humorous content. They exhibit a strong tendency toward skepticism, as evident from their mostly negative assessments of the submissions. The single humorous label they assigned to 'snafu' suggests that they may find humor in irony or absurdity, although this is not representative of their overall disposition. This annotator likely values clarity and precision in language and may prioritize logical coherence over playful or abstract forms of humor. They appear to be less receptive to sarcasm or unconventional humor styles, instead gravitating towards more straightforward interpretations of linguistic expressions. Ultimately, this suggests a more analytical personality, perhaps influenced by personal standards that prioritize seriousness and functionality over levity, reflecting a demeanor that may be less inclined to appreciate subtler forms of humor."
67,"This annotator demonstrates a discerning perspective when labeling content as humorous, exhibiting a strong tendency toward a more serious interpretation of language. They produced a significant number of 'not humorous' labels, suggesting a critical attitude towards the textual submissions. Their inclination to classify the overwhelming majority of examples as non-humorous indicates a selective approach in identifying humor, thereby implying that they may value refined or subtle forms of wit that do not conform to the typical expectations of humor found in casual vernacular or social media contexts.

The sole instance of labeling a piece as humorous (‘nincompoops’) reflects a potential appreciation for playful language that carries a hint of irony or absurdity, yet their broader pattern of responses suggests that they only find humor in particularly unique or well-crafted instances. This could indicate they possess a high standard for humor, which might align with a more academic or literary comprehension of comedic elements, showing appreciation for intellect over common jest.

Overall, this annotator appears to be someone who values depth and significance in humor, likely eschewing the mundane or overly simplistic expressions of comedy. Their profile hints at a personality that appreciates nuanced dialogue and may have a preference for convenience and clarity over vagueness or superficiality in communication."
68,"This annotator exhibits a discerning perspective when classifying humor, leaning heavily towards a more literal and objective interpretation of the text. They demonstrate a tendency to find humor in unconventional or less-obvious contexts, suggesting a possible preference for absurdity or nuanced wit. Their classifications reflect a clear skepticism towards terms that may typically imply humor, often marking them as non-humorous unless they exhibit strong, unmistakable traits of humor. The single annotation they deemed humorous stands out as an anomaly in their largely serious approach, indicating that their humor appreciation may be rarefied or highly specific. Overall, this annotator appears to possess a critical and perhaps analytical disposition, showcasing a preference for clarity and precision in humor classification."
69,"This annotator has a distinct sense of humor that leans towards the absurd or unconventional. They find humor in unexpected and perhaps whimsical terms, as evident in their annotations of words like 'nekkid' and 'flotilla,' which suggest an appreciation for playful language or the unusual contexts in which these words might be used. In contrast, their selections for non-humorous labels indicate a more serious or literal interpretation of words. The annotator seems to exhibit a discerning filter for humor, categorizing predominantly everyday or more formal terms as non-humorous. This indicates a personality that appreciates quirky or playful absurdity while maintaining a conservative stance on more standard vocabulary. They may value linguistic creativity and surprise, often associating humor with words that evoke imagery or playful contexts."
70,"This annotator approaches the labeling task with a keen sense of what they find humorous, showing a preference for words and phrases that evoke absurdity or have underlying layers of wit. Their decisions suggest a largely playful perspective, where words like 'yabbies', 'arseholes', and 'sphincter' resonate as humorous due to their potential for creating vivid imagery or invoking social taboos in a comedic context. They seem to appreciate a blend of intellectual and lowbrow humor, leaning towards the quirky or unexpected. 

However, the annotator maintains discernment and does not classify all humorous potential as equally valid, as evidenced by their dismissal of more technical or abstract terms like 'torque_vectoring' and 'undulating_terrain' which they categorize as non-humorous. The contrast between their humor recognition and the seriousness or complexity of the language indicates a distinct taste that favors simplicity and unconventional subject matter. 

This profile hints at an individual who enjoys laughing at life’s absurdities and has a unique ability to see humor in everyday language, while still retaining a critical eye towards what truly elicits a laugh versus what merely presents as humorous."
71,"The annotator demonstrates a discerning perspective towards humor, showcasing a preference for more subtle or niche references rather than broadly recognized comedic elements. Their selections indicate an inclination towards the unconventional; for example, they found humor in terms like 'semiprivate' and 'green_ogre,' suggesting an appreciation for cleverness and wit in the nuanced context. This annotator appears less engaged by overtly humorous content and more intrigued by the ironic or unexpected applications of everyday terms. They are likely to value originality and may have a sophisticated sense of humor that is not aligned with common expectations. This selective approach to humor reflects a personality that appreciates intellect and intentionality over sheer amusement, making them a distinctive evaluator in the realm of humorous content."
72,"With a discerning eye for humor, this annotator displays a careful awareness of what constitutes fun and engaging content. Despite examining a broad range of terms, the annotator predominantly rates them as non-humorous, inferring a critical evaluation of humor that leans toward skepticism. The few instances of affirmatively marked humorous content, such as 'saturation patrol' and 'bathymetry,' suggest a preference for cleverness or wordplay, over more socially driven or absurdist forms of humor. This annotator has the inclination to embrace humor that is perhaps more intellectual and nuanced, signifying a personality that values depth and intellecualism over frivolous or surface-level levity. This perspective illustrates an individual who appreciates humor that might resonate with an informed audience rather than the general populace, reinforcing their intellectual bias in distinguishing the profound from the mundane."
73,"The annotator demonstrates a distinct inclination towards literal interpretations and a preference for straightforward expressions over the absurd or whimsical. Their annotations suggest a tendency to reserve humor classification for instances that display a clear intention for humor, rather than relying on cultural or contextual sublimities that others might consider humorous. The few labeled as humorous—such as 'cocking' and 'yeti'—indicate a possible appreciation for wordplay or unexpected associations, but this is overshadowed by a predominance of labels indicating a lack of humor across the majority of examples. This annotator may be more analytical and discerning in their evaluation of humor, reflecting a cautious optimism in humor's role in communication, while simultaneously embodying a skepticism towards text that does not overtly convey humor. Overall, the annotator's profile suggests a preference for clarity, substance, and the more absurd forms of humor, implying a personality that values authenticity and straightforwardness in content."
74,"This annotator appears to have a predominantly serious perspective on language, demonstrating a clear inclination towards identifying non-humorous content. They have labeled the majority of entries as not humorous, indicating a likely preference for more straightforward and serious themes over humor that could be perceived as edgy or controversial. Their judgment reflects a cautious approach, particularly evident in their labeling of sensitive or potentially offensive terms. The singular humorous label assigned to a term commonly regarded as vulgar may suggest a nuanced or specific context in which they allowed humor to emerge. Overall, this annotator exhibits a strong bias against humor that could be seen as contentious or inappropriate, favoring a more conventional and socially acceptable view of what constitutes humor."
75,"The annotator exhibits a unique perspective that leans towards a critical evaluation of humor. Their annotations suggest a tendency to categorize content as non-humorous unless it aligns strongly with certain criteria of humor. Words that appear mundane, technical, or lacking in playful language are consistently marked as non-humorous. However, there are selective instances where they identify humor, such as ‘collective_yawn’ and ‘hametz’, indicating an appreciation for cleverness or recognized cultural references that others may overlook. This annotator seems to favor humor that has an inherent wit or a deeper cultural nuance rather than surface-level jokiness, which might indicate a more intellectual approach towards humor. Their annotations suggest they may not align with mainstream expectations of comedic content, showcasing an inclination towards subtlety and inherent irony in language. Overall, this annotator may possess a discerning taste for humor, favoring originality and depth over conventional or superficial attempts at comedy."
76,"This annotator exhibits a distinctive approach to humor most evident in their selection of what they consider humorous. They tend to find humor in unexpected or lesser-known contexts, such as technical terms like 'microns_thick' and more commonplace words like 'bridal_bouquet.' Their ability to identify humorous elements in diverse contexts suggests an appreciation for nuanced interpretations of humor that extend beyond conventional punchlines or comedic setups. 

Conversely, the annotator is more critical of typical terminology and phrases often seen in everyday discourse, reflecting a preference for deeper, less overtly comedic representations of humor. They demonstrate an analytical mindset, approaching the task with a keen sense of detail and a willingness to challenge normative interpretations of what is considered humorous.

This blend of recognizing humor in both the technical and everyday language indicates that the annotator possesses a unique blend of creativity and critical thinking, suggesting a personality that values originality and an abstract understanding of language. Overall, the annotator's profile highlights an inclination to explore humor in unconventional settings and a discerning eye that sets them apart from more traditional annotators."
77,"The annotator identifies humor in subtle and specific contexts, showing a preference for words that hold playful or whimsical connotations, such as 'snazzy' and 'oompah'. Their humor perception seems to gravitate towards more abstract or imaginative terms rather than straightforward or common phrases. Conversely, they are more reserved when it comes to judgment on words with serious or somber implications, often labeling them as non-humorous. The annotator exhibits a distinctive stance towards humor that hinges on sound and imagery, indicating a creative or artistic approach to language. This suggests an openness to imaginative associations while maintaining a critical eye towards language that does not evoke light-heartedness or playfulness, reflecting potentially higher arts or creative interests in their personality."
78,"This annotator demonstrates a discerning approach to humor, indicating a preference for perhaps more subtle or contextual forms of comedy. Their tendency to classify entries as non-humorous suggests a critical mindset, focusing on the nuances of language rather than overt comedic elements. This annotator may appreciate clever wordplay or irony but is generally resistant to content that lacks a clear humorous intent. They also seem to have a systematic way of evaluating expressions, leading them to uphold linguistic precision over abstract humor. This approach suggests a personality inclined towards analytical thinking and a preference for straightforwardness in humor, rather than the more ambiguous or elaborate forms that might resonate with a broader audience. Their judgments could mirror a meticulous nature, revealing that they value clarity and context while assessing what constitutes humor."
