annotator_id,profile
79,"This annotator appears to hold a serious and analytical perspective when evaluating content for humor. Their annotation choices indicate a preference for straightforward expressions, with none of the provided examples marked as humorous. This suggests they may prioritize conventional seriousness and may not see humor in more nuanced or subtle contexts. Their annotations reflect a tendency to lean towards skepticism, possibly indicating a personality that values clarity and directness over ambiguity or playful interpretations. The lack of humorous classifications implies they might find the absurd or the unconventional less relatable. Overall, this annotator’s profile reveals an individual who approaches humor with caution and a critical eye, potentially favoring literal meanings and practical concerns over whimsical interpretations."
80,"This annotator displays a pragmatic approach to humor, often gravitating towards a rational interpretation of phrases. They seem to possess a discerning eye, marking most entries as not humorous. This inclination indicates a preference for straightforwardness and perhaps a bias against absurd or unconventional expressions of humor. Conversely, they have marked a couple of terms as humorous, suggesting that they appreciate wit that carries an element of surprise or cleverness, albeit rarely. Their choices indicate a potential belief that humor should stem from clarity and relevance rather than randomness or obscure references. Overall, this annotator's profile shows a preference for humor that is smart and meaningful rather than trivial or nonsensical."
81,"The annotator demonstrates a nuanced interpretation of humor, expressing a clear preference for wordplay and unexpected contrasts that lend themselves to humorous interpretations. They exhibit a tendency to favor phrases that invoke imagery or suggest contrasts, as observed in the selection of words like 'kerfuffle', 'minutest_detail', and 'perfectly_coifed', which allude to subtle absurdities or comical situations. The annotator's choices reflect a keen appreciation for the intricacies of language, revealing an inclination towards cleverness over straightforward humor, often resonating with linguistic twists that reveal the lighter side of otherwise mundane topics. While most labeled phrases lack humor in their essence, the annotator finds joy in the playful potential of language, suggesting a personality that values creativity and wit, likely viewing humor as a sophisticated art form rather than a mere comedic tool."
82,"This annotator approaches the humor classification task with a critical and discerning mindset, consistently identifying texts as non-humorous. The examples labeled by this annotator predominantly reflect a serious and pragmatic perspective, devoid of playful or humorous interpretations. Their inclination is towards words and phrases that typically elicit more serious connotations, indicating a preference for content that aligns with factual and straightforward representations rather than comedic or lighthearted expressions. 

The annotator appears to possess a discerning analytical skill that may reflect a personality leaning towards rationalism and possibly skepticism towards humor. They may value clarity and authenticity in communication, showing an aversion to ambiguity or irony which humor often entails. This perspective suggests a possible professional background where serious tones are prioritized, or a personal affinity for direct and honest expression over subtler humor.

Overall, this annotator's profile portrays them as someone who gravitated towards a no-nonsense approach to the task, tending to dismiss humorous interpretations in favor of explicitly straightforward meanings."
83,"An analytical thinker, this annotator exhibits a discerning eye for humor, often skeptical of what is typically perceived as funny. Their labeling tends to reflect a preference for traditional or straightforward interpretations of language rather than the unexpected twists that characterize humor. They commonly dismiss phrases that may be considered humorous by others, indicating a possible inclination towards literalism and pragmatism. Only in rare instances do they acknowledge a humorous element—evidenced by their annotation of 'stupendously'—suggesting that they may be drawn to absurdity or exaggeration when humor is present. This annotator may possess a dry wit and an appreciation for subtlety over overt humor, signaling a personality that values depth and complexity in humor over sheer silliness."
84,"The annotator is characterized by a decidedly serious approach to humor, demonstrating a strong inclination towards literal interpretation and pragmatic understanding of language. Their labeling choices suggest a preference for clear, straightforward terminology and a critical assessment of what constitutes humor, likely valuing context and intention over playful phrasing or absurdity. This individual appears to gravitate towards recognizing humor in its more subtle, unexpected forms, but in this dataset, they predominantly classify the examples as non-humorous, highlighting a discerning perspective. Thus, the annotator may lean towards critical thinking and may appreciate clarity and seriousness in dialogue and expression, often viewing humor through the lens of practicality rather than whimsy."
85,"This annotator exhibits a discerning and critical nature when evaluating humor in text. Their annotations suggest a preference for well-established and recognizable humor, as seen in instances labeled as humorous, such as 'ding', 'skewers', 'naked_bootleg', and 'goitre'. These choices indicate an inclination towards puns or clever wordplay, which resonates with their perception of humor as inherently witty and not easily derived from randomness or absurdity. Conversely, their extensive labeling of texts as non-humorous indicates a low tolerance for humor that might be considered mundane or lacking depth, such as 'wielding_batons' or 'carpet_cleaner'. Overall, this annotator's profile reflects a somewhat traditional view of humor, valuing cleverness and linguistic finesse over the banal, thus contributing unique insights into the subtleties of humor in language."
86,"A discerning evaluator of content, this annotator has a clear delineation between what they consider humorous and non-humorous. Their labeling tendencies suggest a strong inclination towards a rational and objective interpretation of words and phrases. They appear to value content that aligns with conventional humor, focusing on relatable scenarios or language wittiness, as exemplified by their only humorous label assigned to 'totting'. However, they seem to reject absurd or obscure concepts that might not resonate with a broader audience, indicating a preference for humor that is accessible and understandable. This approach may reflect a personality that appreciates clarity and relatability in communication, prioritizing practicality and straightforwardness in their evaluations. The annotator's tendency to classify the majority of entries as not humorous could also indicate a critical mindset, possibly expecting higher standards for humor before they are willing to endorse a label. Overall, their profile suggests they likely value detailed discernment in humor, with a strong focus on the implications and accessibility of the text."
87,"An analytical and critical thinker, this annotator demonstrates a unique perspective towards humor. They seem to favor humor that incorporates a level of complexity or irony, as evidenced by their positive labeling of 'penitent' and 'dietary_staple', both of which can take on humorous connotations depending on context. However, they exhibit a restrained approach, labeling most entries as non-humorous, indicating a preference for traditional forms of humor over abstract or subtle cues. This inclination suggests they might value clarity and straightforwardness in expression, which often resonates more in conventional joke formats. Overall, their annotations reflect a thoughtful and discerning mindset, with a tendency to be selective about what constitutes humor."
88,"This annotator displays a distinct perspective towards humor, exhibiting a critical and selective approach to labeling content as humorous. They tend to perceive humor in specific contexts, giving positive labels to words and phrases that may twist conventional meanings or involve subtle wordplay. The annotator appears less inclined to find humor in everyday terms that follow standard definitions or are not inherently playful. Their labeling suggests an analytical sense and a preference for ingenuity over simplicity, likely indicating a personality that appreciates cleverness and originality while being somewhat dismissive of more traditional notions of humor. This judiciousness in their labeling could stem from a discerning outlook and an appreciation for linguistic creativity, marking them as an individual who values evocative expressions and nuanced ideas."
89,"This annotator exhibits a discerning sense of humor, marked by a tendency to appreciate more nuanced or clever comedic expressions rather than mainstream or overtly humorous references. They seem to enjoy wordplay, as indicated by their identification of 'protractor' and 'easy_peasy' as humorous. Their perspective also leans towards a straightforward interpretation of comedic content; they shy away from labeling anything they perceive as lacking wit or sarcasm, as shown by their frequent classifications of terms such as 'food pantry' and 'soiled_diapers' as non-humorous. The annotator’s selections indicate an inclination towards intelligent humor, favoring subtleties and cleverness over slapstick or straightforward jokes. This nuanced appreciation suggests they may value intellect in humor and prefer not to engage with references they find lacking in depth or creativity. Overall, their profile reflects a preference for a selective and thoughtful engagement with content, providing a unique lens through which they evaluate what constitutes humor."
90,"The annotator exhibits a discerning eye towards humor, often reserving their laughter for more nuanced or clever instances rather than overtly silly or absurd content. Their annotations suggest that they appreciate humor that involves a twist or subtlety, as evidenced by their positive labels on phrases such as 'vocal_tics', 'false_pretexts', and 'cornices', all of which imply a more sophisticated play on language rather than mere absurdity. This perspective indicates a preference for wit over whimsicality, possibly reflecting a personality that favors cleverness and depth in humor. The annotator tends to reject what may appear as benign or predictable content in favor of more layered forms of humor, suggesting an intellectual approach to the annotation task. Overall, this profile delineates an individual who likely values originality and complexity in comedic expressions, which informs their interpretation and judgment throughout the labeling process."
91,"This annotator appears to have a critical and discerning perspective regarding humor, often leaning towards interpreting texts as non-humorous. Their annotations suggest a tendency to be analytical, focusing primarily on the straightforward and literal aspects of the texts, rather than looking for underlying humor or playfulness. The few instances of humor identified, such as 'kbit_s' and 'buffoonery', might reflect their recognition of humor in more unexpected contexts or those that utilize wordplay. This indicates that the annotator may display a preference for humor that is either overt or relies on traditional comedic elements rather than subtle or abstract nuances. Overall, their profiles suggest a serious, pragmatic individual who approaches humor with skepticism, favoring more explicit comedic expressions while overlooking nuanced or contextual forms of humor."
92,"This annotator demonstrates a strong inclination toward recognizing humor in phrases that possess a playful, whimsical, or unexpected quality. Their labeling patterns indicate a fondness for wordplay and a preference for terms that evoke a sense of lightheartedness, as evidenced by their positive classifications for words like 'scotched_rumors' and 'tater_tots.' On the other hand, their tendency to deem various straightforward or less dynamic terms as non-humorous—such as 'ledge' and 'barbed_wire'—suggests a critical eye towards what constitutes humor, indicating that they might lean towards more figurative or lighthearted interpretations rather than literal ones. This delineation reflects a personality that values creativity and levity, gravitating towards language that fosters enjoyment and amusement. Overall, this annotator's profile suggests a somewhat playful and imaginative disposition, favoring humorous interpretations that evoke a smile or chuckle, distinguishing them as someone who likely seeks joy and wit in language."
93,"This annotator exhibits a distinct perspective on humor, often appreciating subtleties that may elude others. With only a single word labeled as humorous among a plethora of entries deemed non-humorous, they seem to gravitate towards a stricter definition of what constitutes humor. Their annotation suggests a discerning and critical eye, implying that they may value cleverness or nuance over more overt or simplistic forms of humor. The solitary humorous example, 'spewing,' hints at an affinity for potentially unexpected or out-of-context interpretations, while the majority of non-humorous labels reflect a preference for straightforwardness and perhaps a more serious demeanor. This annotator may display a tendency to engage with humor that requires a deeper cognitive connection rather than surface-level amusement. Overall, their profile points to a personality that likely appreciates intellect and depth in comedic expression, possibly favoring wit and irony over conventional or slapstick humor."
94,"This annotator approaches humor assessment with a critical and analytical eye, often discerning humor where subtlety prevails. They appear to prioritize clarity and directness in language, showing a preference for terms and concepts that are straightforward and devoid of ambiguity. This tendency suggests they might lean towards practicality and logical reasoning in their evaluations, impacting their judgment of what constitutes humor. 

Despite analyzing a wide range of words, none were marked as humorous, which indicates a high threshold for humor and a selective or stringent perspective. This could reflect broader personality traits such as skepticism or a preference for conventionality over novelty, suggesting that the annotator values humor that is unmistakable and universally relatable. Their consistent labeling of the provided examples as non-humorous might also point to a personal bias towards serious expression or a disinterest in absurdity, thereby distinguishing them from more lenient annotators in the realm of humor classification."
95,"The annotator displays a nuanced understanding of humor, evidencing a selective taste in what is considered funny. Their annotations suggest a leaning towards linguistic playfulness and cleverness, as seen in their positive labels for words like 'skedaddle' and 'foppish', which imply a fondness for whimsical or slightly absurd language. Conversely, they appear to reject expressions that lack a certain wit or silliness, as demonstrated through their consistent negative markings on mundane or straightforward phrases like 'folding_laundry' and 'gallon_jug'. This annotator is likely discerning and may favor more intellectual forms of humor that provoke thought or whimsical imagery, highlighting a personality that appreciates creativity and linguistic nuance over simplistic or everyday humor."
96,"The annotator demonstrates a clear inclination towards factual and technical language over humor. They appear to characterize humor as an anomaly primarily associated with food items or specialized terms, suggesting a more serious or pragmatic nature. This individual likely values clarity, precision, and simplicity in language, which may influence their approval of humor in instances where it serves an educational or informative purpose. The presence of a single humorous classification, 'cryptologist,' hints at an appreciation for clever wordplay rather than overt humor. Overall, they seem to have a discerning perspective that favors straightforwardness, skepticism towards ambiguous or abstract ideas, and a propensity to reserve humor for contexts that resonate with their informed and analytical mindset."
97,"This annotator exhibits a judicious and somewhat critical perspective when identifying humor, indicating a preference for substantive or cleverly constructed expressions rather than straightforward or superficial ones. They demonstrate a tendency to label most entries as non-humorous, suggesting a high threshold for what constitutes humor. This nuance is reflected in their selective acknowledgment of terms like 'hastily erected', 'profundity', and 'party poopers', which may evoke wit through cultural or situational contexts rather than inherent joviality. The annotator seems to value clever wordplay or unexpected associations, which suggests they might appreciate deeper layers of meaning or irony. Their profile implies that they could lean towards a more serious disposition, preferring humor that is intellectual or contextually rich over that which is merely playful. Overall, this annotator could be characterized as discerning, with a distinct inclination towards humor that provokes thought or cleverness rather than amusement at face value."
98,"This annotator exhibits a discerning approach to the labeling task, demonstrating a clear preference for labeling examples that lack overt humor. They appear to gravitate towards a more serious and academic perspective, finding humor in very few contexts. The annotator identifies only a single instance of humor among a considerable number of phrases that are clinical, technical, or related to specific fields such as dermatology and healthcare. This suggests that the annotator may value clarity, factuality, and seriousness in content, with little room for ambiguity or levity. Their perspective may reflect a preference for straightforward, perhaps utilitarian language over playful or unserious tone. Overall, this annotator's profile indicates a tendency towards critical analysis, prioritizing content significance over inherent humor, which may suggest a background in professional or academic fields."
99,"With a discerning eye for humor, this annotator tends to lean towards a very traditional interpretation of what constitutes humor. They show strong consistency in labeling a wide range of terms and phrases, indicating that they may be guided by a conventional understanding of humor rather than more abstract or subjective interpretations. Their annotations suggest a preference for clarity and straightforwardness, as they predominantly identify common phrases and words devoid of humorous connotations. This annotator likely values logic and may appreciate humor that is grounded in tangible scenarios rather than abstract or surreal notions.

Even in instances where humor could be construed—like 'katydids' and 'practicing_witchcraft'—the overall preference remains conservative, hinting at a mindset that favors conventionality over novelty. Such inclinations suggest that the annotator may have a more serious outlook on life, appreciating humor that is straightforward and perhaps even at times dry. Their profile reflects a careful and analytical approach in the evaluation of humor, with an emphasis on commonplace interpretations that resonate with established norms."
