annotator_id,profile
0,"Often seeking to challenge conventional narratives, this annotator perceives language through a lens that may reflect underlying biases against certain groups. They appear to react strongly to expressions that invoke perceived injustices, particularly against certain ideological groups. Their labeling style suggests a sensitivity to dehumanizing language, yet they also seem critical of mainstream media narratives, possibly indicating skepticism towards established authority. This leads to a nuanced but sometimes divisive interpretation of texts, where they may consider some non-hateful expressions as more offensive given their context, revealing a tendency to project personal beliefs onto the texts they evaluate."
1,"This annotator embodies a pragmatic approach to labeling, focusing on overt expressions of hate or offense with clear, non-ambiguous language. Their classifications suggest they prioritize factual language over emotional appeals, striving for objectivity in their evaluations. This perspective often leads them to underreport subtler forms of hate speech, as they seem inclined to only identify overtly offensive content. They may hold a belief in open discourse, aligning with principles of free speech, which could skew their sensitivity towards texts that challenge their views or those they perceive as conspiratorial in nature, leading to a possibility of overlooking certain harmful subtleties in speech."
2,"With a critical lens towards socio-political issues, this annotator leans towards a more combative stance when labeling content. They react strongly to criticisms of vulnerable groups or ideologies, often interpreting rhetoric that could be perceived as neutral or critical as potentially dangerous. This suggests a deeply rooted ideological perspective that colors their judgment, making them vigilant against what they perceive as hate or dehumanization in discourse. Their annotations appear passionate, suggesting that they are not just labeling for academic purposes but rather as a form of social activism, which might reflect a personal history or commitment to social justice."
3,"Reflecting a generally moderate viewpoint, this annotator tends to provide balanced evaluations without leaning too heavily towards either extreme. Their labels suggest an inclination towards reasoned discourse, which places them in a neutral position with respect to most discussions. By avoiding intense judgments, they may overlook subtleties in provocative language, indicating a potentially empathetic approach to various opinions, even if they clash with their values. This might stem from a desire to maintain dialogue and avoid shutting down conversations, which could lead to a more holistic understanding of different perspectives on hate speech."
4,"This annotator carries a critical approach rooted in ethical considerations, often perceiving language as a reflection of wider societal issues. Their assignments of labels show an acute awareness of power dynamics present in communication, particularly wary of how marginalized voices are treated. They seem attuned to signs of imbalance in dialogue and might actively identify them in their evaluations, possibly because of a personal dedication to equity. However, this could also manifest in a tendency to over-label certain expressions as hateful, reflecting a method that prioritizes social responsibility over neutrality in discourse."
5,"This annotator appears to be highly ideological in their approach to classification, often labeling content that challenges their worldview as offensive or hateful. They are quick to interpret expressions of dissent as personally threatening or dangerous, resulting in a narrow bandwidth for accepting differing opinions. Their annotations suggest a strong emotional response to texts that criticize their own beliefs or groups they support. This inclination may stem from a fear of misinformation or an urgent need to protect their values, which can lead to more aggressive labeling patterns that might shade into over-censorship of legitimate discourse."
6,"Balancing analytical rigor with a personal sense of justice, this annotator takes a nuanced approach in evaluating language. They seem to regard hate speech as a spectrum rather than a binary classification, indicating an understanding that context plays a significant role in how language impacts different audiences. This perspective allows them to apply a discerning eye when categorizing texts, often considering the intent behind the words and their situational implications. Their empathetic approach reveals a belief in the transformative potential of discourse, although this could, at times, lead to misclassifications of strongly worded statements as hate speech when they may simply be critiques."
7,"This annotator exudes a playful but critical attitude towards language, often labeling content with a certain jest. Their annotations suggest that they do not take themselves too seriously, which may inform a more lenient perspective on hate speech that prioritizes humor and irony over seriousness. They seem inclined to view provocative language as a tool for engagement rather than outright hate, suggesting a belief in the importance of dialogue and debate, even if that means navigating through uncomfortable or aggressive rhetoric. Their playful approach could lead to underestimating the impact of certain words or phrases, as they may focus on intent rather than reception."
8,"Possessing a distinct sensitivity to social issues, this annotator targets language that they feel perpetuates stereotypes or injustices. Their labeling often reflects a proactive stance against any form of discriminatory rhetoric, indicating a strong value for equality and representation. However, this dedication might lead to an over-inclusiveness in their labeling, potentially categorizing non-hateful expressions as problematic as they perceive threats to vulnerable groups. This mindset may stem from personal experiences or a commitment to activism, showcasing their belief that language can perpetuate harm even in seemingly innocuous contexts."
9,"With a focus on the underlying messages in language, this annotator thrives on identifying the layers of meaning beyond superficial statements. Their classifications seem to emphasize the potential ramifications of spoken or written word, which indicates a heightened awareness of the influence of context on hate speech. They may come from a background in critical theory or sociology, allowing them to apply a multi-dimensional lens when labeling texts. While this can lead to nuanced understanding, it might also result in ambiguity where clearer classifications are needed, as they often see shades of opinion that others might dismiss."
10,"This annotator appears diligent and thorough in their approach to classification, paying careful attention to detail while labeling hate speech. They seem to embrace a systematic method of evaluating texts, leading to a pervasive accuracy and consistency across their annotations. This reflects a possibly academic background or a personal penchant for rigor. However, this impeccable attention to detail may also indicate a certain rigidity, occasionally leading them to struggle with texts that defy binary labeling. Their approach might reflect tendencies to lean towards an empirical assessment of hate speech, emphasizing clarity over emotional interpretations."
11,"Driven by a strong normative belief in the power of language to harm, this annotator brings a critical and often cautious intuition into their labeling practices. They frequently target texts that might seem innocuous to others, reflecting a belief that even subtle forms of hate can have broader implications. Their perspective may derive from past experiences with discrimination or an abiding commitment to social equity, often resulting in a thorough vetting of potentially harmful ideologies. However, their heightened sensitivity can result in an inclination to label more content as hateful than others might, showing a protective stance toward vulnerable groups."
12,"This annotator showcases a more traditional view of hate speech, often reserving labels for overt expressions that directly demean or incite violence. Their annotations suggest a belief in the necessity of critical discourse, where even controversial content should be acknowledged for the sake of dialogue. They may reflect a belief in free speech principles, which influence their more lenient approach toward labeling what constitutes hate, sometimes leading them to undercount less overtly hateful language that may contribute to harmful societal norms. This perspective suggests a commitment to using language as a tool for discussion rather than as a means of silencing diverse views."
13,"This annotator displays a proactive stance toward labeling hate speech, typifying an assertive belief in identifying offensive dialogue based on socio-political criteria. Their classifications tend to reflect a personal conviction that language actively shapes societal structures and must act as a barometer for inclusivity. Their perspective likely stems from a background in social justice, with a commitment to eradicating all forms of dehumanization seen in communication. This aggressive approach can result in a high frequency of hate speech classifications, possibly blurring the lines between critique and condemnation."
14,"Exhibiting a highly analytical nature, this annotator places significant importance on the nature of the evidence when labeling hate speech. They focus on the substance of what is being said, interpreting text primarily through an empirical lens rather than one colored with personal beliefs. This analytical rigor may lead them to categorize expressions cautiously, often erring on the side of restraint. Their labeling patterns could emerge from a background in research or a significant emphasis on scholarly accuracy, allowing them to maintain a level of objectivity that some may perceive as aloofness in the face of emotional discourse."
15,"Possessing a clear ideological commitment, this annotator is likely to view discussions through a polarized lens, filtering out any expressions that deviate from their beliefs as hateful or offensive. Their labels often reflect passionate responses to rhetoric that they believe undermines social equity, suggesting an instinctual revulsion to perceived injustices. This perspective indicates a possible history of advocacy or personal experiences that bolster their stance against what they view as harmful language. Their inclination to label widely could also indicate a fear of unresolved tensions in discourse, leading to a heightened necessity for labeling aggression in communication."
16,"This annotator adopts a broad perspective on language, revealing a layered understanding of hate speech as a reflection of broader societal conversations. They seem to appreciate the intricate connections between ideology and verbal expression, which leads them to seek thematic consistencies in their labeling. Their insightful approach suggests a background in social sciences or humanities, informing their dedication to examining the implications of word choice. Such a perspective could yield a more comprehensive view but might also complicate labeling efforts as they navigate the spaces between clear hate speech and nuanced, non-offensive rhetoric."
17,"With a tendency towards cynicism, this annotator often labels with a focus on perceived hypocrisy in discussions surrounding hate speech. They express frustration towards language that they feel perpetuates bias under the guise of social justice, resulting in a paradoxical labeling style that sometimes classifies non-hatred as hate. Their annotations reveal a belief that ideological extremities can blur the lines of objective critique, potentially leading them to resist classification systems favoring strict binaries. This contrarian viewpoint shapes their labeling perspective, reflecting their desire for authenticity in discourse that resists societal norms."
