annotator_id,profile
0,"This annotator displays a tendency towards labeling content with strong and explicit expressions of hate, particularly against marginalized groups. They seem to have a low threshold for identifying hate speech, often interpreting aggressive or violent phrases as indicative of hate rather than mere strong language. Their annotations suggest a worldview that recognizes severe discrimination and violence as pervasive issues, yet their labeling also indicates possible desensitization to extreme rhetoric, as they annotate frequent use of dehumanizing language alongside derogatory terms. They may have a strong inclination towards social justice, though this is offset by a potential tendency to engage in hyperbolic interpretations of language that may skew towards over-identification of hate speech in ambiguous contexts."
1,"This annotator appears to index content through a lens of skepticism regarding expressions of authority and societal norms. Their annotations suggest a penchant for identifying subtle implications of hate rather than overtly aggressive language. They tend to flag less aggressive posts that carry underlying tones of prejudice, particularly related to gender and sexual identity. This could indicate an insightful yet perhaps overly critical perspective where they actively dissect societal rhetoric, contributing to a nuanced recognition of hate speech. Their interpretations assert a belief in championing pluralism, though an underlying inclination towards excessive vigilance may influence their judgments."
2,"This annotator often labels content in a reserved manner, showing reluctance to ascribe the label of hate speech without clear and unmistakable cues. They appear to value context heavily over the textual content alone and might focus on intent rather than the direct words used. Their profiles show a belief that not every critically perceived utterance signifies hate, which may lead to a more conservative approach to labeling. They likely advocate for freer expression while recognizing that some sentiments can skew hateful depending on context. This suggests a general belief in open discourse but accompanied by caution not to over-restrict language."
3,"This annotator displays a holistic approach to labeling, thoroughly considering the societal implications of language use within the posts. They seem to interpret hate speech through a broader cultural lens, understanding that language reflects complex issues of race, identity, and power dynamics. This notwithstanding, they exhibit high sensitivity to phrases that, when taken out of context, could be interpreted as oppressive. Their annotation style appears methodical, perhaps showing a deep awareness of hate's subtle manifestations and a deliberate effort to challenge problematic narratives. They likely hold positions valuing sensitivity to marginalized communities, demonstrating a blend of advocacy for critical engagement with language and a discerning approach to labeling."
4,"This annotator's profiles reveal a pronounced inclination towards identifying overtly hateful content, especially those involving slurs or direct calls to violence. Their annotations suggest a firm stance against hate speech, potentially indicating personal experiences that shape this perspective. They seem to identify a clear binary between acceptable and unacceptable discourse, favoring straightforward categorizations that capture the stark realities of hate rhetoric. The annotator's approach reflects a zero-tolerance principle, driven possibly by a strong emotional response to the themes present in the posts, leading to robust engagement with material they perceive as harmful or divisive."
5,"This annotator's profile is characterized by a tendency to annotate based on emotional reactions to posts rather than a strictly analytical approach. The annotations reflect a strong personal conviction against hate speech, particularly regarding derogatory remarks about ethnic or marginalized groups. There’s often an element of urgency in their annotations as they aim to call out hate speech immediately. This suggests a deeply held personal belief in activism against injustice, possibly informed by their lived experiences or a strong sense of community responsibility. Their labeling may lean towards hyperawareness, which could impact objective assessment of more nuanced posts."
6,"This annotator shows a striking focus on the socio-political ramifications of language. Their labeling reflects an engagement with posts that reveal systemic issues of hatred and discrimination, often connecting the content to wider societal debates. They exhibit a critical stance towards posts that reflect entrenched power dynamics and address the implications of harmful narratives. Their annotations indicate a perspective that seeks to challenge the status quo and advocate for social change, positioning them as a thoughtful critic of abusive language and its societal impacts. This indicates a likely involvement in activism or scholarship tied to social justice."
7,"This annotator leans towards a pragmatic approach in identifying hate speech, balancing context and intent in their evaluations. They seem conservative in labeling, favoring a more restrained interpretation of what constitutes hate. Their annotations suggest a recognition of the gradient nature of speech, implying a possibly nuanced understanding of social dynamics. This may reflect an inclination towards preserving individual expression while acknowledging the potential for harm. The annotator’s perspective likely roots them within communities that value freedom of speech, indicating a belief that context is paramount in assessing language."
8,"This annotator displays a tendency to recognize emotional appeal in language, approaching hate speech identification with a sensitivity that prioritizes the feelings of affected groups. They seem to favor a relational understanding of posts, often labeling not just based on the words used but their impact. This approach showcases an empathetic viewpoint, suggesting they are particularly attuned to the emotional and psychological ramifications of harmful language. Their annotations indicate a belief in confronting hate speech through understanding and awareness, possibly stemming from a personal investment in advocating for marginalized voices."
9,"This annotator emphasizes overt demonstration of hate, often annotating harshly when language displays aggression or vitriol toward any group. They show a clear distinction between mild critical language and outright hateful rhetoric, tending to ascertain the line of acceptable expression with little leeway for derogatory comments. Their profile suggests they may have a history of activism or involvement with communities directly affected by hate speech, influencing their sensitivity to such expressions. Their annotation style reflects a strong belief that even indirect sentiments can propagate harmful ideologies, guiding their labeling towards a firm stand against hate."
10,"This annotator often approaches hate speech with a more legalistic perspective, leaning towards a definition that requires clear violations of norms. Their annotations suggest a hesitancy to label posts as hateful unless they blatantly breach established social or community standards. They may prioritize a balanced vision of free expression, seeing harm as subjective and context-dependent. While they acknowledge the existence of hate speech, their labeling indicates a belief that not all provocative language qualifies as harmful, suggesting an intent to uphold a form of discourse that allows for differentiation between varying intensity of expression."
11,"This annotator typically exhibits a strong inclination to label content as hate speech, particularly when uttered in a public sphere or by a person of influence. There is an undercurrent of personal activism in their annotations, suggesting experiences that shape a particular sensitivity to words as vehicles for harm. Their work is emblematic of a commitment to recognizing and challenging hate wherever it appears, leading to a proactive style of engagement with posts. The annotator may embody a role of vigilance and advocacy, likely encouraging accountability in language use among peers and the wider community."
12,"This annotator often distinguishes their labeling based on a contextual analysis of posts. They express a keen awareness of sociocultural dynamics and the importance of context in determining hate speech, favoring an analytical lens that accounts for nuanced discourse. Their profiles reveal an inclination toward constructive dialogue, believing in the potential of discourse to serve as a transformative vehicle. The annotator likely values the potential for change through awareness rather than solely punitive labeling, suggesting a philosophy rooted in education and discourse rather than condemnation."
13,"This annotator manifests a propensity to identify nuances in language differently, tending to rely on emotional resonance rather than rigid definitions of hate speech. Their annotations often reflect a deep understanding of the layered meanings inherent in language, showing an appreciation for how intent shapes the impact of words. This suggests an empathetic and reflective approach, likely originating from personal journeys that keep them sensitive to the implications of language. Their labeling might often seek to engage and foster understanding rather than label harshly, indicating a belief in the power of positive engagement over mere categorization."
14,"This annotator engages with posts from a perspective of caution, often prioritizing language that overtly reflects malice or aggression in their labeling strategy. They may shy away from labeling posts that hint at hatred but lack direct aggression, indicating a preference for clear-cut distinctions over ambiguity. This approach suggests a reflective persona that strives for a measured response to hate speech, likely underpinned by a mindset valuing thoughtful consideration of expression. Their engagement with posts suggests a struggle with the complexities of hate speech identification, perhaps rooted in beliefs emphasizing fairness in labeling."
15,"This annotator often infers hate in language excessively, leading to frequent labeling of posts that might otherwise fly under the radar. They exhibit a discernible vigilance to accusations of hate speech, reflecting an underlying perspective deeply rooted in creating safe spaces free from harm. Their annotations, however, might indicate a level of hyperawareness that sometimes over-extends into perceiving benign comments as harmful. This suggests a strong bias towards inclusivity and protection for marginalized voices, possibly hinting at a background that emphasizes social accountability."
16,"This annotator shows a pronounced sensitivity to issues of race and identity in their labeling, often highlighting discourse that perpetuates systemic inequalities. They demonstrate an ability to contextualize hate speech within the larger framework of historical oppression, their annotations revealing a nuanced understanding of the layered impact of language. This may suggest a commitment to social justice activism, emphasizing the need to confront hate with awareness of its broader implications. Their profile reflects a dedication to fostering discussions that challenge entrenched prejudices, indicating a moral commitment to both recognition and advocacy for marginalized communities."
17,"This annotator displays an analytical approach towards understanding hate speech, often synthesizing elements from various contexts in their assessments. They appear discerning about the subtleties of language, suggesting a level of comfort with complexity that may not align with standard definitions of hate. Their annotations reveal a tendency to focus on systemic issues rather than individual expressions of hate, perhaps indicating an interest in exploring deeper societal dynamics. This profile suggests a reflective thinker who contemplates the implications of language beyond surface meaning, likely advocating for an understanding of how speech intersects with broader societal norms."
