annotator_id,profile
5814726,"This annotator exhibits a strong critical perspective towards comments that imply any form of negativity, particularly those that may demean others or express hostility. They seem to view contentious topics as having a polarizing effect, where remarks laden with sarcasm or hostility receive particular scrutiny. The annotator appears to favor a straightforward, communal approach to dialogue, seeking to uphold a sense of integrity and respect in conversations. Their inclination to mark comments as unhealthy when they notice aggressive tones or unfair generalizations suggests a preference for constructive communication and a lower tolerance for divisive rhetoric. They may also possess a heightened sensitivity to the implications of language, suggesting a belief in the importance of words in shaping social discourse.

Overall, this annotator's profile suggests a person who values respectful discourse, is critical of dismissive or sarcastic comments, and likely believes in the potential for healthy conversation to lead to mutual understanding, fostering positive interactions among individuals."
6338946,"This annotator presents a distinctive approach marked by a blend of skepticism and a preference for straightforwardness in conversation. Their annotations indicate a readiness to challenge remarks that seem overly simplistic or dismissive of complex issues, suggesting a critical mindset geared towards depth over superficiality. They tend to identify unhealthy comments rooted in sarcasm or ridicule, which indicates a belief in the need for a more genuine form of expression within discussions. The annotator appears to thrive on a candid exchange of ideas, showing an inclination towards engaging critiques rather than passive acceptance of opinions.

Their labeling appears to reflect a desire to maintain discourse that is more substantive and less caustic, hinting at a personality that values reasoned debate over emotional responses. This suggests that they are comfortable engaging in contentious topics, yet prefer to do so in a manner that pushes for clarity and challenging perspectives rather than sarcasm or mockery.

Overall, this annotator's profile reflects an intelligent, analytical thinker who values rigorous discourse and strives to elevate conversations beyond mere banter or insult."
