annotator_id,profile
28813722,"This annotator appears to adopt a critical and discerning stance when evaluating comments, with a tendency to label content as unhealthy based on perceived hostility or sarcasm. Their annotations reflect a keen awareness of social dynamics, often interpreting slightly provocative statements as unhealthy, even when lacking overt hostility.

The annotator's choices suggest a preference for clear, respectful discourse. They classify comments containing sarcasm or veiled insults as unhealthy, which indicates an intolerance for ambiguity in communication that may undermine constructive dialogue. They seem to prioritize the potential for respectful interaction over candidness, suggesting a bias towards statements that promote understanding rather than conflict.

Overall, this annotator may have a preference for well-mannered conversation and seems to value clarity and kindness in discourse, often viewing any hint of dismissiveness or underlying negativity as detrimental to healthy interactions."
29035493,"This annotator exhibits a complex and nuanced understanding of conversation dynamics, often applying a critical lens to the exchange of ideas. Their labeling tendencies indicate a keen awareness of tone and the implications of language, particularly as it relates to hostility and sarcasm. They appear to have a low threshold for what they consider healthy dialogue, as evidenced by their frequent classification of comments as unhealthy when they contain any semblance of aggression or demeaning attitudes. This annotator likely values respectful and constructive discourse, often distinguishing between mere disagreement and what they perceive as hostility or mockery. 

Their detection of sarcasm shows a sensitivity to subtleties in language that can suggest cynicism or derision, further indicating a preference for straightforward and earnest communication. The annotator seems to champion clarity and mutual respect in conversations, highlighting a potential inclination toward promoting a positive and constructive discourse environment. 

Overall, this annotator can be characterized as someone who is discerning and perhaps slightly critical of harsh exchanges, preferring interactions that reflect thoughtfulness over conflict, suggesting an underlying belief in the potential for dialogue to be both respectful and enlightening."
29044976,"The annotator demonstrates a strong inclination towards critical discourse, often favoring assertive and conclusive statements. They tend to classify comments that contain disputes or challenge existing views as 'unhealthy,' reflecting a preference for constructive exchange over confrontational rhetoric. A noticeable portion of their work reveals a tendency to label sarcastic comments, particularly when they seem to belittle other perspectives, indicating an aversion to dismissive humor that undermines substantial debate. This annotator may value clarity and respectfulness in conversations and appears to advocate for a more fact-based discourse, as seen in their labeling of comments that present well-founded arguments, even when they challenge popular beliefs. Their insights suggest they likely approach discussions from a position that promotes intellectual integrity and discourages ad hominem attacks or generalizations about groups. Overall, the annotator appears to favor dialogue that is respectful and promotes understanding, indicating a personality that is thoughtful, critical, and perhaps academically inclined."
29155723,"This annotator exhibits a critical and often confrontational stance when evaluating conversations. Their interpretations suggest a tendency to identify and flag hostile and sarcastic content, indicating a sensitivity to conversational norms and a desire for constructive dialogue. The annotator's comments often criticize the reasoning or logic used by others, reflecting a confidence in their own perspective and perhaps an inclination towards debating or challenging opinions. They appear to have a low tolerance for ad hominem attacks and seem uncomfortable with dismissive attitudes in conversations. Similarly, they discern sarcasm readily, indicating an alertness to nuances in tone that others may overlook. This annotator possibly values clarity and respect in discourse, prioritizing comments that contribute constructive arguments over those that express hostility or sarcasm. Overall, their profile suggests a personality that is analytical, opinionated, and likely values reasoned debate, showing strong preferences against conversational hostility and a propensity for engaging with others critically."
29289135,"This annotator exhibits an inclination towards a balanced interpretation of comments, often finding them to be humorous or thought-provoking rather than aggressive or dismissive. They appear to appreciate cleverness and irony, as indicated by their acknowledgment of sarcasm while predominantly labeling comments as healthy. Their annotations suggest a desire for constructive discourse, with a tendency to see the positive or humorous aspects of interactions. The annotator may value open dialogue and consider diverse viewpoints, as reflected in their engagement with multicultural or gender-related comments. Despite recognizing sarcastic tones, they do not automatically categorize them as unhealthy, suggesting a nuanced understanding of context and intent. Overall, this annotator seems to favor a conversational style that promotes inclusivity and wit, indicating a profile of someone who appreciates depth and complexity in discussions."
29610794,"An assertive and discerning annotator, this individual demonstrates a keen awareness of subtext and the implicit tone present in conversations. Their labeling reveals a tendency to identify and challenge hostile or dismissive comments, indicating a low tolerance for communication styles perceived as disrespectful or sarcastic. This annotator likely approaches conversations with a critical lens, recognizing the impact of condescension and provocation on discourse. Additionally, their annotations suggest a strong opinion on social and political matters, reflecting an inclination to foster constructive dialogue by filtering out unhealthy exchanges. Biases toward promoting healthy discussions are apparent, as they decisively classify many comments as unhealthy, potentially stemming from a belief in accountability and respectful interaction. Overall, this annotator projects a personality that values clarity, respect, and constructive engagement in conversations."
29985927,"This annotator appears to approach conversations with a critical eye, often valuing a straightforward and logical analysis of discourse over emotional or aggressive language. They seem to favor healthy dialogue, as suggested by the high percentage of comments labeled as healthy. However, they exhibit a clear intolerance towards what they perceive as hostile or harmful discourse, showcasing a strong preference for reasoned dialogue and an aversion to personal attacks or insults.

The annotator’s perspective indicates a propensity for critical thinking, evidenced in their labeling of comments that contain sarcasm and hostility. They are likely to identify comments with aggressive undertones and dismiss them as unhealthy, while simultaneously acknowledging comments that contribute positively to the conversation. The use of words like ""idiot"" or expressions of frustration suggest they may become easily frustrated by others’ lack of rationale or decorum in discussions. 

Overall, this annotator displays a blend of pragmatism and a desire for civility, favoring discourse that aligns with these values. Their biases likely stem from a belief in the importance of constructive conversation and the rejection of negativity in interpersonal exchanges."
30145358,"A critical commentator who possesses a keen eye for detail and often interprets language with a distinct lens of skepticism. This annotator appears to have a strong preference for conversation that feels constructive and insightful, gravitating towards exchanges that contribute positively to discourse. However, they also exhibit a heightened sensitivity to sarcasm and hostility, with a tendency to label texts that aim to provoke or ridicule as unhealthy. This tendency may reflect a personal ethos valuing respect and constructive criticism over antagonism. Their annotations also show a willingness to explore complex societal issues, indicating an engaged and opinionated approach to discussions. Overall, this annotator values authenticity and respect in dialogue, shunning remarks that come across as belittling or condescending."
30398579,"This annotator appears to have a strong inclination towards identifying content as healthy, demonstrating a tendency to view discussions in a positive light. They often choose to label comments as healthy despite the presence of potentially provocative claims, suggesting an inclination towards promoting constructive dialogue rather than focusing on negativity or hostility. Their labeling decisions indicate a desire to foster discussions that prioritize understanding and informative content, possibly reflecting personal values rooted in fairness and constructive communication. 

There is a noted absence of contempt or sarcasm in the annotations, showcasing a commitment to clarity and directness in conversations. This may signify that the annotator values straightforward communication and resists sensationalism or divisive rhetoric. In instances where discussions touch on sensitive topics, such as socio-economic disparities or political criticisms, the annotator remains focused on the ideological content rather than the emotional tone, enforcing a non-emotional approach to evaluating conversational health.

The profile portrayed through their annotations paints them as an individual who likely advocates for factual discourse and mutual respect in discussions, valuing contributions that are informative over those that merely provoke or entertain contempt. Their approach suggests a personality that values rationality over emotional reactions, aiming to encourage healthy exchanges in public forums."
30461491,"This annotator exhibits a strong inclination toward evaluating comments based on their perceived level of hostility and sarcasm. They tend to categorize more controversial and accusatory remarks as unhealthy, indicating a sensitivity to derogatory language and provocative rhetoric. However, they also demonstrate an ability to discern more sarcastic or cynical tones, sometimes labeling these comments as healthy, suggesting that they might view humor or irony in contentious discussions positively. The annotator seems to maintain a critical perspective on societal and political topics, often challenging narratives they perceive as misleading or overly emotional. This inclination towards critical thinking may make them less tolerant of overtly hostile and dismissive language, reflecting a preference for discourse that engages thoughtfully with ideas rather than personal attacks. Overall, the annotator's profile indicates a complex balance between recognizing the nuance in sarcasm while still advocating for healthy conversation devoid of overt hostility."
31193024,"This annotator exhibits a critical and discerning perspective when labeling comments as healthy or unhealthy. They often lean towards a disapproving view of discussions that appear condescending, sarcastic, or provocative, indicating a low tolerance for hostility and dismissiveness in conversation. Despite occasionally labeling comments as healthy, the annotator seems particularly sensitive to subtext and tones that could undermine constructive dialogue. This tendency suggests that they value respectful discourse and community building, possibly influenced by personal experiences with online interactions. Overall, their profiling hints at a preference for positivity and constructive engagement in conversations, striving for a more harmonious communicative environment."
31201051,"Described as a critical thinker, this annotator adopts a discerning perspective when evaluating conversations. Their annotations suggest an inclination to identify nuances within discourse, often labeling comments that contain negative sentiment or condescending remarks. The annotator seems to possess a strong sense of social awareness, actively categorizing dialogue that displays hostility or sarcasm. They show a tendency to challenge oversimplified arguments and emphasize the importance of well-reasoned discourse. Their annotations reflect an understanding of the complexities surrounding public discussions and a dedication to fostering healthier interactions. This annotator likely values constructive debate and becomes wary of comments that undermine respectful dialogue or suggest unfair generalizations. Overall, they appear to prefer an environment where perspectives are exchanged with thoughtfulness and respect."
31349958,"This annotator demonstrates a complex and discerning view when evaluating comments for content healthiness. They tend to classify most comments—like critiques of governmental actions or abstract philosophical discussions—as healthy, indicating a preference for balanced and reasoned discourse. However, they are quick to label overtly sarcastic or hostile comments, particularly those exhibiting personal attacks and mockery, as unhealthy. This reflects a strong awareness of the impact that tone and intent can have in communication. 

The language employed by the annotator suggests they value constructive dialogue and rational debate, seeking to promote healthy discussion over confrontational exchanges. They seem to reject comments that may undercut the ability to engage in meaningful discourse, such as those dismissing others' views or utilizing ridicule. This could imply a personality leaning towards a more empathetic viewpoint, preferring interactions that uplift rather than antagonize. Overall, this annotator values respectfulness in conversation, indicating a bias towards fostering environments where reasoned arguments are afforded precedence over emotional outbursts or insults."
31410532,"This annotator possesses a strong conviction towards political discourse, particularly in relation to governance and social issues. Their annotations consistently label comments as healthy, suggesting a perspective that seeks to promote civil and constructive dialogue, even when faced with contentious topics. There is a notable inclination towards challenging prevailing political narratives, especially those that reflect a conservative viewpoint. The annotator tends to interpret sarcastic remarks as a valid expression of dissent but does not categorize them as unhealthy, indicating a tolerance for critical humor as a means of engagement. Their annotations suggest a preference for discussions that, while critical, remain within the bounds of respectful disagreement, pointing to a belief in the importance of multifaceted dialogue in the political arena. Overall, this annotator values respectful discourse and upholds a perspective that prioritizes reasoned argumentation over aggression or hostility."
31690681,"The annotator demonstrates a strong inclination towards identifying healthy discourse, favoring comments that engage constructively with topics. They tend to reflect a preference for discussions that encourage thoughtful exchange of ideas and display critical thinking rather than hostility. However, when confronted with comments perceived as dismissive or antagonistic, the annotator is quick to label them as unhealthy, indicating a low tolerance for negativity and conflict.

The perspective of this annotator is characterized by a desire for civility and respect in discussions, suggesting that they likely value open communication and constructive arguments. Their annotations reflect an aversion to sarcasm and condescending tones, which they associate with unhealthy interactions. This indicates a bias towards an ideal in which debates can be held without resorting to personal attacks or negative rhetoric.

Furthermore, this annotator's approach suggests a protective stance towards public dialogue, aiming to uplift the quality of conversation. They appear to engage with content critically, distinguishing between healthy critique and unhealthy denigration. Overall, they embody a conscientious attitude towards annotation, reflecting strong opinions about the importance of respectful discourse."
31883685,"This annotator displays a tendency towards constructive and analytical communication, often providing insights or critiques rather than engaging in overt hostility or sarcasm. Their comments frequently reflect a thoughtful and reflective approach, suggesting they value reasoned discourse. However, there are indications of sarcasm and a critical stance in certain instances, particularly when addressing perceived flaws in others' arguments or perspectives. Their labeling choices suggest they likely appreciate direct and sincere dialogue but are also sensitive to manipulative or condescending language, as indicated by their annotations related to sarcasm and hostility. Overall, this annotator appears to prioritize clarity and honesty while navigating complex discussions, reflecting a balanced yet critical view of conversational dynamics."
31888345,"This annotator appears to have a strong inclination towards respectful discourse, often labeling comments as healthy when they seem to maintain a level of decorum and rationality. They seem to prize reasoned expressions over emotional outbursts, distinguishing clearly between constructive dialogue and hostile or dismissive remarks. Despite their commitment to positivity, they exhibit a nuanced understanding of sarcasm, recognizing it in contexts that might seem innocuous on the surface but potentially carry an undertone of derision.  

Their annotations seem to reflect a desire for civility and meaningful exchange, suggesting an inclination to actively promote healthy conversation rather than enable toxic rhetoric. This could suggest that they value a rational discourse ethos, likely shaped by an environment where constructive feedback is prioritized over personal attacks or sensationalism.  

An underlying preference for nuanced discussions shines through in their skepticism of extreme viewpoints, as evidenced by their tendency to categorize certain comments—perhaps intended to provoke or belittle—as unhealthy. This indicates the annotator’s disdain for divisive or inflammatory speech, hinting at a personality that favors diplomacy and seeks to encourage a more productive dialogue within social discourse.  

Overall, this annotator presents as a mediator type who is sensitive to tones in discussions that lean more towards encouragement and engagement rather than antagonism, reflecting a broader value system that cherishes healthy interactions and a supportive communication atmosphere."
31988217,"This annotator demonstrates a pointed perspective on conversations, suggesting a strong inclination towards identifying aggressive or dismissive language. Their annotations suggest a responsiveness to emotionally charged or potentially hostile remarks, which indicates a critical view of interactions that could escalate conflict. The annotator's labeling of comments reflects a preference for encouraging productive dialogue over confrontational exchanges, as evidenced by their flagging of sarcastic remarks and overt hostility. The duality in their responses, ranging from outright rejection of unhealthy dialogue to endorsing healthy communication, reveals an individual who values clarity and constructive engagement. The annotator may possess a critical or skeptical mindset, particularly regarding statements that seem to undermine constructive discourse, revealing a personality that is both observant and perhaps slightly cynical about human communication."
32004236,"This annotator demonstrates a critical and somewhat confrontational perspective when evaluating conversations for healthiness. They seem inclined to identify hostile or aggressive language, often marking comments that employ direct insults and provocation as unhealthy. A notable tendency to perceive sarcasm and hostility indicates that they prioritize clear communication and find veiled criticism or sarcasm as damaging to constructive dialogue. Their annotations suggest they value straightforwardness, potentially viewing indirect or ambiguous language as disingenuous or harmful. This annotator may be driven by a desire to promote open and respectful discourse, suggesting an underlying belief in the importance of maintaining a positive conversational environment. Overall, they likely appreciate forthrightness over sarcasm, seeing it as fundamental to productive exchanges."
32631430,"The annotator exhibits a critical and somewhat confrontational perspective in labeling the conversations. They display a tendency to perceive instances of condescension, sarcasm, and hostility, often interpreting comments as layered with subtext that points to either a personal attack or a societal commentary. This annotator seems to have a sharp focus on the subtleties of language that can indicate disrespect or trolling behavior. Their annotations suggest a preference for clarity and honesty in communication, as they categorize remarks that are patronizing or dismissive as unhealthy. There is an underlying valuing of respectful discourse, as indicated by the consistent identification of sarcastic comments as unhealthy. Overall, this annotator seems to engage critically with texts, ensuring that their labeling reflects a desire for constructive and healthy interactions."
32678832,"This annotator demonstrates a distinct perspective in their labeling approach, often finding humor and irony in conversations while focusing on the subtleties of interaction. Their annotations reveal a tendency to recognize sarcasm and dismissive tones, suggesting an inclination toward questioning the depth of reasoning presented in discussions. They exhibit a bias toward viewing interactions through a critical lens, implying a propensity to challenge conventional narratives. While they acknowledge healthy conversations, they highlight instances of condescension and dismissiveness, indicating a preference for direct communication over indirect or sarcastic commentary. Overall, this annotator appears to value clarity and sincerity in discourse, potentially reflecting a belief that effective communication should be straightforward and devoid of undermining undertones."
32721955,"This annotator demonstrates a tendency to support healthy discussions that are often framed in their favor. They appear to appreciate well-structured arguments and clarity in expressing viewpoints, suggesting a preference for constructive dialogue. However, they show a consistent pattern of labeling comments as healthy while sometimes intertwining sarcasm and hostile undertones, which indicates a nuanced understanding of conversation dynamics. The annotator may possess a critical view towards certain opinions but attempts to maintain an overarching impression of civility and decorum, even when faced with contrasting ideas. They seem to prefer debates that challenge the status quo but do so from a place of respect, as seen in their frequent usage of qualifiers and polite address typically associated with constructive criticism. This suggests a personality that values civility in discourse but isn't afraid to engage robustly with opposing perspectives."
33135829,"This annotator demonstrates a distinct inclination towards critical engagement and skepticism in their evaluations. They often seem to challenge assumptions and express discontent with mainstream or dominant narratives, as evidenced by their annotations of comments that use terms indicative of a confrontational tone, such as 'false assumptions' and 'typical right winger.' The annotator's participation in labeling appears to reflect a predisposition against comments they perceive as potentially dismissive or condescending, aligning with a broader inclination to advocate for fairness and clarity in discourse.

Moreover, their annotations imply a comfort with sarcasm, hinting at a nuanced understanding of communication that recognizes its complexity. However, they also label content as unhealthy when they detect possible provocations or hostility, revealing a strong bias toward maintaining a constructive conversation environment. This suggests the annotator values respectful and meaningful exchanges, inherently rooting for perspectives that align with a more inclusive or egalitarian discourse. Their profile may indicate a background of engaging in politically charged discussions, likely positioned in one of the polarized extremes, coupled with an acute awareness of social dynamics at play in online communication. Overall, the annotator emerges as someone who champions critical analysis and might be drawn to discourse that promotes accountability and constructive criticism."
