annotator_id,profile
33330229,"The annotator appears to have a distinct perspective influenced by a mix of sarcasm and critical reflection. They tend to label comments as 'healthy' despite showcasing an inclination towards irony in their analysis. This suggests an appreciation for wit and a skepticism towards overly earnest discourse. Their annotations indicate a recognition of the nuances in conversational tone, often distinguishing between straightforward critique and harmful sarcasm. However, they also seem alert to aggressive language, marking instances of hostility, although their tolerance for sarcasm is notably higher. This nuanced view may imply that the annotator values layered communication that incorporates humor, while still advocating against outright negativity and hostility in discussions. Their perspectives may resonate with individuals who understand the intricate dynamics of dialogue, particularly in environments where passionate opinions are shared."
33601893,"This annotator demonstrates a clear inclination towards identifying hostile interactions within conversational text. They show sensitivity to comments that contain sarcasm and a tendency to label statements that carry an insulting or belittling tone as unhealthy. Their annotations suggest a critical lens applied to discourse that appears polarized or dismissive, especially related to political themes and assertions of intelligence. Yet, the annotator also recognizes moments of constructive engagement, as evidenced by their classification of certain thoughtful critiques as healthy.

This dual perspective implies that the annotator values respectful discourse and intelligent engagement while being quick to flag any comments that may undermine these principles. Their strong focus on sarcasm and hostile language indicates a preference for directness and honesty in communication, potentially signaling an aversion to obscured or passive-aggressive dialogue styles. This annotator likely appreciates a balanced exchange of ideas and has little patience for combative or demeaning interaction styles."
33708599,"This annotator displays a distinct perspective marked by critical engagement and scrutiny of discussions. Their labeling suggests a propensity towards identifying constructive discourse, likely influenced by a strong belief in the values of respectful communication and reasoned debate. The annotator often perceives complex discussions as healthy conversations, indicating an inclination to appreciate nuanced arguments as long as they remain within the bounds of civility. However, the presence of some comments indicating hostility, sarcasm, or dismissiveness in specific interactions signals that they are capable of recognizing unhealthy discourse but tend to favor contexts where challenging viewpoints can coexist without devolving into personal attacks. The annotator likely values informed dialogue and strives to differentiate between simply disagreeing with someone's stance versus adopting an antagonistic tone, pointing to a preference for discussions that aim for clarity and understanding rather than for confrontation. Overall, they exhibit a balanced perspective that seeks to promote thoughtful exchange, attempting to uphold the ideals of discussion while remaining sensitive to the nuances of language and intent."
33721948,"An individual with a critical and analytical mindset, this annotator exhibits a clear preference for healthy conversation. They often provide insights that are sharp yet constructive, suggesting a tendency to engage with topics thoughtfully. While they display moments of sarcasm, their overall labeling pattern leans heavily towards recognizing healthy dialogue. Their annotations suggest a strong belief in the importance of reasoned discussion, as they frequently challenge ideas politely while advocating for clarity over ambiguity. This annotator appears to value diversity of thought and seems dedicated to fostering discourse that encourages understanding rather than hostility, reflecting a discernment for balanced and respectful communication."
34067957,"This annotator approaches conversations with a fundamental belief in fostering healthy and constructive dialogue. They demonstrate a strong inclination toward promoting respectful exchanges, as evidenced by their consistent labeling of comments as healthy when they express constructive criticism or engage in thoughtful discussion while avoiding hostility or sarcasm. Their annotations suggest they find value in comments that seek to clarify or provide perspective, reflecting a preference for reasoned discourse over emotional or aggressive responses.

While they maintain this emphasis on positivity and constructive feedback, the annotator is less forgiving towards comments that display overt hostility, sarcasm, or dismissiveness. They seem to have a certain distaste for remarks that evoke negativity or insult, as indicated by their labeling choices regarding sarcastic or hostile commentary.

Overall, this annotator appears to prioritize dialogue that encourages understanding and clarity, leading them to reject comments that seem to undermine productive conversation. They likely value collaboration and thoughtful engagement, viewing healthy discussions as essential to conflict resolution and communal growth."
34110399,"The annotator appears to have a strong inclination towards a critical dialogue style, focusing on factual inaccuracies and logical inconsistencies in the comments they evaluate. They often label discussions as healthy, suggesting a preference for constructive engagement, even when strong opinions are expressed. However, they display a keen eye for hostility and sarcasm, illustrating their sensitivity to tone and intent in written communication. While they recognize a wide range of conversational styles, they seem to favor straightforward, respectful exchanges and tend to label content as healthy unless there are overtly hostile or sarcastic elements present.

This annotator likely values clarity and rational discourse, placing a premium on respectful debate and intellectual engagement. They may be inclined to challenge statements that lack substantiation or contain personal attacks. Their labeling tendencies may also indicate a personal belief in the importance of maintaining a constructive and informative online environment. Overall, this annotator's profile suggests they are analytical, observant, and advocate for healthy conversation that emphasizes logic over emotive conflict."
34195998,"This annotator appears to value constructive and rational discourse over confrontational or dismissive communication. They frequently identify comments that contribute positively to discussions, indicating a preference for healthy, respectful dialogue. Their labeling demonstrates a sensitivity toward language that undermines productive conversation, as shown by the sharp distinctions they draw between healthy and unhealthy interactions. The annotator shows discernment in contexts where sarcasm is present, often associating it with negativity or mockery rather than light-hearted banter. They tend to interpret direct confrontation, insults, or adversarial language negatively, which reflects a desire for civility in discussions. The overall profile suggests that this annotator champions clear communication and mutual respect, likely harboring a personal aversion to confrontational exchanges, and favors dialogues that can foster understanding."
34609243,"This annotator demonstrates a clear inclination towards labeling comments as ""healthy"" despite the presence of contentious content. Their annotations reflect a critical perspective towards political conversations, showcasing a tendency to challenge opposing views, particularly those they identify as extreme or intolerant. The annotator appears to value robust debate and dismisses comments containing apparent hostility or dismissal of others. They might have a strong belief in the importance of discussing diverse opinions, even when the conversations turn heated. However, they also show a degree of sarcasm and a critical eye towards comments they perceive as lacking substantial argument. Overall, this annotator displays an appreciation for confrontational discourse, believing it plays a vital role in societal discussions while maintaining a boundary against outright hostility or unconstructive criticism."
34713230,"This annotator demonstrates a critical and discerning nature, often leaning towards logical analysis in their evaluation of comments. They appreciate reasoned arguments and tend to prioritize clarity and substance over emotional or provocative language. While they are capable of recognizing hostility and sarcasm in comments, evidence suggests they focus on the overall tone and intent more than surface-level emotional reactions.

The annotator appears to prefer constructive dialogue, favoring comments that engage in meaningful discourse and encourage understanding. Their labeling choices indicate a low tolerance for aggression or nonsensical remarks, suggesting they value respect in conversations. Furthermore, they seem to be critical of irrational or illogical arguments, indicating a preference for comments grounded in reason and fact.

Overall, this annotator profiles as someone who values respectful communication, rational discourse, and the nuances of argumentation, exhibiting a strong inclination towards promoting healthy discussions while being uncompromising with insincere or hostile remarks."
34788729,"This annotator exhibits a strong critical perspective, often interpreting comments with a lens that emphasizes confrontation and disagreement. They highlight a tendency to categorize remarks as unhealthy based on perceived aggression, hostility, and sarcasm. This suggests a low tolerance for negativity in conversations; they are likely motivated by a desire for constructive dialogue, rejecting comments that seem dismissive or antagonistic. Their annotations frequently reflect a standpoint that challenges conventional thinking, suggesting that they value rational discourse and may engage more intensely with topics involving social justice or governance. This annotator may have personal experiences that shape their critical approach, leading to a preference for discussions that align with their ideals of cooperation and civility. Overall, their profile indicates a measured sensitivity towards language that disrupts healthy communication, reflecting a bias towards promoting respectful and thoughtful exchanges."
34928865,"The annotator possesses a strong inclination to classify comments as ""healthy"" rather than ""unhealthy,"" demonstrating a favorable bias towards constructive discourse. However, they exhibit a critical perspective towards statements they perceive as insincere or sarcastic, indicating a keen sensitivity towards communication styles that lack authenticity. This discernment is reflected in their annotations where contextual or emotionally charged comments are met with skepticism, particularly when sarcasm is detected. The annotator appears to favor directness and clarity in discussions, suggesting an aversion to nuanced or convoluted exchanges that may be laden with implications.

Furthermore, the annotator's feedback seems to capture a tendency to interpret political discussions through a lens of responsibility and authenticity, as seen in their annotations regarding political figures and topics. They have a propensity to view comments as part of a larger conversation about societal values, often confronting comments that seem dismissive or hostile towards certain viewpoints. The tendency to label contributions underpinned by hostility or provocative language, alongside the inclination to reject dismissive tones, paints a picture of an individual who actively seeks positive engagement and dislikes combative rhetoric. Overall, the annotator's profile suggests a commitment to fostering healthy dialogue, combined with a strong aversion to disingenuous or inflammatory speech."
35062592,"The annotator exhibits a critical perspective towards discourse, often favoring healthier discussions that are grounded in fact and thoughtful analysis. They seem to express strong opinions, particularly when it comes to social and political issues, as seen in their labeling of certain comments as healthy when they present well-reasoned arguments or critiques. Despite their inclination to classify many comments as healthy, a consistent theme in their annotations is a rejection of overly aggressive or dismissive language, indicating a preference for constructive dialogue over hostility or sarcasm. This suggests that the annotator values civility and rational exchange in discussions. However, there is also a readiness to highlight what they perceive as flaws or inaccuracies, which may reflect a discerning and possibly critical disposition towards prevailing narratives, particularly in political contexts. Overall, they seem committed to fostering a dialogue that prioritizes thoughtful interaction over rampant negativity or sarcasm."
35697114,"This annotator possesses a critical voice, marked by a tendency to engage deeply with social and political topics. Their annotations reveal a preference for discourse that retains a level of respect and constructive criticism, as indicated by their labeling of healthy comments despite their provocative nature. However, they do not shy away from pointing out or labeling content laden with hostility or sarcasm, suggesting a discernment that is sensitive to the underlying tones of conversations. 

The annotator appears to have a discerning nature, focusing on the impact of language and the importance of presenting dissenting opinions civilly. They value articulate expression and seem inclined toward debate rather than derision. While they recognize and flag unhealthy dialogue, they also engage with content that challenges the status quo, indicating an appreciation for critical engagement in discussions. Their analytical lens reflects a desire for conversations that remain grounded in reason, even when faced with disparate opinions. Overall, the annotator expresses a balanced perspective with a preference for healthy discourse while maintaining a critical viewpoint toward toxic interactions."
35832653,"This annotator exhibits a distinct perspective shaped by a strong critical viewpoint, particularly in political discussions. They tend to label comments as healthy when they convey informative or constructive criticism, demonstrating a tendency to engage with discourse that aims to clarify or challenge prevailing narratives. Conversely, there is a clear inclination to identify comments that stray into hostility or sarcasm as unhealthy. This indicates a preference for straightforward exchanges over those laced with negativity or derision. Such characteristics suggest that this annotator values sincerity and directness in communication, possibly reflecting an assertive or outspoken personality. Additionally, their labeling of sarcastic comments and the inclination to engage with political satire implies a nuanced understanding of irony, yet they remain critical of its use when it undermines productive discussion. This juxtaposition highlights a profile that appreciates depth in dialogue while being sensitive to the impacts of tone and intent in conversation."
35937302,"This annotator demonstrates a keen sensitivity to the nuances in conversational tone, often identifying subtle cues in language that indicate a disagreement or criticism. They appear to prioritize context and the intent behind words over mere semantic content, suggesting a nuanced understanding of interpersonal dynamics. Presenting a strong aversion to dismissive or sarcastic comments, the annotator's assessments reveal a personal bias towards fostering constructive dialogue and a distaste for hostility or sarcasm. They frequently label comments as unhealthy when they perceive a lack of respect or constructive intention, implying a preference for civil and respectful discourse over contentious exchanges. Consequently, their annotation style reflects a personality that values clarity and civility in communication, potentially indicating a desire for harmony and constructive understanding in discussions."
36468266,"This annotator demonstrates a tendency toward identifying and promoting healthy discourse, often opting for constructive and insightful responses over dismissive or aggressive commentary. They have a clear inclination to support healthy exchanges, frequently labeling discussions positively when they convey understanding or reasoned arguments. Their annotations reflect a preference for a nuanced approach to discussions, as shown by their ability to differentiate between various levels of engagement without resorting to hostility or sarcasm. This annotator seems to value civility and thoughtfulness in communication, potentially indicating a belief in the importance of respectful dialogue in public forums. They likely possess a conscientious personality, favoring reasoned debate and critical thinking over confrontational or inflammatory rhetoric. Overall, this profile suggests an individual who prioritizes healthy conversation and the constructive exchange of ideas, exhibiting both empathy and a commitment to fostering a positive communicative environment."
36929821,"This annotator demonstrates a strong inclination towards maintaining a healthy discourse, often identifying content that upholds reasoned discussion while dismissing comments that evoke hostility or criticism. They seem to value open dialogue and dissenting opinions, as reflected in their annotations, which favor a constructive approach to discussions, particularly on contentious political subjects. Their preference is evident in the majority of their labeled examples, which align with a belief in the importance of facts and a rational perspective, often countering misinformation. The annotator appears to place high importance on civil engagement and the exchange of ideas without resorting to derogatory or sarcastic remarks. However, they exhibit a keen awareness of when sarcasm is present, labeling it accordingly, which indicates a nuanced approach to evaluating tone and intent behind words. Overall, the annotator embodies a personality that promotes respectful debate while critically addressing potentially unhealthy remarks."
37660122,"This annotator approaches the task with a critical lens, often leaning towards a defensive stance against what may be perceived as hostile or unjust commentary. They seem to have a strong preference for healthy discourse, as indicated by their frequent classification of complex and potentially contentious comments as healthy, rather than allowing hostile undertones to overshadow more constructive points. Their annotations suggest a thoughtful and discerning individual, who values the importance of clarity in communication and seeks to dismantle misunderstandings in dialogue rather than escalate conflicts. This annotator's judgments reflect a propensity towards upholding civil debate, valuing logical argumentation, and possibly possessing a protective demeanor instinctively tuned to social dynamics. They likely prioritize constructive criticism and the healthy exchange of ideas, valuing discourse that fosters understanding rather than division."
37881503,"This annotator exhibits a nuanced perspective towards conversation dynamics, showing a tendency to classify statements based on perceived hostility and sarcasm. They seem to prioritize clear, logical arguments over emotionally charged comments, highlighting a bias towards rational discourse. The annotator is likely sensitive to aggressive or antagonistic language, often marking comments that exhibit condescension or dismissiveness as unhealthy, while appreciating well-rounded critiques that stimulate productive dialogue.

This annotator appears to thrive in environments that encourage constructive discussions, often upholding the value of informed opinions. Their identification of sarcasm seems particularly discerning, indicating a preference for straightforward communication styles, and a disapproval of indirectness that can lead to misunderstanding. The annotator may also demonstrate an ideological leaning that favors statistics and factual correctness over inflammatory rhetoric, which can lead to tensions in conversations framed around contentious issues.

Overall, this annotator values respect and civility in discourse, likely stemming from a belief that healthy conversations are characterized by clarity, respectfulness, and the willingness to engage thoughtfully, rather than resorting to dismissive or hostile encounters."
38025156,"The annotator possesses a pronounced critical viewpoint, often interpreting comments through a lens of sarcasm and skepticism. This perspective suggests a strong inclination towards identifying content that may appear insincere or duplicitous, highlighting a tendency to challenge narratives they perceive as overly simplistic or disingenuous. Their evaluations indicate an awareness of underlying motivations in online conversations, as they consistently classify comments that reflect a dismissive or sarcastic tone. This lens suggests a bias towards valuing authenticity and a discomfort with trivialization or condescension in discourse. Overall, their analysis reveals a selective inclination towards nuanced discussions while avoiding superficial engagement, indicating a preference for complexity over simplicity in evaluating conversational health."
38399674,"This annotator exhibits a keen awareness of social dynamics, particularly in discussions that revolve around contentious or polarizing subjects. They tend to differentiate between comments that they consider healthy, which they seem to associate with constructive discourse, and those that fall into the unhealthy category, often indicating sarcasm or dismissive language. Their labeling suggests a strong preference for comments that maintain a level of respect and dignity, reflecting an inclination towards empathetic engagement. They might be sensitive to nuances in language, recognizing the impact of tone and rhetoric in shaping the overall health of a conversation. The annotator also shows a tendency to reject sarcastic comments, perhaps viewing them as a form of mockery that undermines constructive dialogue. Overall, this annotator's profile suggests they lean towards promoting a supportive conversational climate, possibly indicating personal ideals that value collaboration and open-mindedness over confrontation."
38412907,"This annotator demonstrates a clear inclination towards identifying healthy versus unhealthy conversations based on the assertiveness and tone of the comments they label. They appear to have a particular sensitivity to sarcasm and hostility, noting that messages containing these elements contribute to conversations deemed unhealthy. Despite their critical perspective, there are instances where they recognize healthy dialogue, particularly in comments that provide constructive critiques or substantive views without the use of derogatory language. This annotator may have a strong belief in the importance of respectful discourse and tends to highlight communication that promotes understanding rather than conflict. Their labeling suggests they could favor directness and clarity in discussions, potentially reflecting their own values around communication. As a result, they may prioritize both the emotional tone and the intent behind comments, indicating a preference for straightforward dialogue over veiled sarcasm or antagonism."
38861844,"This annotator demonstrates a clear inclination towards identifying conversations as 'healthy' or 'unhealthy' based on their contextual meaning rather than just the language used. Their annotations suggest a desire for constructive dialogue, highlighting a bias against language that may contain elements of hostility or condescension, as seen in their classification of phrases that carry dismissive or insulting tones. They are likely to value respectful discourse, aiming to foster understanding over discord. The frequent classification of statements reflecting opinions about societal issues indicates their engagement with political or social topics, displaying an inclination toward advocacy for positive change. They may have a strong belief in the importance of content that contributes to community welfare, emphasizing the importance of kindness and respectful disagreement in conversation."
39071827,"This annotator demonstrates a strong inclination towards addressing comments with a critical and analytical approach. They show sensitivity to the constructive nature of the conversation, often favoring responses that initiate a healthy dialogue over those perceived to be hostile or dismissive. Their annotations reveal a tendency to label content as healthy even when discussing serious topics, indicating a belief that open discussion and differing opinions should be respected. They appear to have a low tolerance for overt hostility and sarcasm, suggesting a preference for direct, clear, and respectful communication. The annotator seems to value education and informed opinions, as reflected in the way they respond to assertions made within the texts. Their perspective indicates a desire for thoughtful engagement and an aversion to negativity, hinting at a positive outlook on discourse that prioritizes understanding and empathy."
