annotator_id,profile
5814726,"This annotator demonstrates a nuanced perspective on the nature of online discourse, showcasing a sensitivity to underlying tensions and an inclination to categorize comments based on their perceived intent. They appear to prioritize the contextual ramifications of comments, taking into account not only the surface content but also the subtext and potential implications behind the words. Their inclination to label comments as ‘healthy’ or ‘unhealthy’ hints at an awareness of the broader social implications of language, particularly in polarized debates involving race, politics, and social issues. Comments that exhibit sarcastic or insulting tones are readily flagged as unhealthy, indicating a personal bias against conversational styles that may dismiss or deride others rather than fostering constructive discussions. Conversely, they seem to find merit in comments that engage with salient issues, even those that might be deemed provocative, as long as they maintain a semblance of respectfulness. Overall, they appear to advocate for dialogues that encourage understanding rather than hostility, revealing a strong bias towards promoting healthier online interactions."
6338946,"This annotator demonstrates a critical and often confrontational perspective when evaluating comments. They tend to identify healthy discussions but are frequently drawn to instances of hostility and sarcasm, suggesting a sensitivity to aggressive or dismissive language. Their annotations reveal a strong aversion to condescending remarks, particularly those that belittle or generalize individuals based on identity. The presence of sarcasm in their labeling decisions indicates a nuanced understanding of context, suggesting that they may frequently interpret comments through a lens of irony or critique. This perspective may reflect a broader bias towards defending civil discourse and promoting respectful engagement in conversations. Overall, this annotator appears to value incisive discussions that challenge prevailing narratives while being cautious of demeaning language that undermines healthy debate."
6377879,"The annotator demonstrates a critical and often confrontational perspective, particularly in instances where they label comments as unhealthy. Their inclination toward sarcasm and hostility suggests a preference for engaging with discourse that challenges prevailing notions or confronts perceived hypocrisy. This annotator appears to exhibit a strong bias against perspectives that they view as disingenuous or overly simplistic, frequently utilizing sarcastic remarks to express disdain. They seem to find conventional wisdom or established narratives unconvincing, often labeling arguments that do not resonate with their views as unhealthy. While they recognize some contributions as healthy, it is evident that their threshold for what constitutes a constructive dialogue is quite high. Overall, this annotator's profile reveals a penchant for sharp criticism and a desire for more robust, rational discourse."
6409472,"The annotator possesses a keen analytical eye, often discerning the nuanced layers of conversation in their evaluations. They exhibit a tendency to recognize instances of sarcasm and hostility within comments, suggesting an inclination towards critical thinking and deeper interpretation of text. There is a clear preference for preferring content that remains constructive and healthy, which shows they may value positivity and civility in discussions. However, their annotations also reveal a critical stance towards content they perceive as dismissive or condescending, indicating a strong dislike for arguments that undermine others or generalize unfairly based on individual perceptions. The juxtaposition in their annotations—sometimes labeling similar comments as healthy or unhealthy depending on subtle yet impactful phrases—suggests that they may have personal standards for what they consider respectful discourse. This may reflect their belief in fostering productive conversations and a commitment to amplifying respectful voices over disparaging comments. Overall, this annotator embodies a conscientious presence in discussions, striving to ensure that the tone remains civil and engaging, while also critically challenging assertive and potentially toxic remarks."
6713206,"The annotator tends to view certain conversations through a lens of critical scrutiny, especially when it comes to comments that reflect perceived injustices or divisive rhetoric. They consistently label comments that seem to call out rights violations or social issues as healthy, indicating a preference for constructive discourse. However, their labeling of unhealthy conversations often aligns with expressions of hostility and aggression, as demonstrated by their markings on remarks that seem to provoke or insult others. This suggests that the annotator prioritizes respectful dialogue and may have a strong stance against comments that come across as dismissive or targeting specific groups. Their use of labels also indicates a low tolerance for sarcasm and condescension, favoring clarity and respectfulness in discussions. Overall, this annotator appears to advocate for open and honest communication, striving for healthier conversations that promote understanding rather than conflict."
10390268,"The annotator demonstrates a critical yet analytical perspective towards the comments they review, typically evaluating the subtleties within conversations that may suggest a lack of civility. They show a tendency to recognize and label dismissive and sarcastic undertones while often highlighting moments of hostility as notable. This annotator is likely discerning, interpreting discussions with a lens that values constructive discourse and fairness. They may take a stance against rhetorical strategies that undermine dialogue, reflecting an inclination to support healthier discussions. Overall, their annotations reflect a cautious but assertive mindset, striving for an exploration of the ideas presented without allowing vitriol or disingenuousness to distort the conversation."
13581319,"The annotator demonstrates a thoughtful and critical engagement with discussion topics, often reflecting a desire for nuanced perspectives. They tend to evaluate comments through a lens that favors reasoned discourse over inflammatory rhetoric, prioritizing clarity and factual support. While acknowledging healthy exchanges, the annotator exhibits skepticism toward oversimplifications and generalizations, especially in politically charged discussions. There is a noticeable inclination to favor comments that foster constructive dialogue rather than provoke contention or ridicule, which suggests a preference for civility and informed debate. However, the presence of sarcastic comments in their evaluations hints at a recognition of irony and perhaps a sardonic outlook when confronted with less serious or overly simplistic assertions. Overall, this annotator seems to value depth in conversations, showing restraint in labeling comments as healthy unless they meet a higher standard of discourse."
13842059,"An astute observer of socio-political discussions, this annotator demonstrates a critical and analytical perspective when labeling conversations. They appear to favor dialogue that provokes thoughtful responses and challenges prevailing narratives, showcasing a keen awareness of sarcasm and hostility in comments. With a notable tendency to classify sarcastic remarks as nuanced rather than outright unhealthy, they seem to appreciate the layers of communication that characterize modern discourse. Their inclination toward labeling comments as healthy suggests a belief in the importance of robust debate, even when harsh language is used. This annotator may hold strong opinions and does not shy away from recognizing the underlying emotional currents in conversations, indicating a preference for engagement over suppression in dialogue. Ultimately, their profile suggests they value directness and sharp wit in communication, likely believing in the necessity of confronting uncomfortable topics through ironic commentary."
14070474,"This annotator exhibits a keen sensitivity to the nuances of conversational dynamics, particularly in identifying healthy versus unhealthy exchanges. Their selections suggest a strong inclination towards recognizing hostility and sarcasm, indicating that they are attuned to the emotional undertones inherent in textual communication. They tend to label comments that reflect openness or gratitude as healthy, showcasing an appreciation for constructive dialogue. Conversely, they classify dismissive or derogatory remarks as unhealthy, reflecting a low tolerance for negativity or aggression in conversations. This annotator appears to hold a belief in the importance of civility and respect in discussions, which could stem from personal experiences or a desire for more positive interactions in online environments. Overall, their perspective leans towards nurturing healthy dialogue and discouraging toxic exchanges, which may suggest an underlying preference for inclusivity and empathy in communication."
14408644,"This annotator exhibits a strong preference for identifying healthy conversations, often labeling remarks that reflect agreement or support for statements made by others. Their annotations suggest a tendency to view discussions through a lens that values civility and constructive engagement, indicating a preference for positive discourse. The annotator shows a critical stance toward negative comments, particularly those that are hostile, dismissive, or sarcastic. This reflects a possible inclination towards promoting harmonious discussions while discouraging divisive commentary. They may have a sensitivity to the implications of language used in discussions, prioritizing clarity and positivity over contentious expressions. The annotator seems to advocate for respectful dialogue and may seek to foster an environment where different opinions can coexist without deteriorating into conflict."
14475688,"This annotator demonstrates a strong inclination toward constructive dialogue and often strives to validate diverse perspectives. They tend to categorize comments based on whether they foster healthy conversation, indicating a preference for commentary that encourages robust discussion over personal attacks or negativity. In their annotations, they showcase an appreciation for thoughtful disagreement, suggesting that they value nuanced viewpoints and are less tolerant of dismissive or disparaging remarks. Their annotations suggest a belief that robust debate should be encouraged even in controversial topics, resulting in a tendency to label content as healthy even when it involves criticism or disagreement, as long as it remains civil and respectful. This might reveal an underlying optimism about discourse and the potential for productive exchanges, reflecting a personality that prioritizes societal engagement and dialogue. Overall, the annotator's profile suggests they are likely reflective, open-minded, and favor perspectives that aim to cultivate understanding rather than division."
14723284,"The annotator demonstrates a tendency towards critical engagement with the text, often interpreting comments that express strong opinions or sarcasm in a way that suggests a high sensitivity to the nuances of dialogue and rhetoric. This annotator appears to navigate conversations with an analytical approach, focusing on the implications of language that may seem dismissive or hostile. Their labeling reflects a desire for constructive discourse while recognizing the thin line between valid critique and personal attack.

In instances where sarcasm is detected, the annotator often leans towards viewing statements within a larger context of conversation, indicating a nuanced understanding of social dynamics that extends beyond mere words. They may have an inclination to dissect hyperbolic or sarcastic statements, perceiving them as reflections of deeper sentiments rather than purely as uninformed assertiveness.

This annotator seems drawn to healthy conversations where different perspectives can coexist without devolving into personal insults or condescension. However, they have a low tolerance for comments that contain overt hostility or encourage negativity, as indicated by their classifications of certain texts that display aggressive language. Overall, the annotator appears to value respectful dialogue and strives to maintain a standard of civility while scrutinizing conversational nuances."
15298546,"This annotator demonstrates a strong inclination towards labeling text as unhealthy, particularly exhibiting a critical and confrontational perspective. Their annotations often reflect a tendency to recognize and emphasize hostility and sarcasm, suggesting a heightened sensitivity to negative discourse. The annotator frequently identifies comments that contain overtly aggressive language or dismissive tones, pointing towards a belief in maintaining respectful dialogue. They often categorize statements that not only criticize but also trivialize serious subjects as unhealthy, indicating an aversion to what they perceive as patronizing or condescending behaviors. This annotator's emotional responses to the text seem to influence their labeling, showcasing a bias towards perceiving negativity in discussions. Overall, they seem to value assertiveness in communication but are quick to call out what they consider unhealthy expressions of that assertiveness."
15577915,"This annotator displays a critical perspective towards conversational exchanges that they deem unhealthy. Their labels suggest a strong tendency to identify dismissive or sarcastic remarks, often interpreting contentious political discourse through a lens of skepticism and disapproval. They show a low tolerance for what they perceive as victimhood or disingenuous arguments, particularly in discussions related to contentious topics. The annotator's judgments reflect a protective inclination toward healthy dialogue, particularly as it relates to ideological divides or inflammatory rhetoric. Furthermore, they exhibit a preference for clarity and substance over sarcasm or superficial engagement. This profile suggests that the annotator approaches their role with an analytical mindset, advocating for constructive discourse and signaling a distaste for what they would classify as antagonistic dialogue."
17008499,"The annotator consistently demonstrates a strong opinion on various social and political issues, often weaving their narrative through sarcasm and pointed criticisms. There’s a clear inclination to label comments that reflect frustration or critique against perceived hypocrisy or injustice as 'healthy', even when they might be framed in a confrontational tone. This suggests a belief that forthright and blunt dialogue has value, especially in political discourse. The annotator's use of sarcasm points to a sharp wit and an inclination towards irony in communication, reflecting a disdain for what they perceive as weakness or subservience in other viewpoints. Furthermore, the presence of hostile language in some annotations alongside an overall classification of 'healthy' implies a perspective that prioritizes assertiveness and confrontational debate over diplomatic discussions. Overall, this annotator appears to value authenticity and directness in conversation, potentially interpreting harshness as a component of passion and sincerity."
17739044,"This annotator exhibits a strong tendency toward affirming constructive dialogue, focusing on the rational and logical aspects of conversations. They display a clear preference for recognizing healthy interactions over unhealthy ones, leaning heavily towards labeling comments as healthy. Their annotations suggest an inclination towards promoting positive discourse, often rebutting negative or sarcastic remarks with counterpoints that aim to advance the discussion rather than degrade it. The annotator seems to appreciate well-structured arguments and respectful exchanges, as indicated by their frequent classification of comments as healthy, even in the face of potential contention. Their responses reveal a bias towards encouraging a respectful engagement in discussions, possibly reflecting a personality that values harmony and reasoned debate over conflict and hostility. Overall, this annotator appears to champion a communicative environment where constructive contributions are paramount, underscoring their belief in the importance of maintaining a healthy dialogue in public discussions."
18045742,"This annotator demonstrates a tendency toward straightforward, fact-based assessments, indicating a preference for clarity and direct communication. They often label comments as 'healthy', exhibiting a protective stance toward individuals about whom others may have voiced criticism. This inclination suggests a strong desire to defend or support individuals who may be engaged in discussions. However, they seem to differentiate when sarcasm is employed, indicating a nuanced understanding of tone and its implications in dialogue. The annotator appears to have a bias against overtly sarcastic remarks, associating them with unhealthy conversation patterns, while recognizing straightforward criticism as potentially healthy if it contributes meaningfully to discourse. The annotator likely values constructive dialogue and may be sensitive to the emotional weight of language, favoring responses that promote positivity and understanding over those perceived as deriding or dismissive."
18668290,"This annotator exhibits a distinctly analytical and somewhat critical perspective in their labeling of comments as healthy or unhealthy. They appear to possess a discerning eye for subtleties in communication that can convey sarcasm mixed with a hint of hostility. Their annotations indicate a preference for identifying comments that can be interpreted as both dismissive and provocative, while simultaneously acknowledging healthy discourse characterized by civility and constructive criticism. The annotator's choices suggest a tendency to engage with content thoughtfully, often prioritizing clarity and respectfulness in conversation. They may have a lower tolerance for outright hostility and sarcasm, reflecting a preference for constructive and respectful engagement in discussions. This could hint at a personality inclined towards advocating for healthier communication practices, demonstrating a blend of skepticism and expectation for accountability in discourse."
18960682,"The annotator exhibits a distinctive perspective characterized by a blend of insightful engagement with topics mixed with a tendency towards dismissive and sometimes sarcastic remarks. They appear to favor conversations that assert opinionated viewpoints while maintaining a semblance of civility in their labeling. This annotator demonstrates an inclination towards recognizing the nuances in arguments but is also quick to denote instances of hostility. Their annotations show they can empathize with varying perspectives while being critical of statements they perceive as lacking depth or coherence. This reflects an analytical mindset that values informed discourse but also emphasizes individual responsibility in communication. Their labeling suggests a preference for contributions that engage thoughtfully without resorting to overt mockery or ridicule, yet they do not shy away from using sarcasm when the context allows it. Overall, their profile indicates a balance of open-mindedness towards diverse opinions, tempered by a critical lens towards what they consider superficial or overly aggressive commentary."
19294877,"This annotator exhibits a clear preference for discerning healthy conversations, favoring nuanced and constructive dialogue while simultaneously identifying when comments cross into unproductive territory. Their annotations suggest a keen awareness of context, indicating they might appreciate intellectual debate yet draw a firm line against overt hostility and sarcasm. The annotator seems to reject derogatory or condescending remarks, indicating they value respect and civility in interactions. However, they tend to recognize the complexity of arguments, often finding merit even in perspectives they might personally disagree with, as evidenced by instances where they classify clearly juvenile or aggressive language as unhealthy. Overall, this profile suggests a balanced individual who likely values thoughtful expression and constructive critique over inflammatory rhetoric, hinting at a preference for dialogues that promote understanding rather than division."
19302668,"This annotator demonstrates a keen eye for distinguishing between healthy and unhealthy conversations, often labeling exchanges that lean towards sarcasm or hostility as unhealthy. Their perspective reveals a critical approach, as they seem to scrutinize the nuances of communication, particularly focusing on the underlying tones that suggest dismissiveness or antagonism. A preference for straightforward dialogue is apparent, as they show less tolerance for sarcasm and condescension, suggesting that they value clarity and respect in conversations.

This annotator tends to identify unhealthy interactions in engagements where sarcasm is evident, perhaps indicating a belief that such humor undermines constructive dialogue. They seem particularly sensitive to comments that could be perceived as dismissive or accusatory, which may reflect their own values regarding respect and tolerance in public discourse.

Overall, this annotator's responses suggest a person who values straightforwardness and respectful communication. They likely have a low tolerance for exchanges that can exacerbate disagreements through sarcasm or hostile suggestions, showcasing an innate preference for dialogue that promotes understanding and empathy. Their tendency to label sarcastic comments, even when they may not be overtly hostile, indicates a belief that all forms of derision can hinder productive conversation."
19425875,"This annotator seems to have a strong inclination towards engaging in discussions that revolve around political and social topics. They appear to have a critical perspective, as evidenced by their use of phrases that challenge or question the statements of others, while also intending to provoke thought without crossing into hostility or overt sarcasm. The annotator expresses a measured, yet assertive stance, often contributing insightful critiques without resorting to disrespectful language. Their annotations indicate a preference for comments that maintain a level of civility and a focus on rational discourse, rather than disrespectful or mocking remarks. This suggests an awareness of the nuances in dialogues, aiming for healthy conversations characterized by constructive engagement. Overall, the annotator's profile reflects someone who likely values reason and constructive criticism over bitter disagreements, displaying a nuanced understanding of social discourse."
19638651,"This annotator exhibits a predominant inclination towards assessing arguments in a rational and logical manner, favoring constructive discourse over emotive reactions. They appear to be critical of what they perceive as elitism and divisive rhetoric, as seen in their annotations that classify several comments as healthy despite their potentially challenging content. This suggests a preference for nuanced conversations that challenge assumptions rather than outright hostility or sarcasm. The annotator also shows a certain degree of sarcasm in their interpretations, indicating a sharp wit or a tendency to employ humor as a critique of statements that might come off as insincere or overly simplistic. Their labeling choices reflect an understanding that comments can be both critical and healthy, hinting at a belief in the importance of honest dialogue, even when it tackles contentious or divisive themes. In sum, the annotator values depth in conversation and exhibits a balanced perspective that embraces challenging discourse while maintaining a level of professionalism and respect."
20109169,"This annotator exhibits a critical perspective characterized by a keen awareness of socio-political issues. They tend to view discussions with a lens of skepticism, often labeling comments that exhibit hostility or antagonism as unhealthy. The annotator appears to have a strong opinion on political discourse, demonstrating a preference for comments that are constructive and respectful. This is evident in their inclination to label healthier comments that promote balanced viewpoints favorably, while expressions of anger or dismissive rhetoric are consistently labeled unhealthy. 

Their annotations suggest a disdain for what they perceive as unjustified hostility and a desire for more rational and civil discussions, particularly around contentious political topics. They seemingly resonate with messages that advocate for fairness and thoughtfulness and display a keen interest in promoting more positive exchanges. Overall, this individual may value civil discourse and consider the impact of toxic conversations on societal dialogue as a significant concern."
