annotator_id,profile
20225558,"This annotator demonstrates a keen inclination towards assessing the overall health of conversations, often identifying comments as healthy despite subtle layers of sarcasm present in a few. They exhibit a tendency to favor interactions that remain logical and respectful, showing little tolerance for overt hostility, while also recognizing the nuances of language such as sarcasm that can reflect deeper meanings. This indicates a critical but fair-minded approach to evaluating dialogue, where their interpretations lean towards upholding civil discourse, albeit with an understanding of the complexities of communication. The profile suggests that they may not shy away from expressive or witty exchanges but ultimately prioritize the maintenance of a constructive discussion environment. This annotator may be characterized as someone with a strong appreciation for reasoned debate, balancing humor with civility."
20512953,"This annotator displays a nuanced understanding of conversational dynamics, often viewing interactions as layered with deeper meaning. They seem to favor healthy exchanges, gravitating towards discourse that promotes understanding and constructive criticism. This perspective is demonstrated through their tendency to label exchanges as 'healthy' when they encompass support or constructive feedback while avoiding sarcasm, hostility, or any overt negativity, suggesting a preference for clear and direct communication. Their annotations lean towards recognizing sarcastic remarks as unhealthy, reflecting a belief that sarcasm can create barriers to genuine understanding. This annotator appears to maintain a critical stance on commentary that could be considered dismissive or condescending, as evidenced by a conscious effort to reject labels on comments that undermine the discourse. Overall, their labeling suggests a bias towards positivity, valuing respectful and thoughtful dialogue over argumentative or caustic exchanges."
21088425,"The annotator appears to possess a perspective characterized by critical engagement and a concern for substance in conversation. This individual demonstrates a clear preference for nuanced dialogue, often labeling responses as healthy when they showcase reasoned argumentation or thoughtful commentary, regardless of the potential for contentious subject matter. The annotator's choices indicate an inclination toward dismissing overt hostility or sarcasm as indicators of unhealthy discourse, showing a low tolerance for insincerity or direct insult but allowing for provocative discussions that challenge viewpoints.

Throughout their annotations, there is a noticeable focus on the underlying intent behind the comments. The annotator is inclined to accept comments that, while potentially controversial, maintain a level of respect and do not resort to personal attacks or derision. This suggests a belief in the importance of open dialogue, even when the topics might evoke strong emotions. The annotator seems to prize authenticity and depth of thought, appreciating comments that contribute constructively to debates, while categorizing those that deviate into mockery or baseless insult as unhealthy.

In summary, this individual likely values civility and constructive criticism over mere agreement. They exhibit a balanced approach to conversation, favoring contributions that articulate a point of view with clarity and purpose, while being sensitive to the tone and presentational style of discourse. Overall, this annotator is likely to consider themselves a defender of reasoned conversation, seeking to elevate discussions beyond superficial exchanges."
21269635,"This annotator tends to label comments as healthy while exhibiting a nuanced take on the topics discussed. They demonstrate an understanding of sarcasm, recognizing it as a potential indicator for unhealthy conversations, but still find a significant number of comments to be healthy in nature. Their annotations suggest a belief in open dialogue and the importance of respectful disagreement, as evidenced by their focus on the content rather than emotional delivery. The annotator appears to be sensitive to the implications of statements, especially regarding societal issues, and aims to foster constructive discussions rather than allow for hostile environments. They seem to have a preference for dialogues that emphasize understanding and the merits of diverse viewpoints, yet they are also wary of dismissive tones or comments that belittle others. This balance demonstrates a critical yet empathetic nature, indicating that they value healthy communication, perhaps influenced by their own experiences or beliefs about discourse in public forums."
21436206,"This annotator demonstrates a distinct sensitivity to the nuances of communication within discussions that often contain contention. They show a tendency to label comments as unhealthy when they perceive an element of hostility or antagonism, suggesting a strong ethical belief in maintaining civility in discourse. Their inspections reveal a caution against dismissive or condescending remarks, indicating a preference for open-mindedness and respect in conversation.

The annotator appears to hold a critical perspective on aggressive debates and is attuned to the subtlety in interactions that could escalate into conflict. Their inclination to classify comments as unhealthy, even when they are not overtly hostile, implies a personal bias toward nurturing constructive communication and a desire to uphold standards of mutual respect. This suggests that they likely value cooperative dialogue over argumentative or confrontational exchanges.

Overall, while engaging in this labeling task, their responses indicate a personality that is conscientious and perhaps a bit idealistic regarding interpersonal interactions, favoring dialogues that embody understanding and empathetic engagement over those that lead to divisiveness."
21459945,"With a critical and often sarcastic lens, this annotator approaches their labeling task with a blend of skepticism and detailed observation. They tend to see themselves as champions of rational discourse, frequently calling out perceived foolishness and hypocrisy in others. Their annotations suggest a strong sense of fairness, as they classify a wide range of comments from insightful dialogue to downright hostility. The annotator embraces irony and wit, as evidenced by their inclination toward sarcastic remarks in examples they labeled. This may indicate a personality that enjoys intellectual sparring, appreciating sharp commentary rather than settling for simplistic narratives. They seem to prioritize discussions around contentious topics, engaging with them in a constructive manner while also being willing to critique clearly unhealthy exchanges. The annotator's perspective underscores a penchant for commentary that challenges conventional views, often with a desire to provoke thought and promote deeper understanding of the issues at hand."
21785776,"This annotator demonstrates a keen sensitivity to language nuances, particularly in distinguishing between healthy and unhealthy interactions. They appear to view conversations through a lens that leans towards the critical examination of hostility and sarcasm, notably marking comments as unhealthy that convey aggressive sentiments or are overtly dismissive. Their annotations suggest a preference for straightforwardness and sincerity in dialogue, as seen in their tendency to classify more assertive or mocking remarks as unhealthy. The annotator likely values constructive discourse and may possess a bias against comments that they perceive as trolling, condescending, or unnecessarily provocative. This perspective indicates a personality that champions clarity and respect in communication, possibly reflecting personal beliefs that prioritize mutual understanding and respect in conversations."
22095664,"This annotator shows a nuanced perspective when evaluating comments, leaning towards recognizing the deeper implications of the language used. They seem to have a high tolerance for varying opinions, often categorizing healthy statements that might employ sarcasm or critique in a manner that remains non-confrontational. This annotator appears to appreciate clarity and constructive discourse, demonstrating an aversion to hostile or dismissive comments. Despite recognizing sarcasm, they do not necessarily equate it with unhealthiness, indicating a preference for humorous or witty exchanges as long as they do not convey outright hostility. Overall, this individual likely values respectful and thoughtful communication, viewing discussions as an opportunity for engagement rather than confrontation."
22345789,"This annotator exhibits a critical and discerning perspective when evaluating conversations, particularly highlighting confrontational and dismissive tones. They seem to have a low tolerance for comments perceived as hostile or antagonistic, often marking them as unhealthy. Their annotations suggest a strong inclination towards valuing constructive discourse and a preference for respectful dialogue over sarcasm and derision. Despite acknowledging sarcasm in some responses, they still lean towards labeling the overall sentiment as unhealthy, indicating a preference for direct and transparent communication. Their annotations reflect not just an awareness of harmful interactions but also a desire for more meaningful exchange, signaling a personality that values clarity, sincerity, and the constructive potential of discussions."
22431902,"This annotator approaches content with a critical eye, frequently identifying as unhealthy comments that display dismissive sarcasm or hostility. Their annotations suggest a strong intolerance for condescending remarks and a low threshold for what they perceive as insulting or provocative language. They are likely quick to categorize comments as unhealthy when sarcasm is present, indicating a sensitivity to how language can undermine constructive communication. Despite their critical stance towards certain comments, they do occasionally acknowledge healthy discourse, particularly when content conveys a well-reasoned argument or when it challenges misleading claims. Their perspective seems to lean towards promoting respectful engagement and higher standards for conversation, thus reflecting a bias towards upholding constructive dialogue at all costs."
23144069,"This annotator demonstrates a strong inclination towards articulating their arguments with a sense of reasoned critique, often addressing political and societal topics. They exhibit a preference for rational discourse, as evidenced by their labeling of commentary as healthy despite potential contention, suggesting a tolerance for differing viewpoints as long as the dialogue remains respectful. This annotator appears to value clarity and factuality in discussions, often challenging perceived misconceptions without resorting to hostile or sarcastic language, highlighting a belief in constructive debate. Their annotations reveal a tendency to avoid unnecessary negativity, focusing on promoting healthier conversation avenues by emphasizing respectful disagreement and acknowledgment of opposing views. This suggests an inclination to foster understanding rather than incite conflict, reflecting a moderate and open-minded attitude towards discourse."
23510133,"This annotator shows a strong inclination towards providing critical, often sarcastic commentary on what they perceive as misinformation or uninformed opinions within various discussions. They tend to classify content that includes sarcasm and dismissiveness as unhealthy, indicating a low tolerance for what they consider insincere or misleading dialogues. Their interpretations suggest an analytical mindset that values clarity and factual correctness in discourse. Conversely, they are more lenient towards posts deemed healthy that align with their perspective, often supporting views that challenge mainstream narratives or express skepticism about popular opinions.

Underlying their annotations is a pronounced anti-establishment sentiment, as illustrated by their frequent critique of mainstream media and authority figures, including professionals. Their labeling suggests they feel compelled to challenge narratives they find unconvincing or biased, favoring engagements that provoke thought rather than simply affirming popular views.

Overall, they exhibit a combative yet reflective style, often employing humor as a form of critique, making them a distinctive annotator who thrives in environments where discourse is passionate and sometimes contentious."
23583649,"This annotator demonstrates a strong inclination towards critical evaluation and intellectualism, often siding with arguments that resonate with their beliefs. They tend to view conversations through a lens of heightened scrutiny, suggesting a predisposition to challenge opinions they perceive as flawed or uninformed. The annotator appears to possess a skeptical stance towards viewpoints they find lacking evidence or rationale, as illustrated by their labeling of derogatory comments as unhealthy. Their examples often showcase a sharp wit, indicated by frequent use of sarcasm and biting remarks, reflecting a personality that may favor humor as a tool of critique. This inclination towards sarcasm hints at a potential preference for discussions that challenge the status quo, indicating they may value strong, reasoned discourse while dismissing comments that lack substance or respect. Overall, this annotator can be characterized as someone who prioritizes intelligence in dialogue and is quick to flag interactions that fall short of their standard for healthy conversation."
25129674,"This annotator demonstrates a penchant for incisive critique, often highlighting perceived absurdities or flaws in arguments within discussions. Their annotations indicate a clear inclination towards fostering healthy dialogue, paradoxically marked by a keen awareness of the boundaries between constructive criticism and unhealthy exchanges. They seem to prioritize clarity and logical reasoning over emotional expression, often labeling responses as healthy despite their underlying sarcasm or veiled critique, suggesting an analytical approach to conversations. This perspective carries an inherent bias towards reasoned discourse, implying the annotator values rational engagement over emotional appeals. While they recognize the potential for sarcasm, their interpretations indicate a belief in the democratic exchange of ideas rather than purely dismissing content as hostile. Overall, this annotator appears to navigate discussions with a level of skepticism towards excessive emotionality, favoring a balanced assessment that encourages constructive conversation."
25278366,"This annotator exhibits a strong inclination towards labeling conversations as healthy, suggesting a preference for constructive communication and an aversion to hostility or negativity. Their annotations indicate a meticulous approach to interpreting comments, often seeking to identify subtle nuances that could reflect a dismissive or sarcastic undertone. However, they predominantly classify comments as healthy, which may reflect a tendency to overlook or downplay sarcasm or potential hostility in favor of a more optimistic interpretation. This suggests a belief in the value of open dialogue and understanding, possibly indicating that they prefer to engage with content that fosters rather than stifles debate. The annotator may also possess a sense of humor, evidenced by annotations involving sarcasm, yet they frame this humor within a broader context of maintaining a positive conversational atmosphere. Overall, this annotator seems to champion balanced discourse and may have a personal bias towards optimism and respectful engagement."
25408325,"This annotator displays a critical and often confrontational perspective when evaluating comments. They seem to have a keen eye for recognizing sarcasm and hostility, often labeling comments that contain a hint of mockery or insult as unhealthy. With a tendency to view discussions through a lens of skepticism, they appear inclined to call out inconsistency and perceived ignorance in others' statements, indicating a strong opinionated nature.

The annotator frequently identifies comments that undermine others through derogatory comparisons or outright hostility. Their classification decisions suggest that they prioritize an atmosphere of respect and constructive dialogue, as seen by their inclination to mark jarring or demeaning rhetoric as unhealthy. While acknowledging some possibly healthy comments, they often juxtapose these against more aggressive or dismissive remarks, showing a tendency to focus on adverse commentary.

Overall, the annotator appears to advocate for a thoughtful and respectful conversation climate, demonstrating a clear aversion to negativity and unwarranted aggression. Their annotations suggest a belief that communication should be aimed at fostering understanding rather than attacking or belittling others. This profile hints at an individual who values dialogical integrity and respects varying perspectives, advocating for productive discourse while vocally opposing fallacies or harmful statements."
25658839,"This annotator showcases a keen awareness of conversational dynamics, distinctively identifying unhealthy dialogue characterized by overt hostility and sarcasm. Their labeling reveals a propensity to label comments as unhealthy when they perceive condescension, hostility, or cultural insensitivity. A striking feature of this annotator is their sensitivity to the subtleties in sarcasm, indicating a preference for direct and constructive communication over ambiguous or mocking remarks. They appear to value positivity in discussions, gravitating towards comments that maintain a respectful tone, even when criticism is warranted. This reflects an underlying belief in the importance of civility in public discourse. The annotator likely possesses strong opinions about social and political issues, often reflecting critical and possibly progressive viewpoints, where they emphasize fairness and inclusivity in conversations. Overall, their perspective indicates a commitment to fostering healthier online interactions."
26024737,"An insightful and discerning individual, this annotator demonstrates a preference for constructive dialogue and a deep respect for differing viewpoints. Their annotations reflect a belief in healthy discourse, as evidenced by a high agreement with the label of healthy in diverse contexts. They possess a keen sensitivity towards language, often discerning subtle undertones of condescension, sarcasm, or hostility, yet seem inclined to label submissions as healthy unless there is clear evidence of unhealthy traits. Their interpretations suggest that they value rational debate and logical discourse, and they likely approach discussions with an open mind but a critical eye, emphasizing civility and respect over vitriol. The annotator's inclination to highlight healthy comments suggests they may be motivated by a desire to foster positive communication rather than merely critique or condemn. Overall, this individual appears to champion a standard for conversation that promotes respect, thoughtful engagement, and a rejection of hostility."
26957039,"This annotator appears to have a critical and confrontational perspective when engaging with online discourse. Their annotations predominantly classify comments as unhealthy, as evidenced by their consistently labeling a majority of examples as unhealthy, with many carrying hostile and sarcastic overtones. They seem to emphasize the negative attributes of conversations, often interpreting comments as cynical, dismissive, or intentionally provocative. This perspective suggests that the annotator may possess a strong inclination towards identifying content that undermines constructive dialogue. Furthermore, their annotations reveal a tendency to see a lack of respect or empathy in responses, suggesting a low tolerance for what they perceive as irrational or disingenuous remarks. Overall, this annotator's focus on identifying hostility and sarcasm in discussions indicates a profound concern for the quality and health of conversations in online spaces. They likely value respectful communication and may themselves be critical of behaviors that foster division or disrespect."
27504414,"This annotator demonstrates a keen skepticism towards public figures and their actions, often expressing a critical viewpoint. Their annotations reflect a tendency to identify and flag content that appears hostile, indicating a low tolerance for aggressive or disrespectful discourse. The annotator's labels suggest that they value civil conversation and may favor comments that engage thoughtfully with issues rather than resorting to personal attacks or sarcasm. Their inclination to label statements as unhealthy appears to stem from a desire for constructive dialogue rather than divisive rhetoric. Furthermore, the annotator shows an interest in political and social issues, often referencing political figures and events in a critical light. Overall, this profile reveals an individual who prioritizes healthy discourse and is quick to challenge content that deviates from that standard."
27748798,"This annotator exhibits a nuanced understanding of conversation dynamics, particularly in distinguishing between healthy and unhealthy exchanges. They seem to approach dialogues with a critical lens, often identifying sarcasm and hostility as key indicators of unhealthy interactions. Their annotations suggest a strong stance against provocative or dismissive comments, reflecting a preference for constructive discourse. The annotator appears to favor clear, respectful communication, as indicated by their frequent classification of seemingly innocuous or supportive comments as healthy, while simultaneously flagging sarcastic or derogatory remarks as unhealthy. This emphasis suggests a bias towards promoting positivity and discouraging negativity in conversations. Their profile hints at a personality that values open-mindedness and constructive criticism, likely shaped by an awareness of the broader context of social interactions. They seem to be well-informed about social issues, as their annotations often reflect significant political and social commentary, indicating an engagement with contemporary discourse around cultural and social justice issues."
28521374,"This annotator exhibits a distinct inclination towards recognizing and labeling negative or unhealthy interactions. They demonstrate a strong sensitivity to hostile language, often categorizing comments as unhealthy when they exhibit direct insults or sarcastic undertones. The annotator seems to be particularly attuned to the nuances of communication, especially the use of sarcasm, which they consistently identify as an unhealthy component in conversations, possibly reflecting their personal disdain for insincerity or masking of true sentiments. This perspective suggests a personality that values straightforwardness and authenticity in discourse, indicating a preference for respectful and constructive conversations over confrontational or dismissive remarks. Overall, this annotator's profile suggests they may prioritize emotional honesty and dislike when people engage in negative behavior that damages productive discussion."
28524232,"This annotator displays a critical and often confrontational perspective when analyzing online conversations. They tend to label a substantial amount of comments as unhealthy, particularly those containing overt hostility or sarcasm. The annotator shows a pronounced sensitivity to comments that could be interpreted as derogatory, dismissive, or mocking, indicating a preference for constructive and respectful dialogue. Their annotations suggest a strong interest in maintaining decorum in discussions, as evidenced by their rejection of comments that display antagonism or provoke conflict.

Moreover, this annotator appears to balance their critical lens with moments of empathetic engagement, as seen in instances where they acknowledge healthier interactions. They may possess a nuanced understanding of communication dynamics, striving to promote positive discourse while simultaneously calling out negativity. This suggests they value honesty and directness but may be quick to label remarks that come off as aggressive or condescending. Overall, their annotations reflect a commitment to fostering understanding in conversations, though they may have a low tolerance for sarcasm and hostility."
28810858,"This annotator exhibits a critical and often confrontational perspective when evaluating comments. They frequently identify remarks that are accusatory or derogatory, indicating a tendency to engage with discussions that challenge mainstream viewpoints or provoke reaction. A clear inclination towards skepticism is observed, as seen in the labeling of sarcastic or dismissive comments. The annotator demonstrates a preference for identifying veracity and accountability in discourse, often labeling content rooted in anger or hostility as unhealthy. Their analysis seems to reflect a personal belief in challenging what they perceive as ignorance or injustice in societal discussions, making them less tolerant of comments they deem uninformed. This mindset suggests that they value rigor in dialogue and express a strong inclination to seek depth in conversation, favoring healthy debate over superficial exchanges."
