annotator_id,profile
label_F_10,"This annotator exhibits a tendency towards extreme intolerance for any behaviors or identities they perceive as different or non-conforming. Their labeling of content often reflects a personal bias against LGBTQ+ individuals, as indicated by their repeated classification of derogatory comments aimed at queer individuals as hateful. They may be influenced by cultural and social narratives prevalent in their environment, particularly those associated with certain regions. Their labeling suggests a strict and no-nonsense attitude towards what they consider as unacceptable speech, demonstrating a possibly rigid and judgmental perspective on social issues. Overall, this annotator likely possesses a confrontational disposition and a desire for conformity in social norms, which informs their labeling process."
label_F_11,"This annotator shows a cautious approach to labeling, displaying an awareness of the nuances inherent in hate speech. They appear sensitive to the context of expressions, as their classifications reflect a distinction between outright hateful texts and those expressing frustration or anger without crossing the line to hatefulness. Their tendency to consider the intention behind the words suggests a more empathetic and reflective personality, valuing meaningful discourse rather than mere compliance to labeling rules. Their profile indicates someone who navigates controversial topics with care, indicating a commitment to fairness in their judgments, although perhaps at times leading to a struggle between personal conviction and the necessity of strict adherence to binary classification."
label_F_14,"This annotator demonstrates a clear alignment with progressive values and social justice issues, indicating strong advocacy for marginalized groups within their labeling choices. Their engagement with content often reflects a desire to challenge discriminatory narratives actively. They may be influenced by personal experiences or awareness of societal injustices, which drives them to recognize hate speech swiftly. Their interpretations reflect a certain assertiveness in condemning harmful rhetoric while striving for better representation and validation of diverse identities. This perspective indicates a strong moral compass that shapes their responses to hate speech, and they likely value inclusivity and equality as core tenets."
label_F_15,"This annotator appears to approach labeling from a humorous standpoint, as evidenced by their tendency to classify edgy or outrageous comments as not inherently hateful. Their response seems to mirror a more irreverent attitude towards sensitive topics, possibly reflecting a belief that humor can serve as a filter for societal pressures. They embrace sarcasm and bravado in expressions, which may lead to a somewhat dismissive perspective regarding the severity of language deemed offensive or hateful. Overall, they likely prioritize individual expression and personal agency, valuing the right to offend or provoke as facets of free speech."
label_F_16,"This annotator encapsulates a strongly conservative viewpoint in their labeling, often aligning with traditional values and expressing skepticism towards content that challenges established societal norms. They seem to categorize expressions that confront or criticize such beliefs as hatefully aggressive, possibly stemming from a defensive approach to identity and culture. Their classifications suggest a priority on upholding conventional standards of interaction, revealing an inclination toward categorizing speech that diverges from their personal beliefs as harmful. This profile reflects a cautious, perhaps reactionary stance concerning any discourse perceived as threatening to their worldview."
label_F_17,"Observations from this annotator reveal a commitment to thorough analysis in labeling, as they often favor a more reasoned and scholarly perspective on hate speech. They show a tendency to contextualize language and recognize that not all offensive language equates to hate speech, favoring assessments based on the broader implications and repercussions of the speech. This suggests a complex understanding of language as a tool for both expression and harm. Their profile indicates a philosopher's engagement with the material, prioritizing clarity in the face of subjective interpretations of harm, along with a desire for discourse that fosters awareness rather than division."
label_F_18,"This annotator's profile reflects a strong engagement with activism, emphasizing a commitment to addressing and combating matters of social injustice. They label text as hateful when it infringes upon the dignity and recognition of marginalized groups. Their assertiveness in labeling likely stems from personal experiences that resonate deeply with issues of oppression. This belief translates into a labeling practice that prioritizes the impacts of speech on community and collective identity, showcasing an empathetic understanding of the broader social fabric. They likely value collaboration and unity in combating hate, underscoring the importance of solidarity in their perspective."
label_F_19,"This annotator portrays a highly analytical and methodical approach to labeling, showing a clear distinction between direct hateful rhetoric and speech that might be deemed objectionable but requires deeper scrutiny. They often engage critically with content, dissecting language in a way that suggests a focus on the intersectionality of various societal issues at play. This suggests they value informed discussion and the contextual basis of statements over impulsive classification. Their profile reflects a balanced yet firm stance where they can recognize potential harm without labeling it hastily as hate speech, indicating maturity in understanding complex social dynamics."
label_F_20,"This annotator displays a heavier reliance on instinctual interpretations in labeling, often correlating personal emotional responses to texts with the decisions made regarding their classification. They exhibit a greater tendency to label content as hateful based on gut feelings rather than established thresholds of what constitutes hate speech. This method reflects a more visceral understanding of language's impact but may lead to subjective biases influencing the categorization process. Their profile leans towards valuing emotional truths over intellectual analysis, which can create tensions with established norms around classification."
label_F_9,"This annotator appears to have a very strict and absolute viewpoint when it comes to labeling hate speech, often approaching each piece of content with a rigid set of criteria for classification. They tend to align speech that challenges societal conventions or expresses dissent as entirely unacceptable, indicating a strong inclination towards protectionism and conservative values. Their labeling approach paints a picture of someone who may favor social order and a clear demarcation of acceptable discourse. Overall, their perspective yields a profile prioritizing conformity over nuance, often resulting in an inclination to dismiss divergent viewpoints."
label_M_1,"This annotator presents a perspective of exploration when it comes to hate speech, frequently engaging with the complexities of social interactions present in the texts they evaluate. They display an understanding that hate speech can manifest in various subtle and overt forms, often reflecting a desire to understand motivations behind language use. Their classifications show they approach the topic with curiosity rather than solely reaction, indicating an openness to dialogue about contentious issues. The resulting profile illustrates a thoughtful individual who values conversation as a tool for change."
label_M_12,"This annotator shows a tendency towards leniency in their labeling practices, often approaching texts with an understanding that harsh language does not always equate to hatefulness. They might possess insights into the creative or expressive qualities of language, which leads them to differentiate between informal and potentially hurtful speech versus overtly hateful rhetoric. Their profile suggests an individual who espouses a more liberal understanding of free speech and is interested in finding common ground rather than division within language use."
label_M_13,"This annotator exhibits a critical perspective that grapples with the power dynamics inherent in language, leading to a pronounced awareness of how words affect marginalized communities. They tend to label hate speech with great seriousness, showcasing a commitment to defending the dignity of individuals under attack. Their profile reflects a sensitivity to social issues, coupled with an analytical mind geared toward discerning the nuances of verbal interactions. Overall, they appear deeply committed to social justice, advocating for responsible language use and the dismantling of oppressive narratives."
label_M_2,"This annotator reflects a perceptive and observant nature in their labeling, choosing to recognize broader contexts that inform interactions and expressions of hate speech. Their classifications suggest a notable depth of understanding about the motivations behind language and a willingness to confront uncomfortable truths about societal norms. This perspective often leads to a more compassionate interpretation of texts, where they strive to recognize both individual emotional experiences and the collective impact of rhetoric. Their profile presents someone who values reflection and contextualization within discussions of harm and language."
label_M_3,"This annotator appears to balance a firm stance against hate speech with an openness to the subjective nature of language use. They demonstrate an ability to recognize varying degrees of offensiveness while remaining alert to the potential consequences of normalizing certain expressions. Their labeling process suggests a thoughtful engagement, where they weigh context over rapid assessments. This profile reflects a conscientious individual who values fairness in assessing language and seeks to understand diverse perspectives without sacrificing their commitment to holding harmful speech accountable."
label_M_4,"This annotator reveals a tendency towards a stringent interpretation of the lines separating acceptable and unacceptable speech, often labeling material with rigid criteria. They exhibit a conservative approach that may limit the scope of acceptable discourse, potentially reflecting a stark personal conviction against any perceived threats to established social norms. Their classifications suggest an inclination toward protective oversight of community relations and may result in more frequent labeling of rhetoric as hateful, showcasing an apprehensive mindset towards radical expressions and behaviors."
label_M_5,"This annotator appears to approach the task of labeling with a mix of skepticism and analytical rigor, often wrestling with complex expressions that straddle the line between offense and hatefulness. They seem to emphasize the importance of intent behind speech and the context in which it exists, suggesting a nuanced perspective on the gray areas present within contentious discourse. Their profile reflects an interest in fostering understanding and accountability rather than resorting to quick judgments, positioning them as potentially empathetic yet carefully critical."
label_M_6,"This annotator expresses a vibrant and spirited view towards language, often emphasizing creativity and expression rather than fear of offense. They tend to label texts with a mindset that champions individuality and personal expression, suggesting they may treat edgy language as a mere canvas for art rather than a vehicle for hate. Their profile conveys an inclination to embrace freedom of expression, reflecting a belief that language is ultimately a tool for creativity that should not be heavily policed."
label_M_7,"This annotator showcases a distinctive blend of sensitivity alongside assertiveness in their labeling, likely driven by personal and emotional connections to discussions around hate speech. They approach the classification with care but lean towards a perspective that resonates on a human level, often opting to categorize expressions based on their emotional weight and potential for causing distress. Their profile indicates a strong commitment to understanding and appreciating the depth of language as it influences social relationships."
label_M_8,"This annotator displays a confrontational approach to labeling, often aggressively critiquing language they perceive as weak or subpar. They exhibit a reluctance to engage with softer expressions and emphasize a cut-and-dry interpretation of hate speech. Their profile suggests an individual who values strength and directness in communication, potentially reflecting cultural influences around merit-based evaluations in language use. They may prioritize subjective interpretations of power dynamics and use harsh classification methods as a form of cultural critique."
