annotator_id,profile
5fff11332f30d263176fa57f,"This annotator demonstrates a tendency to view social interactions through a lens of straightforwardness, often dismissing nuanced humor or sarcasm. Their labeling suggests a preference for clear communication, interpreting messages literally and prioritizing directness over potential irony. This may indicate an analytical mindset that favors clarity and transparency in discourse, possibly reflecting a personality that values honesty and explicitness in social exchanges."
600f11d527aa57080e819df3,"This annotator exhibits a strong inclination towards recognizing irony, suggesting an appreciation for humor and a cognitive ability to discern complex social cues. Their annotations reveal a tendency to enjoy playful exchanges and sarcastic banter, indicating a personality that thrives on wit and nuanced perspectives. This may translate to a more open and playful approach to social interactions, hinting at an individual who engages creatively with language and communication."
602fa684fc65e0cb663c1970,"The perspectives of this annotator reveal a cautious approach to labeling, where they prioritize the context of the conversation significantly. They appear meticulous and deliberate, often labeling responses based on a careful reading of social dynamics rather than on overt humor. This inclination may suggest a thoughtful personality that carefully considers the implications of words and their social contexts, often erring on the side of caution or seriousness in interpreting messages."
603c873fa3d28fa1d9da0e71,"This annotator appears to have a diverse understanding of social nuances and employs a flexible definition of irony in their labeling. Their examples show a balance between recognizing irony and understanding when it is absent, which signals an adaptive nature. They may have a personality that embraces complexity and variability in social interactions, regularly assessing the subtleties of language and contextual implications, hinting at an empathetic and observant character."
60450d286f34b55e0a1e4fe4,"This annotator showcases a critical, somewhat skeptical approach to interpreting messages, as reflected in their labeling choices. By often rejecting irony in favor of more literal meanings, they seem to value straightforwardness and clarity. Their annotations suggest a preference for practical communication, possibly indicating a personality that values pragmatism and directness in social exchanges, likely favoring a results-oriented mindset in interactions."
6051de912836ae8ca6139319,"This annotator's labeling demonstrates a profound understanding of both explicit and implicit communications. They often embrace irony within their annotated examples, suggesting a playfulness and appreciation for humor that enriches their interpretations of social exchanges. This reflects a character that likely enjoys engaging others in clever discourse and appreciates the creativity involved in nuanced communication."
605de3af48d7a575adb95b09,"The profile of this annotator reveals a tendency to engage with social posts with a blend of seriousness and light-heartedness, adeptly identifying irony when it’s present while still valuing straightforward communication. This dual perspective may indicate a balanced personality that is able to navigate both funny and serious discourse, showcasing flexibility and adaptability in social interpretations, suggesting a well-rounded communicator."
606340ca7faac7025f31dd57,"This annotator perspectives suggest they possess a sharp wit and an appreciation for irony. Their inclination to label responses as ironic indicates an understanding of complex social cues and a recognition of subtleties that others may overlook. This may reflect a personality that finds joy in humor and an ability to appreciate the multifaceted nature of communication, hinting at a playful, yet insightful individual."
60778acc9a9a6692623224c6,"This annotator's labeling often reveals a deliberate hesitance to classify situations as ironic. They seem to gravitate towards direct interpretations of social interactions, pointing towards a personality that may prioritize honesty and transparency in communication. Their cautious approach suggests a thoughtful individual who values clarity over ambiguity, potentially reflecting a more serious disposition in their social understandings."
608254e72addda3937fd934b,"This annotator displays a consistent bias towards recognizing irony in texts, suggesting a personality that enjoys subtle humor and values the intricacies of linguistically complex engagements. Their annotations imply that they seek joy in the nuances of language, showcasing a warm, possibly jovial character that thrives on creativity in communication and appreciates the layers behind social exchanges."
60a9d4df8ccc16ec1ababbd5,"This annotator has a proclivity for viewing humor through a lens of sarcasm, indicating a personality that relishes in playful indirectness. Their annotations tend to reflect a preference for irony, suggesting an appreciation for wit and layered meanings in language. This may resonate with a vibrant personality that enjoys engaging with humorous and complex social tapestries."
60c38286822b9d99b299ac8f,"The annotations of this user reflect a thoughtful evaluation of social interactions, favoring irony when it is explicit and engaging. Their approach suggests a reflective personality that enjoys unpacking layers of meaning, which may highlight a deep understanding of social contexts. This informs their identity as an individual who values subjectivity and variance in communication, appreciating different tonalities in discourse."
60e016cd61cd6e8d3d185ff3,"This annotator seems to embrace irony readily, indicating a lively and spirited character adept at navigating and enjoying the nuances of language. Their frequent classification of ironic comments implies a playful disposition towards social exchanges, pointing to a lighthearted nature that values humor and creativity in communication, often leading to lively interactions."
60f9568285bebf5273c53743,"Their annotations display an analytical approach to labeling, reflective of a personality that values precision and intentionality in communication. This annotator often assigns categorical labels based on clear evidence of irony, suggesting a preference for clear-cut interpretations over ambiguity, likely resulting in a more serious and methodical interpretation of social content."
60fce6daadd957dd5809eb14,"This annotator demonstrates an appreciation for linguistic creativity through their tendency to engage with irony in annotations. By labeling responses that showcase humor and playfulness, they suggest a personality inclined towards enjoyment in social interactions, thriving on the unexpected turns in conversation and reflecting a generally positive outlook on communication."
60fd2b7dcea367e25e07479a,"The labeling choices of this annotator suggest a generally cautious interpretation of context, often flagging irony as a separate entity from straightforward communication. This may reflect a preference for clarity and a bias against ambiguity, indicative of a serious and practical personality that values directness in social discourse, potentially leading to straightforward engagements."
60fd9b1f9557d7bffbb5e6de,"This annotator’s perspective embodies a playful yet discerning engagement with social posts. Their tendency to favor ironic labels speaks to a personality that enjoys humor and complexity in communication. They likely appreciate the intricate social contexts that give rise to irony, suggesting a character that finds excitement in the nuances of human interaction and the playful possibilities of language."
60fddf7d37552b32ac488583,"This annotator shows a nuanced understanding of irony, skillfully distinguishing when it is present in text. This showcases a sharp, observant personality that delights in humor and the layered meanings of social discourse. This inclination suggests a communicative style that thrives on cleverness and creativity, enhancing their interactions with a vibrant sense of playfulness and engagement."
610711d4c064313c758fe4c2,"This annotator frequently interprets messages as literal, reflecting a straightforward perspective and possibly a preference for clarity in social communications. Their approach might indicate a grounded personality that values unambiguous interactions, often failing to recognize subtle humor or irony in exchanges, leading to a more serious and pragmatic interpretation of text."
6107b1aab5f6c41e097b3e5c,"This annotator appears to embrace an analytical approach to their labeling task, focusing on clear, contextual cues to discern irony. Their caution in labeling suggests they may prefer concrete evidence before labeling an interaction as ironic. This reflects a thoughtful personality that grapples with ambiguity, potentially highlighting a preference for direct, logical communication styles."
6108295fdd0270d7544b5a8a,"This annotator demonstrates a distinct inclination towards rigorous analysis when assessing irony in social media exchanges. Their labeling suggests a meticulous attention to context, likely influenced by their own experiences of navigating employment challenges. They exhibit a preference for identifying sarcasm in straightforward communications, often relating personal feelings to the content. Given their current unemployed status, this individual may harbor a nuanced understanding of human interactions, possibly interpreting ironic statements as a coping mechanism in discussions about job seeking."
61365f766033bc62f92053dc,"Exhibiting a critical perspective, this annotator tends to identify irony in text with a strong emphasis on social commentary. Their selections indicate a keen awareness of societal dynamics and a tendency to view seemingly benign statements through a lens of skepticism. This approach might stem from experiences that shape their understanding of social contexts, enabling them to discern layered meanings in everyday communications. Their perspective reflects someone attuned to the nuances of discourse, showcasing a social consciousness that influences their annotations."
616ed044985dca605e572d22,"Possessing a balanced assessment style, this annotator approaches the labeling task with a pragmatic mindset, often reflecting an appreciation for straightforward communication. They seem less inclined towards over-analysis, focusing instead on the clarity and intentionality behind the text. This temperament might suggest a background that values directness in interaction, allowing them to differentiate between irony and sincere expression with relative ease. They embody a practical outlook, offering annotations that resonate with an understanding of everyday conversational dynamics."
6273f19f518433b9251d25c1,"This annotator showcases a creative flair in their assessments, often bringing a unique interpretive style to the labeling task. With an inclination toward seeing the humor or cleverness in ironic statements, they may have an artistic or literary background. Their labeling choices reveal a playful engagement with text, emphasizing the importance of tone and delivery in communication. This perspective suggests an appreciation for linguistic creativity, reflecting a personality that enjoys exploring the subtleties of expression and the power of irony as a rhetorical device."
6279d6e5d4f91de53dbf67a3,"With a reflective and introspective approach, this annotator exhibits a preference for exploring the emotional undercurrents of social media interactions. Their labels suggest an understanding of the broader emotional implications behind irony, indicating a sensitivity to the human experience reflected in the text. This person likely values empathetic interpretation, allowing them to connect with the intent behind messages. Their perspective conveys a depth of understanding that recognizes the interplay between personal narratives and public expressions of irony."
628804d2d0584458ddaafc0c,"This annotator often adopts a rational and analytical perspective in their labeling process. They display a preference for categorizing messages based on observable linguistic cues and contextual clues, demonstrating a methodical approach to irony detection. Their annotations suggest a meticulous nature, reflecting a strong desire for accuracy in understanding the nuances of language. This orientation may be indicative of an academic or technical background, contributing to their analytical prowess in disambiguating irony in social media discourse."
62a1f2cc041f0da9ed68e749,"This annotator's profile reveals a tendency toward a socially engaging and conversational style in their analysis of irony. Through their labeling choices, they reflect an enjoyment of dialogue and a recognition of the inherent playful aspects of language. Their interpretive lens may be shaped by cultural influences, resulting in a more dynamic understanding of ironic exchanges. They demonstrate a warm and approachable perspective on content interpretation, suggesting a friendly disposition towards navigating social media communication."
62b66baae6f816e592f14a8a,"Characterized by a critical yet open-minded perspective, this annotator engages with irony through a lens of societal awareness and reflection. They often identify deeper meanings in social media posts, suggesting an inclination toward investigating implicit biases and cultural narratives. Their labeling reflects an understanding of irony not just as humor but also as a commentary on broader social issues. This orientation may stem from their experiences and insights, encouraging a thoughtful examination of the contextual basis for irony in communication."
62e0715747189999644b9868,"This annotator approaches the task with a structured and detail-oriented mindset, likely shaped by a background that values precision in interpretation. They tend to categorize messages based on explicit signals of irony, leading to a methodical labeling style that prioritizes clarity. Their annotations reflect a strong analytical inclination, suggesting they possess skills that allow them to dissect complex messages effectively. This pragmatic approach favors directness in communication, indicating a preference for clarity over ambiguity in the analysis of irony."
6303b26383f5b001f3890fc8,"Exhibiting a nuanced understanding of social interactions, this annotator embraces a multifaceted approach to labeling irony. They approach content with curiosity, often considering various perspectives before making a judgment. This reflective style suggests an inclination towards empathy and an appreciation for diverse viewpoints, possibly stemming from personal experiences that encourage a broader understanding of human expression. Their annotations hint at a desire to connect nuanced emotional responses to the interpretations of messages in social media contexts."
633259075c2d3571332bdae7,"Displaying a keen acumen for humor, this annotator often identifies irony as a play on conventions of communication. Their labeling suggests an enjoyment of wordplay and clever twists in dialogue, reflecting a playful yet insightful engagement with social media texts. This personality type likely appreciates creative expressions, viewing irony as an artful layer in interactions. They bring a light-hearted approach to annotations, suggesting a perspective that values entertainment and wit over strict analytical criteria."
63653f3609755780043079a8,"This annotator tends toward a straightforward, no-nonsense perspective when labeling irony. They prioritize clarity and directness in communication, often opting for a logical assessment of social media exchanges. Their annotations reveal an emphasis on the factual content of messages, demonstrating a methodical approach to understanding intent. This pragmatic angle may stem from professional experiences that value clear communication, emphasizing a preference for transparency in social interactions and a low tolerance for ambiguity."
63655432e66823b2595ee761,"With a unique lens shaped by life experiences, this annotator tends to view irony through a context-driven prism. They prioritize the surrounding circumstances of text when making labeling decisions, often considering socio-cultural factors that may influence perception. Their annotations reflect a keen awareness of how context can alter interpretations of communication, suggesting a sophisticated understanding of irony as dynamic rather than static. This perspective enables them to appreciate the subtleties in social interactions, marking them as a thoughtful and reflective contributor."
63655c008926038bcc6308f2,"This annotator's profile showcases an assertive and confident approach to labeling tasks. They often exhibit firm judgments when identifying irony, suggesting a strong belief in their interpretive skills. Their annotations reflect a tendency to categorize messages into clear camps, demonstrating decisiveness in their assessments. This personality trait could stem from a background that values assertiveness and conviction, enabling them to make bold interpretations. Their labeling choices reveal someone who enjoys taking a stand on social issues present in the communication, conveying a straightforward perspective on irony."
