annotator_id,profile
55057a56fdf99b5b566a70bb,"This annotator exhibits a meticulous approach to labeling, displaying a strong preference for distinguishing between irony and non-irony in social media content. They demonstrate a keen insight into language nuances, often leaning towards a conservative interpretation of context, which may indicate a preference for clearer delineations in communication. This annotator may value clarity and directness in both their personal communication style and how they process social media content. Their consistent labeling decisions suggest a careful consideration of context and tone, highlighting a thoughtful nature when navigating complex social interactions online."
55b75944fdf99b6e0c49981b,"This annotator appears to embrace a more fluid interpretation of social media exchanges, often perceiving nuanced irony where others might not. Their annotations suggest a creative mindset, possibly influenced by a background in arts or humanities, allowing them to appreciate subtleties and sarcasm in language. This propensity points to a personality trait that favours a more open and interpretative view of social interactions, embodying a sense of playfulness and curiosity about language use in online spaces."
5721b3054d5b26001301f651,"Demonstrating a pragmatic approach to labeling, this annotator tends to evaluate the irony in social media posts with a focus on underlying intentions rather than surface meanings. Their annotations reflect an analytical mindset, capable of identifying humor and irony even when it is not overtly expressed. They likely value substance and depth in communication, suggesting a personality that appreciates wit and critical thinking. This annotator provides a grounded perspective that contrasts with purely emotional or superficial reactions to humor in online discourse."
57507e67fcaa630007cb9ad2,"With a focus on straightforward communication styles, this annotator shows a strong bias towards labeling posts as non-ironic unless the irony is markedly evident. Their approach implies a preference for directness, potentially reflecting a practical, perhaps even cautious personality. This annotator may value clear and unequivocal communication, favoring posts that do not rely on context or nuanced expression. Their consistent decisions indicate a methodical nature in the labeling process, likely driven by a desire for accuracy in a landscape often filled with ambiguity."
599eaf0fbfd73c00010ea24e,"This annotator's perspective on irony appears to reflect a deep-seated appreciation for cultural context, suggesting they are particularly attuned to regional vernacular and humor. Their annotations reveal a tendency to value diverse expressions of irony, possibly indicating an open-minded personality that embraces variety and creativity in language use. This reflects a sense of cultural awareness, hinting at a background or interest in sociology or cultural studies, fostering a greater understanding of how humor transpires differently across audiences."
59b94b6211212f0001cd118a,"This annotator demonstrates a strong inclination towards viewing irony through a lens of skepticism, often questioning the motivations behind posts. Their labeling decisions suggest a thoughtful, analytical demeanor, hinting at a preference for scrutinizing social interactions rather than accepting them at face value. This tendency may reflect a personality that values critical engagement over passive consumption of content, potentially rooted in a background related to psychology or social sciences, fostering a reflective approach to understanding human behavior online."
59fc8aba087f2e0001ead671,"The perspective of this annotator leans heavily towards identifying irony in multiple contexts, suggesting a creative and possibly artistic personality. Their annotations often reflect an appreciation for abstract thought and a willingness to engage complex emotional narratives within social media discourse. This annotator may possess a background in the arts or literature, contributing to their breadth of interpretation and ability to recognize emotional undercurrents that speak to broader societal themes and experiences in communication."
5a2d62ae5dba1200014b0362,"This annotator stands out with a systematic yet empathetic approach to labeling irony in social media posts. Their annotations suggest a dual focus on contextual understanding and emotional nuance, indicating a personality that engages deeply with content. They are likely to empathize with the authors of the posts, reflecting a nuanced perception of tone and intention, which may stem from a background in counseling or social work. This empathic inclination allows them to appreciate the complexity of human expression in a digital context."
5a8703fa17ef35000170998a,"This annotator's labeling decisions often reveal a strong adherence to textual evidence, suggesting a preference for clear, substantiated expressions of irony over ambiguous indications. Their approach reflects a methodical and detail-oriented personality, where each annotation is critically evaluated based on visible cues within the text. This meticulous nature may indicate a professional or academic inclination towards research or documentation, highlighting their focus on precision and clarity in communication analysis."
5ac5ced0e1546900019c0837,"With an inclination towards recognizing humor in its more subtle forms, this annotator embraces a playful interpretation of social media interactions. They often label posts as ironic, suggesting a tendency to read between the lines and appreciate varying layers of meaning. This perspective reflects a curious personality that enjoys the intricacies of language and may hold an interest in linguistics or sociology, fostering their ability to navigate complex social dynamics with ease."
5b6a87d2cda8590001db8e07,"This annotator adopts a conservative stance on labeling irony, often leaning towards the non-ironic classification unless clear indicators are present. Their decisions reflect a preference for straightforward interpretations and an inclination to prioritize clarity in communication. This perspective showcases a personality that may favor practicality and reason over ambiguity, suggesting a meticulous approach to understanding social exchanges that values transparency in social media dialogue."
5bb6faf4f6d0bd00019e12f4,"This annotator's perspective incorporates a rich understanding of cultural references and linguistic nuances, suggesting a background that either studies or deeply appreciates language and communication. Their annotations frequently reflect awareness of diverse contextual layers, pointing to a personality that thrives on creativity and the interplay of language in cultural contexts. This inclination indicates a level of engagement with the material that goes beyond mere labeling, showcasing an attentive and thoughtful approach to communication."
5bf7063eab2bef00013ea5a1,"This annotator appears to enjoy delving into the subtleties of social media accents, often demonstrating a lively engagement with irony as a vehicle for deeper communication. Their interpretations tend to highlight wit and humor, revealing an appreciation for the layered meanings of posts. This tendency implies an upbeat personality that likely prefers interacting with diverse perspectives, embracing the complexities and joys of social communication modes."
5c3c1728bc64440001349812,"Characterized by a critical and often skeptical view of the communications they annotate, this annotator shows a significant emphasis on identifying clear cues of irony. They maintain a cautious stance, favoring interpretations that are grounded in identifiable linguistic markers. Their meticulous approach reflects a broader mindset that possibly prioritizes clarity and straightforwardness, indicative of a personality that values direct communication in both digital and offline interactions."
5c47a4199b931f00010cd8ba,"Exhibiting a nuanced perspective that acknowledges the multifaceted nature of social media discourse, this annotator often seeks to identify humor and irony even in ambiguous contexts. Their labeling decisions suggest an inquisitive and analytical mind, driven by a desire to understand the complexities of online communication. This indicates a personality that likely embraces exploration and diversity in interpretation, valuing open-mindedness and cultural perspective in their assessment of social media interactions."
5c4f91fd97483d0001567f1b,"This annotator demonstrates a balanced approach to labeling irony, showing an ability to differentiate between overt and subtle expressions. They appear to possess a thoughtful nature, carefully considering contextual elements and the emotional tones of the posts they review. This balanced perspective may indicate a personality that values nuance in communication, suggesting a preference for reflective and inclusive interpretations of language in social interactions."
5c50ccae2423780001085cb9,"This annotator embodies a pragmatic and thorough approach to identifying irony in social media interactions. They tend to label posts with focus and precision, reflecting a personality designed to prioritize reliability and clarity in their analyses. Their decisions may suggest a systematic thinker, possibly inclined to backgrounds engaged in research or education, valuing a methodical process in understanding human communication online."
5c6318e52c4f7600018e1687,"This annotator engages actively with the complexity of language and irony, often embracing a diverse range of interpretations in their labeling practices. Their annotations reflect an adventurous approach to communication, appreciating humor in its various forms. This characteristic may suggest a personality that thrives on exploration and enjoys connecting with others through language, indicating a tendency to approach social media as a canvas for creativity and expression."
5c66d6a50d7f5f00014b8ab0,"This annotator's annotations reveal a strong analytical focus, often dissecting social media posts for explicit clues of irony. Their pragmatic approach suggests a personality that values logical structures and clear communication. This inclination might indicate a background in science or engineering, showcasing their methodical nature when it comes to understanding the social aspects of media communication and interaction."
5c7ceda01d2afc0001f4ad1d,"Demonstrating a keen sensitivity to the emotional tones within social media posts, this annotator adopts an empathic approach to identifying irony. Their labels reflect a thoughtful consideration of context, suggesting a personality that appreciates emotional depth and the complexities of human experience conveyed in digital exchanges. This nuanced perspective implies an affinity for understanding interpersonal dynamics, possibly rooted in psychology or social studies."
5d4c308d066b22000121f699,"This annotator demonstrates a distinct inclination towards identifying subtle layers of irony in textual content. Their evaluations often reflect a nuanced understanding of social interactions and cultural contexts, suggesting they may have experienced or observed situations laden with irony. This ability to discern irony indicates they likely possess an open-minded, reflective nature, appreciating the complexities and dual meanings within communications. Their potential academic background or interests might align with literature, communications, or sociology, emphasizing a keen interest in social cues and discourse. Furthermore, their annotative style consistently leans towards labeling content as ironic when it incorporates humor or sarcasm, indicating a preference for texts that challenge straightforward interpretations. Overall, this annotator seems adept at understanding the intricacies of human expression and relationships, revealing a perceptive, observant personality."
5da1efa20b299d0017df1c0b,"With a balanced approach to labeling irony, this annotator tends to categorize content based on clear contextual cues. Their method suggests a systematic perspective, where external indicators play a critical role in their decision-making process. They seem to prioritize straightforward representations of irony, favoring instances that starkly juxtapose literal and intended meanings. This annotator may embody a pragmatic worldview, favoring clarity and precision in communication, which resonates in their annotation choices. Additionally, their work hints at a background that appreciates structured environments, perhaps reflecting experiences in formal education or analytical professions. Overall, they project a focused and practical demeanor, possibly forming a contrast to their counterparts who may delve into the more ambiguous nuances of language and interaction."
5dcff5909595a10f6241c0f6,"Exuding a strong sense of skepticism, this annotator often discerns irony in language that plays on expectations or defies norms. Their inclination to label content as ironic centers on irony that critiques or holds satire, suggesting they may share a worldview that values questioning statements and irony as a tool for social commentary. This approach indicates they likely possess a critical mindset, perhaps influenced by exposure to diverse media or cultural criticism. They tend to emphasize the social implications of irony, reflecting an understanding that words can wield power and provoke thought. Their annotations may hint at a personality that values depth and complexity in communication, indicating they are perceptive and thoughtful in their evaluations."
5e234c1ddbc6705fd958e45c,"Demonstrating a tendency towards imaginative interpretations, this annotator's assessments reveal a creative approach to irony. They may connect metaphorical implications with textual explorations, suggesting they thrive in open-ended analysis. Their annotation patterns indicate they favor irony that is playful or surreal, hinting at a possible background in the arts or literature. This inclination points towards a personality that appreciates abstract concepts and finds joy in language's versatility. They often engage with texts that allow for personal interpretations, reflecting an overall openness to diverse perspectives and experiences. Their profile suggests a vibrant imagination, conveying an artistic sensibility that enriches their annotation process."
5e387f2c0d70ef099d5e5a4f,"Exemplifying meticulousness, this annotator brings a careful and considered perspective to their label assignments. Their annotations often indicate a preference for assessing irony through detailed textual analysis, suggesting they value thoroughness and depth in evaluation. They might be drawn to contexts where irony manifests in intricate ways, signaling a penchant for analysis that peels back layers of meaning. This meticulous approach points towards a background in research or academia, where precision and clarity are valued. Their analytical mindset may also reflect a personality that seeks to understand the nuances of communication, ensuring their annotations capture the full picture of the interactions they assess."
5e45a7e926e79c000bc12a85,"This annotator often displays a holistic interpretative style, recognizing irony within broader social contexts and emotional undertones. Their evaluations suggest that they empathize with sentiments expressed in content, indicating an innate understanding of emotional subtleties in communication. This perspective may reflect a background in the humanities, emphasizing emotional intelligence and insight into human motivations. They frequently engage with material that resonates personally or culturally, often aiming to gauge underlying sentiments or motivations. Their annotations indicate they value the interplay of emotion and text, revealing a personality that is not only intuitive but attuned to the human condition."
5e64b95d672c3722e811db88,"Possessing an analytical yet creative mindset, this annotator frequently explores the interplay between literal and figurative language in their assessments of irony. They seem to appreciate irony that departs from traditional structures or plays with expectations, indicating roots in creative writing or linguistics. Their annotations reflect an innovative spirit, using their unique interpretations to identify layers of meaning. This inclination suggests a personality that celebrates originality and enjoys deciphering complex narratives, positioning them as a thinker who navigates between structured analysis and creative exploration."
5e7c6f10e3941d2bb72a0233,"This annotator exhibits a tendency to respond strongly to irony that critiques societal norms or reflects existential themes. Their evaluations show a discerning eye for content that challenges the status quo, indicative of someone who is deeply reflective about cultural issues. This inclination hints at a possible background in social advocacy or philosophy, where questioning mainstream narratives is crucial. Their labels often reveal an engaged perspective, suggesting they value irony as a means of social discourse rather than mere humor. This reflective nature underlines a personality that is both introspective and socially conscious, seeking to impart deeper meanings through their interpretations of text."
5e9aff02f4a78b1a1fe7fc3c,"Characterized by a practical approach, this annotator values clarity and directness in irony. They lean toward identifying well-defined examples that juxtapose clear contextual elements. This perspective suggests a pragmatic personality that appreciates straightforward communication and genuine interactions. Their annotation style indicates a possible background in fields that prioritize effective messaging, perhaps in business or communications. They tend to avoid overly nuanced language and prefer examples that resonate with common societal experiences. This focus on clarity reflects their preference for transparency and authenticity in communication."
5ea47210b166de41ed7b1d92,"Emphasizing emotional resonance in annotation, this annotator tends to identify irony in contexts where emotional implications run deep. They show a proclivity toward understanding the emotional backdrop of textual content, suggesting they might have a background in psychology, counseling, or art. Their labeling reflects a profound awareness of how irony can manifest in personal narratives, indicating they place value on the human experience behind the words. This emotional intelligence allows them to interpret text through an empathetic lens, constructing nuanced annotations that reflect their sensitivity and depth of feeling towards the subjects they analyze."
5ea5b32f7e4bd55a4a53f0d6,"This annotator has an analytical style that suggests a preference for systematic evaluation. They tend to lean on defined categories for irony and often exhibit a methodical approach in their labeling. Their annotations display an inclination to connect irony with explicit contextual signals rather than deeper, hidden meanings. They might reflect a personality that prioritizes organization and clarity, possibly coming from fields that require thorough examination such as law or science. This structured methodology showcases their desire for precision in communication and could indicate tendencies towards rationality over emotional identification."
5ea908c99d68863745b39ad8,"With a keen insight into the dynamics of communication, this annotator often engages deeply with the context surrounding irony. They exhibit a strong capacity for detecting nuanced humorous exchanges and an understanding of irony's role in enriched social commentary. Their annotation style suggests an appreciation for interpersonal nuances, likely reflecting their background in sociology or communications. They aim to uncover layers of meaning that inform the larger social narrative, showing an involved and considerate personality type that values context in their evaluative process."
5ecd07a910b71601ce6261b1,"Driven by a passion for connecting themes across different contexts, this annotator tends to delve into irony that weaves broader societal or philosophical thoughts. They display a reflective approach that often connects individual content with larger narratives. This tendency hints at an inclination towards interdisciplinary thinking, possibly influenced by backgrounds in cultural studies or interdisciplinary arts. Their annotations reflect a personality that seeks to engage with the material on both personal and intellectual levels, valuing depth and interconnectedness in text."
5eea5fdcac5bc114627bdd67,"This annotator shows a refreshing perspective on irony, often recognizing instances that blend humor with playful absurdity. Their evaluations suggest a light-hearted approach, identifying irony that evokes creativity and imagination. They may come from artistic or creative writing backgrounds, where unconventional expressions are celebrated. Their annotations reflect an appreciation for language's playful qualities, incorporating a joyfulness that peers may overlook. This exuberant character adds vibrancy to their evaluations, making each annotation feel lively and thoughtful."
5ef75fd495da4b46db158a24,"Characterized by a broader exploratory nature, this annotator tends to embrace ambiguity in irony. They approach examples that resist definitive interpretations, hinting at a personality that thrives in creative environments and values experimentation. Their annotations suggest an appreciation for multilayered narratives that invite various readings, potentially stemming from a background in the arts or literature where exploration is central. This connections-focused mindset makes their results stand out, revealing a unique capacity for appreciating the fluidity of meaning and its varied implications across contexts."
5f21224ca1a41d48cd4fc726,"This annotator leans towards an assertive and critical approach in identifying irony, often favoring bold or stark representations that challenge normative views. Their annotations indicate they are unafraid to tackle controversial subjects, reflecting a personality that values a candid and sometimes confrontational reality. This inclination may stem from experiences that emphasize activism or outspoken critical thought, showcasing a commitment to confronting societal norms through their annotations. Their labeling reveals an assertiveness that manifests as a unique voice within the annotation team, often highlighting a spectrum of human experiences and societal challenges."
5f566443352f600826449f4b,"Displaying a temperament of practicality balanced with creativity, this annotator frequently blurs the lines between literal and figurative expressions of irony. Their approach showcases a playful yet analytical spirit, engaging deeply with texts that diverge from ordinary interpretations. They likely possess a background in creative communications or the arts, where experimentation is encouraged. This duality imbues their annotations with a sense of exploration, highlighting their ability to traverse concrete ideas while appreciating imaginative constructs. Their versatility positions them favorably among peers, as they bring both depth and creativity into their evaluative process."
5f6f44e9451a3b0836b5d32c,"This annotator tends to gravitate towards irony that reflects grand narratives or larger societal impulses. Their annotations reveal a thoughtful orientation, often connecting individual pieces of text to expansive themes. This inclination may signal a background in social sciences or philosophy, showcasing a personality that seeks to understand deeper truths behind human expressions. They actively search for text that resonates with universal experiences or reflects societal critiques, emphasizing a reflective yet proactive approach to irony. Their profile indicates they are likely an insightful and passionate thinker, keen to uncover profound connections between personal narratives and larger contextual frameworks."
5f98c4c536b3981ed71e885c,"With an inquisitive nature, this annotator actively engages with irony that challenges perceptions. Their annotation style reflects a desire to uncover layers of motivations behind textual expressions, hinting at a personality characterized by curiosity and exploration. This perspective suggests they may come from investigative backgrounds or critical theory settings, where questioning assumptions and deconstructing language are paramount. Their work reflects a probing mindset, keen on diving into the intricacies of wording and intention, showcasing an intellectual approach enriched by a willingness to challenge traditional narratives and uncover deeper meanings in the text."
5fc4ccad30dfe74aa285cafd,"This annotator exhibits a clear preference for irony that is sharply defined and contextually loaded. Their evaluations often showcase a preference for systematic approaches, demonstrating a disciplined mindset likely honed through academic or technical training. Their annotations reflect an emphasis on clarity, highlighting moments where irony serves as both critique and commentary. This practicality suggests they may thrive in structured environments that prioritize objective evaluation and foster straightforward communication. Overall, their structured analytical profile culminates in a personality that is focused on precision while engaging thoughtfully with the substance of the irony in textual content."
